id,conversation_id,created_at,date,time,timezone,user_id,username,name,place,tweet,language,mentions,urls,photos,replies_count,retweets_count,likes_count,hashtags,cashtags,link,retweet,quote_url,video,thumbnail,near,geo,source,user_rt_id,user_rt,retweet_id,reply_to,retweet_date,translate,trans_src,trans_dest
1215451002993856515,1215451002993856515,2020-01-09 21:51:15 Venezuela Standard Time,2020-01-09,21:51:15,-0400,216381984,gabosantana35,Gabriel Santana,,¡Vecino de Chacao!  Nos vemos mañana a las 6pm en la Plaza Los Palos Grandes. ¡Acompañemos a nuestros diputados y a nuestra Asamblea Nacional!  https://t.co/FbigUDoBjv,es,[],[],['https://pbs.twimg.com/media/EN4mO54VUAET4ZM.jpg'],0,7,7,[],[],https://twitter.com/gabosantana35/status/1215451002993856515,False,,1,https://pbs.twimg.com/media/EN4mO54VUAET4ZM.jpg,,,,,,,[],,,,
1214277018386345987,1214268304040366085,2020-01-06 16:06:16 Venezuela Standard Time,2020-01-06,16:06:16,-0400,216381984,gabosantana35,Gabriel Santana,,Atentos a esta información.  https://t.co/foyQcjOMhW,es,[],[],['https://pbs.twimg.com/media/ENn6geIX0AMwNAW.jpg'],0,1,1,[],[],https://twitter.com/gabosantana35/status/1214277018386345987,False,,1,https://pbs.twimg.com/media/ENn6geIX0AMwNAW.jpg,,,,,,,[],,,,
1214268304040366085,1214268304040366085,2020-01-06 15:31:38 Venezuela Standard Time,2020-01-06,15:31:38,-0400,216381984,gabosantana35,Gabriel Santana,,Anuncian la liberación de nuestro vecino y funcionario de la alcaldía de Chacao Emilio Boulanger. Desde Mayo del 2019 se encuentra privado de libertad.  Esperemos que se concrete la liberación de alguien que nunca debió estar preso.,es,[],[],[],2,13,22,[],[],https://twitter.com/gabosantana35/status/1214268304040366085,False,,0,,,,,,,,[],,,,
1213844758977748994,1213844758977748994,2020-01-05 11:28:37 Venezuela Standard Time,2020-01-05,11:28:37,-0400,216381984,gabosantana35,Gabriel Santana,,Que papelón el que están haciendo estos 5. La fracción del CLAP.  Que la historia los recuerde como lo que son: Unos arrastrados.  https://t.co/XOYkosS2uJ,es,[],[],['https://pbs.twimg.com/media/ENhxXPZX0AA4ezs.jpg'],9,104,59,[],[],https://twitter.com/gabosantana35/status/1213844758977748994,False,,1,https://pbs.twimg.com/media/ENhxXPZX0AA4ezs.jpg,,,,,,,[],,,,
1207384444568514560,1207384444568514560,2019-12-18 15:37:38 Venezuela Standard Time,2019-12-18,15:37:38,-0400,216381984,gabosantana35,Gabriel Santana,,"Sin luz en la parte norte y centro de nuestro municipio (Altamira, La Castellana y Los Palos Grandes).  A Chacao le tocan unas navidades sin luz y sin agua.",es,[],[],[],0,19,10,[],[],https://twitter.com/gabosantana35/status/1207384444568514560,False,,0,,,,,,,,[],,,,
1205537728370266113,1205537728370266113,2019-12-13 13:19:26 Venezuela Standard Time,2019-12-13,13:19:26,-0400,216381984,gabosantana35,Gabriel Santana,,Un orgullo para Chacao y Venezuela.  Nuestra tradición de los Palmeros de Chacao es declarada por la UNESCO como patrimonio cultural de la humanidad.  Que viva nuestra tierra y sus tradiciones.  https://t.co/uA4XxtiWNk,es,[],[],['https://pbs.twimg.com/media/ELruItcX0AEdvnd.jpg'],1,26,50,[],[],https://twitter.com/gabosantana35/status/1205537728370266113,False,,1,https://pbs.twimg.com/media/ELruItcX0AEdvnd.jpg,,,,,,,[],,,,
1205184533085249538,1205184533085249538,2019-12-12 13:55:58 Venezuela Standard Time,2019-12-12,13:55:58,-0400,216381984,gabosantana35,Gabriel Santana,,Esta mañana compartimos junto a varios líderes vecinales de Chacao. Son muchos los retos que tenemos para este 2020 y unidos vamos a seguir luchando por recuperar nuestro país.  https://t.co/w8fdFWojCv,es,[],[],['https://pbs.twimg.com/media/ELms2poXYAgntDj.jpg'],0,8,16,[],[],https://twitter.com/gabosantana35/status/1205184533085249538,False,,1,https://pbs.twimg.com/media/ELms2poXYAgntDj.jpg,,,,,,,[],,,,
1200421498906906625,1200421498906906625,2019-11-29 10:29:22 Venezuela Standard Time,2019-11-29,10:29:22,-0400,216381984,gabosantana35,Gabriel Santana,,Con la consulta en Miranda pretenden quitarle recursos a la policia del estado Miranda para dárselo a las comunas.  #HectorFraudeRodriguez  https://t.co/dVetxpO3Iu,es,[],[],['https://pbs.twimg.com/media/EKjA-7AWkAA3z90.jpg'],0,34,14,['hectorfrauderodriguez'],[],https://twitter.com/gabosantana35/status/1200421498906906625,False,,1,https://pbs.twimg.com/media/EKjA-7AWkAA3z90.jpg,,,,,,,[],,,,
1200180785141231617,1200180785141231617,2019-11-28 18:32:52 Venezuela Standard Time,2019-11-28,18:32:52,-0400,216381984,gabosantana35,Gabriel Santana,,"Tanto la consulta de Hector Rodríguez en Miranda, como el censo de Maduro, tienen un fin electoral.  Para diseñar los circuitos electorales a su conveniencia y aceitar su maquinaria.  En eso se gastan los recursos de todos los Venezolanos.  https://t.co/oa4IMd6NkU",es,[],[],[],0,27,22,[],[],https://twitter.com/gabosantana35/status/1200180785141231617,False,,1,https://pbs.twimg.com/ext_tw_video_thumb/1200179337003175936/pu/img/zNwBkbhAnPrRGw3Q.jpg,,,,,,,[],,,,
1200080738776956928,1200080738776956928,2019-11-28 11:55:19 Venezuela Standard Time,2019-11-28,11:55:19,-0400,216381984,gabosantana35,Gabriel Santana,,Desde Primero Justicia rechazamos el proceso de consulta que pretende hacer Hector Rodríguez en Miranda.   Donde busca quitarle recursos a la policia de Miranda y dárselos a los militantes del PSUV a través las comunas.  https://t.co/Gc7hfL3USI,es,[],[],['https://pbs.twimg.com/media/EKeK088WkAAv2Vv.jpg'],1,7,9,[],[],https://twitter.com/gabosantana35/status/1200080738776956928,False,,1,https://pbs.twimg.com/media/EKeK088WkAAv2Vv.jpg,,,,,,,[],,,,
1198791233566584832,1198626815197229056,2019-11-24 22:31:17 Venezuela Standard Time,2019-11-24,22:31:17,-0400,216381984,gabosantana35,Gabriel Santana,,"@acosan47 Gracias profe, un fuerte abrazo!",es,[],[],[],0,0,0,[],[],https://twitter.com/gabosantana35/status/1198791233566584832,False,,0,,,,,,,,"[{'screen_name': 'acosan47', 'name': 'Rafael Acosta', 'id': '140049048'}]",,,,
1198626815197229056,1198626815197229056,2019-11-24 11:37:56 Venezuela Standard Time,2019-11-24,11:37:56,-0400,216381984,gabosantana35,Gabriel Santana,,"Agradecido con todas las personas que votaron por mi como líder juvenil del 2019.  Este reconocimiento se lo quiero dedicar a mi abuelo, que el jueves dejó de estar con nosotros.  Eo, eres mi referencia. Siempre te voy a tener en mi corazón. Te quiero y te voy a extrañar mucho.  https://t.co/SCP4N2CnOu",es,[],[],"['https://pbs.twimg.com/media/EKJguCgWsAIE0sD.jpg', 'https://pbs.twimg.com/media/EKJguClX0AExau_.jpg']",2,4,36,[],[],https://twitter.com/gabosantana35/status/1198626815197229056,False,,1,https://pbs.twimg.com/media/EKJguCgWsAIE0sD.jpg,,,,,,,[],,,,
1196935148899622918,1196935148899622918,2019-11-19 19:35:52 Venezuela Standard Time,2019-11-19,19:35:52,-0400,216381984,gabosantana35,Gabriel Santana,,La organización @MasCiudadanos_ me postuló como líder juvenil del año.  Ayúdame con tu voto!   Aquí en link:  https://t.co/dicABlLUUK  https://t.co/f8DAgs8Mtl,es,"[{'screen_name': 'masciudadanos_', 'name': 'ong más ciudadanos', 'id': '956861860120350720'}]",['https://linktr.ee/masciudadanosorg'],['https://pbs.twimg.com/media/EJxeInRWwAEnyki.jpg'],2,5,8,[],[],https://twitter.com/gabosantana35/status/1196935148899622918,False,,1,https://pbs.twimg.com/media/EJxeInRWwAEnyki.jpg,,,,,,,[],,,,
1195804135439978497,1195804135439978497,2019-11-16 16:41:37 Venezuela Standard Time,2019-11-16,16:41:37,-0400,216381984,gabosantana35,Gabriel Santana,,"Hoy, mañana, y los días que sean necesarios hasta recuperar a Venezuela.  https://t.co/Fohc4zHhfG",es,[],[],['https://pbs.twimg.com/media/EJhZgJLWoAI-jqD.jpg'],0,5,15,[],[],https://twitter.com/gabosantana35/status/1195804135439978497,False,,1,https://pbs.twimg.com/media/EJhZgJLWoAI-jqD.jpg,,,,,,,[],,,,
1194587712621367296,1194587712621367296,2019-11-13 08:07:59 Venezuela Standard Time,2019-11-13,08:07:59,-0400,216381984,gabosantana35,Gabriel Santana,,Así amanece la Av. Libertador este miércoles 13.  Todos a la calle este 16 de Noviembre.  #16NDependeDeTodos  https://t.co/ZYcinjDQ4D,es,[],[],"['https://pbs.twimg.com/media/EJQHKxWWoAAlULj.jpg', 'https://pbs.twimg.com/media/EJQHKxjX0AUz6nd.jpg']",1,6,6,['16ndependedetodos'],[],https://twitter.com/gabosantana35/status/1194587712621367296,False,,1,https://pbs.twimg.com/media/EJQHKxWWoAAlULj.jpg,,,,,,,[],,,,
1194394317714001922,1194394317714001922,2019-11-12 19:19:30 Venezuela Standard Time,2019-11-12,19:19:30,-0400,216381984,gabosantana35,Gabriel Santana,,¡Vecino de Chacao! Nos vemos este sábado 16 de Noviembre a las 10AM en la Plaza Altamira.  Este país nos pertenece y vamos a cambiarlo juntos. #16NDependeDeTodos,es,[],[],[],1,11,14,['16ndependedetodos'],[],https://twitter.com/gabosantana35/status/1194394317714001922,False,,0,,,,,,,,[],,,,
1194273566239461376,1194273566239461376,2019-11-12 11:19:41 Venezuela Standard Time,2019-11-12,11:19:41,-0400,216381984,gabosantana35,Gabriel Santana,,Este 16 de Noviembre nos vemos en la calle.  https://t.co/Zq0piG3PDP,es,[],[],['https://pbs.twimg.com/media/EJLpd94XYAABSxz.jpg'],0,2,3,[],[],https://twitter.com/gabosantana35/status/1194273566239461376,False,,1,https://pbs.twimg.com/media/EJLpd94XYAABSxz.jpg,,,,,,,[],,,,
1194254356826271744,1194254356826271744,2019-11-12 10:03:21 Venezuela Standard Time,2019-11-12,10:03:21,-0400,216381984,gabosantana35,Gabriel Santana,,El próximo Vicepresidente de España.  Que decepción.  @Pablo_Iglesias_  https://t.co/yq6KQKTLUC,es,[],[],['https://pbs.twimg.com/media/EJLYACFWkAAENv5.jpg'],0,2,2,[],[],https://twitter.com/gabosantana35/status/1194254356826271744,False,,1,https://pbs.twimg.com/media/EJLYACFWkAAENv5.jpg,,,,,,,[],,,,
1194045018622898176,1194045018622898176,2019-11-11 20:11:31 Venezuela Standard Time,2019-11-11,20:11:31,-0400,216381984,gabosantana35,Gabriel Santana,,Mi parte favorita del trabajo político es el de hormiguita.  #ALaCalle16N  https://t.co/B6sfD56ZXR,es,[],[],[],0,1,9,['alacalle16n'],[],https://twitter.com/gabosantana35/status/1194045018622898176,False,,1,https://pbs.twimg.com/ext_tw_video_thumb/1194044145888833537/pu/img/VmJhDr30sfQE0Zm8.jpg,,,,,,,[],,,,
1192582731152207872,1192582731152207872,2019-11-07 19:20:54 Venezuela Standard Time,2019-11-07,19:20:54,-0400,216381984,gabosantana35,Gabriel Santana,,"Recorriendo la Plaza Los Palos Grandes junto al doctor Requesens, papá de nuestro diputado @juanrequesens.  Como le dijo a los vecinos “Si Juan está fuerte y con esperanza, nosotros tenemos que seguir luchando”.  https://t.co/ymoiXB0lJv",es,"[{'screen_name': 'juanrequesens', 'name': 'juan requesens', 'id': '85386874'}]",[],['https://pbs.twimg.com/media/EIznnUfX0AADS_H.jpg'],0,2,3,[],[],https://twitter.com/gabosantana35/status/1192582731152207872,False,,1,https://pbs.twimg.com/media/EIznnUfX0AADS_H.jpg,,,,,,,[],,,,
1192068954023514114,1192068954023514114,2019-11-06 09:19:20 Venezuela Standard Time,2019-11-06,09:19:20,-0400,216381984,gabosantana35,Gabriel Santana,,"Ayer como Hector Rodríguez se dio una vuelta por el casco de Chacao, mandaron agua.  Pero apenas se acabo su show, volvemos a al calvario que semana a semana viven nuestros vecinos.",es,[],[],[],0,10,6,[],[],https://twitter.com/gabosantana35/status/1192068954023514114,False,https://twitter.com/gabosantana35/status/1192061105000058881,0,,,,,,,,[],,,,
1192061105000058881,1192061105000058881,2019-11-06 08:48:09 Venezuela Standard Time,2019-11-06,08:48:09,-0400,216381984,gabosantana35,Gabriel Santana,,"Casi todo Chacao pasó 3 semanas sin agua, ayer empezó a llegar y esta mañana ya cortaron el suministro. No alcanzó ni para llenar los tanques.  Estamos hartos de esta burla y de mendigar lo que es un derecho humano.",es,[],[],[],3,31,20,[],[],https://twitter.com/gabosantana35/status/1192061105000058881,False,,0,,,,,,,,[],,,,
1188919027458023425,1188843525015781378,2019-10-28 16:42:39 Venezuela Standard Time,2019-10-28,16:42:39,-0400,216381984,gabosantana35,Gabriel Santana,,"@ValeriaFarresR @LedVarela Que honor que me menciones aquí Valeria, un fuerte abrazo!!",es,[],[],[],0,0,1,[],[],https://twitter.com/gabosantana35/status/1188919027458023425,False,,0,,,,,,,,"[{'screen_name': 'ValeriaFarresR', 'name': 'Valeria', 'id': '417938740'}, {'screen_name': 'LedVarela', 'name': 'Led Varela Bargalló', 'id': '16507462'}]",,,,
1188495243672465408,1188495243672465408,2019-10-27 12:38:41 Venezuela Standard Time,2019-10-27,12:38:41,-0400,216381984,gabosantana35,Gabriel Santana,,"Viendo a nuestros hermanos de Argentina, Uruguay y Colombia votar con tranquilidad hoy, solo puedo pensar una cosa: ¡Que envidia!",es,[],[],[],1,2,7,[],[],https://twitter.com/gabosantana35/status/1188495243672465408,False,,0,,,,,,,,[],,,,
1186791702595551234,1186791702595551234,2019-10-22 19:49:26 Venezuela Standard Time,2019-10-22,19:49:26,-0400,216381984,gabosantana35,Gabriel Santana,,Hoy cumple 49 años mi querida @unimet. Agradezco por cada compañero y profesor con los que he compartido.  La universidad venezolana es sinónimo de lucha por la democracia y estoy orgulloso de ser parte de ella.  https://t.co/pe4zolcotQ,es,"[{'screen_name': 'unimet', 'name': 'unimet', 'id': '32280530'}]",[],['https://pbs.twimg.com/media/EHhUwBzWsAAnt1u.jpg'],0,11,48,[],[],https://twitter.com/gabosantana35/status/1186791702595551234,False,,1,https://pbs.twimg.com/media/EHhUwBzWsAAnt1u.jpg,,,,,,,[],,,,
1186776890247393280,1186769801605271553,2019-10-22 18:50:34 Venezuela Standard Time,2019-10-22,18:50:34,-0400,216381984,gabosantana35,Gabriel Santana,,@AndresB2917 @JuanPGuanipa @ElimarDiazG @Pr1meroJusticia Eso muestra tu gran criterio.  Saludos.,es,[],[],[],0,0,0,[],[],https://twitter.com/gabosantana35/status/1186776890247393280,False,,0,,,,,,,,"[{'screen_name': 'AndresB2917', 'name': 'Andres Ivan', 'id': '772943418'}, {'screen_name': 'JuanPGuanipa', 'name': 'Juan Pablo Guanipa', 'id': '66198530'}, {'screen_name': 'ElimarDiazG', 'name': 'Elimar Díaz G.', 'id': '231902294'}, {'screen_name': 'Pr1meroJusticia', 'name': 'Primero Justicia', 'id': '144164028'}]",,,,
1186776100833300483,1186769801605271553,2019-10-22 18:47:26 Venezuela Standard Time,2019-10-22,18:47:26,-0400,216381984,gabosantana35,Gabriel Santana,,"@AndresB2917 @JuanPGuanipa @ElimarDiazG @Pr1meroJusticia No soy ni socialista, ni cómplice. Por qué me llamas así? Tú me conoces o atacar es simplemente una línea de tú partido?",es,[],[],[],0,0,0,[],[],https://twitter.com/gabosantana35/status/1186776100833300483,False,,0,,,,,,,,"[{'screen_name': 'AndresB2917', 'name': 'Andres Ivan', 'id': '772943418'}, {'screen_name': 'JuanPGuanipa', 'name': 'Juan Pablo Guanipa', 'id': '66198530'}, {'screen_name': 'ElimarDiazG', 'name': 'Elimar Díaz G.', 'id': '231902294'}, {'screen_name': 'Pr1meroJusticia', 'name': 'Primero Justicia', 'id': '144164028'}]",,,,
1186769801605271553,1186769801605271553,2019-10-22 18:22:24 Venezuela Standard Time,2019-10-22,18:22:24,-0400,216381984,gabosantana35,Gabriel Santana,,"Maduro le tiene miedo a los venezolanos protestando, por eso ataca a @JuanPGuanipa.  Mañana en la esquina Plomer de Chacao, a las 5:30pm, estaremos conversando con la diputada por el Zulia @ElimarDiazG sobre la crisis en el Zulia y la convocatoria del 24.  @Pr1meroJusticia  https://t.co/mfWAQC3jcx",es,"[{'screen_name': 'juanpguanipa', 'name': 'juan pablo guanipa', 'id': '66198530'}, {'screen_name': 'elimardiazg', 'name': 'elimar díaz g.', 'id': '231902294'}, {'screen_name': 'pr1merojusticia', 'name': 'primero justicia', 'id': '144164028'}]",[],['https://pbs.twimg.com/media/EHhA1jlWkAUrf6c.jpg'],0,14,18,[],[],https://twitter.com/gabosantana35/status/1186769801605271553,False,,1,https://pbs.twimg.com/media/EHhA1jlWkAUrf6c.jpg,,,,,,,[],,,,
1186390049056854020,1186390049056854020,2019-10-21 17:13:24 Venezuela Standard Time,2019-10-21,17:13:24,-0400,216381984,gabosantana35,Gabriel Santana,,En Chacao vivimos una crisis profunda de servicios públicos. Pero no se compara a la dura situación que vive hoy el Zulia.  Nos vemos el miércoles junto a la diputada @ElimarDiazG en el casco de Chacao!  https://t.co/NmYIjz2hHA,es,"[{'screen_name': 'elimardiazg', 'name': 'elimar díaz g.', 'id': '231902294'}]",[],['https://pbs.twimg.com/media/EHbnb3pXkAENPSf.jpg'],1,14,11,[],[],https://twitter.com/gabosantana35/status/1186390049056854020,False,,1,https://pbs.twimg.com/media/EHbnb3pXkAENPSf.jpg,,,,,,,[],,,,
1185604258391101441,1185604258391101441,2019-10-19 13:10:57 Venezuela Standard Time,2019-10-19,13:10:57,-0400,216381984,gabosantana35,Gabriel Santana,,"Esta sábado visitamos La Cruz.  En los momentos más difíciles, seguimos recorriendo nuestros sectores y escuchando a nuestros vecinos.  @ChacaoPJ  #PrimeroEstaChacao  https://t.co/uIgKtfIsa0",es,"[{'screen_name': 'chacaopj', 'name': 'pj chacao', 'id': '2384013134'}]",[],['https://pbs.twimg.com/media/EHQcwfLXkAAjzbC.jpg'],0,7,8,['primeroestachacao'],[],https://twitter.com/gabosantana35/status/1185604258391101441,False,,1,https://pbs.twimg.com/media/EHQcwfLXkAAjzbC.jpg,,,,,,,[],,,,
1184865964439023616,1184865964439023616,2019-10-17 12:17:14 Venezuela Standard Time,2019-10-17,12:17:14,-0400,216381984,gabosantana35,Gabriel Santana,,Que vergüenza.,es,[],[],[],0,1,0,[],[],https://twitter.com/gabosantana35/status/1184865964439023616,False,https://twitter.com/NTN24ve/status/1184857561364865024,0,,,,,,,,[],,,,
1184594654005727233,1184594654005727233,2019-10-16 18:19:08 Venezuela Standard Time,2019-10-16,18:19:08,-0400,216381984,gabosantana35,Gabriel Santana,,"¡QUE BOLAS TIENE STALIN!  Ya que tengo tu atención, aquí una noticia de algo que de verdad nos afecta a los venezolanos.  Están saqueando nuestro país y nosotros pendientes de otra cosa.   https://t.co/Eos49RvbL3",es,[],['https://www.ntn24.com/america-latina/venezuela/maduro-anuncia-que-entregara-una-mina-de-oro-cada-gobernacion-socialista'],[],5,32,29,[],[],https://twitter.com/gabosantana35/status/1184594654005727233,False,,0,,,,,,,,[],,,,
1183901845837811712,1183901845837811712,2019-10-14 20:26:10 Venezuela Standard Time,2019-10-14,20:26:10,-0400,216381984,gabosantana35,Gabriel Santana,,Agradecido con @Punto_deCorte y @johanalvarezr por la entrevista de hoy. Aquí les dejo la reseña.    https://t.co/l7sccEWWES,es,"[{'screen_name': 'punto_decorte', 'name': 'pdctv.info', 'id': '876863947617513473'}, {'screen_name': 'johanalvarezr', 'name': 'johan alvarez', 'id': '128294096'}]",['https://puntodecorte.com/crisis-de-agua/'],[],1,8,8,[],[],https://twitter.com/gabosantana35/status/1183901845837811712,False,,0,,,,,,,,[],,,,
1182717517359390721,1182717517359390721,2019-10-11 14:00:04 Venezuela Standard Time,2019-10-11,14:00:04,-0400,216381984,gabosantana35,Gabriel Santana,,"Vecinos del municipio Chacao protestando por la falta de agua.  Lo de Hidrocapital es una burla, puras excusas y nada de agua! #VzlaEnProtesta  https://t.co/bIOEed1ZHP",es,[],[],['https://pbs.twimg.com/media/EGnbRcnWwAAwvKl.jpg'],5,45,43,['vzlaenprotesta'],[],https://twitter.com/gabosantana35/status/1182717517359390721,False,,1,https://pbs.twimg.com/media/EGnbRcnWwAAwvKl.jpg,,,,,,,[],,,,
1180882159063711744,1180882159063711744,2019-10-06 12:27:01 Venezuela Standard Time,2019-10-06,12:27:01,-0400,216381984,gabosantana35,Gabriel Santana,,Los vecinos de Chacao volvimos a para protestar por la falta de agua en nuestro municipio.  Seguiremos en las calles hasta que se restituya el servicio!  #ChacaoSinAgua  https://t.co/mCuypBS6gP,es,[],[],"['https://pbs.twimg.com/media/EGNV_kTXkAARnYN.jpg', 'https://pbs.twimg.com/media/EGNV_kUXUAAJA2_.jpg']",1,17,17,['chacaosinagua'],[],https://twitter.com/gabosantana35/status/1180882159063711744,False,,1,https://pbs.twimg.com/media/EGNV_kTXkAARnYN.jpg,,,,,,,[],,,,
1180562133563645953,1180562133563645953,2019-10-05 15:15:21 Venezuela Standard Time,2019-10-05,15:15:21,-0400,216381984,gabosantana35,Gabriel Santana,,"Mientras Hidrocapital tuitea que Chacao tiene agua, esta es la realidad.  Decenas de vecinos cargando agua porque tienen semanas sin una gota! Basta de mentiras!  https://t.co/2HLh88XykT",es,[],[],['https://pbs.twimg.com/media/EGIy_PvW4AUHotJ.jpg'],1,29,13,[],[],https://twitter.com/gabosantana35/status/1180562133563645953,False,,1,https://pbs.twimg.com/media/EGIy_PvW4AUHotJ.jpg,,,,,,,[],,,,
1180554593450762241,1180554593450762241,2019-10-05 14:45:23 Venezuela Standard Time,2019-10-05,14:45:23,-0400,216381984,gabosantana35,Gabriel Santana,,"Un honor recibir a nuestro presidente @jguaido en el mercado de Chacao.  En el momento más duro que viven nuestros vecinos, es importante que sepan que tienen a un líder que lucha día a día por el cambio en Venezuela.  https://t.co/92K6xeTYht",es,"[{'screen_name': 'jguaido', 'name': 'juan guaidó', 'id': '39176902'}]",[],['https://pbs.twimg.com/media/EGIsHbSX0AErK1V.jpg'],1,13,29,[],[],https://twitter.com/gabosantana35/status/1180554593450762241,False,,1,https://pbs.twimg.com/media/EGIsHbSX0AErK1V.jpg,,,,,,,[],,,,
1179864826421624832,1179864826421624832,2019-10-03 17:04:30 Venezuela Standard Time,2019-10-03,17:04:30,-0400,216381984,gabosantana35,Gabriel Santana,,"Esta semana he leído sobre la disolución del parlamento en Perú y las protestas y estado de excepción  en Ecuador.  Tenemos que sacar a Maduro para que nuestros hermanos puedan volver a su tierra. Ningún país es perfecto, pero este es el suyo.",es,[],[],[],0,6,7,[],[],https://twitter.com/gabosantana35/status/1179864826421624832,False,,0,,,,,,,,[],,,,
1179187991920730112,1179187991920730112,2019-10-01 20:15:00 Venezuela Standard Time,2019-10-01,20:15:00,-0400,216381984,gabosantana35,Gabriel Santana,,"Ojalá en el último bloque del #DebatePresidencialUy se toque el tema de Venezuela, y la postura del Frente Amplio tan condescendiente con Maduro.",es,[],[],[],0,0,1,['debatepresidencialuy'],[],https://twitter.com/gabosantana35/status/1179187991920730112,False,,0,,,,,,,,[],,,,
1179175962136711168,1179175962136711168,2019-10-01 19:27:12 Venezuela Standard Time,2019-10-01,19:27:12,-0400,216381984,gabosantana35,Gabriel Santana,,Muy buena primera intervención de @LuisLacallePou en el #DebatePresidencialUy. Como venezolano estoy del lado del partido en Uruguay que siempre ha defendido nuestra causa. Vamos @PNACIONAL!!  https://t.co/Iw0dVOMzs6,es,"[{'screen_name': 'luislacallepou', 'name': 'luis lacalle pou', 'id': '189861728'}, {'screen_name': 'pnacional', 'name': 'partido nacional', 'id': '153146271'}]",[],['https://pbs.twimg.com/media/EF1GRDLXoAAr94o.jpg'],0,0,2,['debatepresidencialuy'],[],https://twitter.com/gabosantana35/status/1179175962136711168,False,,1,https://pbs.twimg.com/media/EF1GRDLXoAAr94o.jpg,,,,,,,[],,,,
1179053860343750659,1179053176437297153,2019-10-01 11:22:00 Venezuela Standard Time,2019-10-01,11:22:00,-0400,216381984,gabosantana35,Gabriel Santana,,Desde Primero Justicia habilitamos un correo electrónico para recibir las denuncias sobre el censo: Primeromicasa2019@gmail.com  ¡Ayúdanos a difundirlo!  #PrimeroMiCasa,es,[],[],[],2,16,14,['primeromicasa'],[],https://twitter.com/gabosantana35/status/1179053860343750659,False,,0,,,,,,,,[],,,,
1179053176437297153,1179053176437297153,2019-10-01 11:19:17 Venezuela Standard Time,2019-10-01,11:19:17,-0400,216381984,gabosantana35,Gabriel Santana,,"Hace semanas el ministro de Maduro propuso un censo pirata, donde milicianos, militantes de Somos Venezuela y el Poder Popular van a ir casa por casa amedrentando a los venezolanos.  Los ciudadanos rechazamos esto contundentemente. #PrimeroMiCasa",es,[],[],[],3,38,22,['primeromicasa'],[],https://twitter.com/gabosantana35/status/1179053176437297153,False,,0,,,,,,,,[],,,,
1177364771399774208,1177364771399774208,2019-09-26 19:30:10 Venezuela Standard Time,2019-09-26,19:30:10,-0400,216381984,gabosantana35,Gabriel Santana,,"Vecinos, mañana nos vemos a las 5pm en la esquina Plomer de Chacao. Para organizarnos y decir contundentemente NO al censo.  https://t.co/jhJt8DfK9y",es,[],[],['https://pbs.twimg.com/media/EFbXAdWXYAA70Y3.jpg'],0,10,8,[],[],https://twitter.com/gabosantana35/status/1177364771399774208,False,,1,https://pbs.twimg.com/media/EFbXAdWXYAA70Y3.jpg,,,,,,,[],,,,
1176879728231354369,1176879728231354369,2019-09-25 11:22:47 Venezuela Standard Time,2019-09-25,11:22:47,-0400,216381984,gabosantana35,Gabriel Santana,,"Hoy desde @Pr1meroJusticia rechazamos el censo de Maduro.  Llamamos a los venezolanos a NO cooperar, a NO abrir la puerta y NO dar información privada.  https://t.co/ZhJIje12uO",es,"[{'screen_name': 'pr1merojusticia', 'name': 'primero justicia', 'id': '144164028'}]",[],['https://pbs.twimg.com/media/EFUd3aSXsAEEN4H.jpg'],2,16,17,[],[],https://twitter.com/gabosantana35/status/1176879728231354369,False,,1,https://pbs.twimg.com/media/EFUd3aSXsAEEN4H.jpg,,,,,,,[],,,,
1175006131401437185,1175005491560402944,2019-09-20 07:17:46 Venezuela Standard Time,2019-09-20,07:17:46,-0400,216381984,gabosantana35,Gabriel Santana,,"Ahogar a los colegios con la falta de presupuesto, mantenimiento y servicios públicos es una marca del “Hecho en Socialismo”  Quieren cada día a una población menos crítica.  #EnMirandaDestruyeronLaEducación",es,[],[],[],0,13,8,['enmirandadestruyeronlaeducación'],[],https://twitter.com/gabosantana35/status/1175006131401437185,False,,0,,,,,,,,[],,,,
1175005491560402944,1175005491560402944,2019-09-20 07:15:14 Venezuela Standard Time,2019-09-20,07:15:14,-0400,216381984,gabosantana35,Gabriel Santana,,En los colegios públicos los maestros no ganan ni 2 cartones de huevo al mes.  ¿Como vive un profesor con ese sueldo de hambre?  #EnMirandaDestruyeronLaEducacion,es,[],[],[],4,68,46,['enmirandadestruyeronlaeducacion'],[],https://twitter.com/gabosantana35/status/1175005491560402944,False,,0,,,,,,,,[],,,,
