id,conversation_id,created_at,date,time,timezone,user_id,username,name,place,tweet,language,mentions,urls,photos,replies_count,retweets_count,likes_count,hashtags,cashtags,link,retweet,quote_url,video,thumbnail,near,geo,source,user_rt_id,user_rt,retweet_id,reply_to,retweet_date,translate,trans_src,trans_dest
1299495596852678658,1299495596852678658,2020-08-28 19:54:28 Venezuela Standard Time,2020-08-28,19:54:28,-0400,216381984,gabosantana35,Gabriel Santana,,"Juan Requesens representa el espíritu de lucha del verdadero justiciero.  Ese que no entrega sus principios ni sus valores, ese que no se arrodilla ante la opresión.  Hoy el corazón de @pr1merojusticia está impregnado de su testimonio de lucha.  https://t.co/u3xRYlvMfh",es,"[{'screen_name': 'pr1merojusticia', 'name': 'primero justicia', 'id': '144164028'}]",[],['https://pbs.twimg.com/media/Egi8WaRWsAM3PsZ.jpg'],0,9,15,[],[],https://twitter.com/gabosantana35/status/1299495596852678658,False,,1,https://pbs.twimg.com/media/Egi8WaRWsAM3PsZ.jpg,,,,,,,[],,,,
1299433394598752256,1299433394598752256,2020-08-28 15:47:18 Venezuela Standard Time,2020-08-28,15:47:18,-0400,216381984,gabosantana35,Gabriel Santana,,Hoy comienzo este nuevo proyecto.  Voces Locales es un espacio para conversar con líderes políticos de diferentes partes de Iberoamérica.  Pueden escucharlo aquí!    https://t.co/XjdG4pcfWe,es,[],['https://youtu.be/zH3UCD_oosw'],[],1,3,11,[],[],https://twitter.com/gabosantana35/status/1299433394598752256,False,,0,,,,,,,,[],,,,
1299404279481069569,1299404279481069569,2020-08-28 13:51:36 Venezuela Standard Time,2020-08-28,13:51:36,-0400,216381984,gabosantana35,Gabriel Santana,,"Reporte de los casos de COVID-19 en nuestro municipio Chacao.  Sigamos tomando todas las medidas de prevención, por nosotros y por nuestros vecinos.  https://t.co/A417NzJ2Sf",es,[],[],['https://pbs.twimg.com/media/EghpP4uVgAEW1Df.jpg'],0,2,4,[],[],https://twitter.com/gabosantana35/status/1299404279481069569,False,,1,https://pbs.twimg.com/media/EghpP4uVgAEW1Df.jpg,,,,,,,[],,,,
1299076006872055811,1299076006872055811,2020-08-27 16:07:10 Venezuela Standard Time,2020-08-27,16:07:10,-0400,216381984,gabosantana35,Gabriel Santana,,Ayer junto a más 50 vecinos de Chacao conversando sobre la “Ley de condominios” que propone la gobernación de Miranda.  Gracias a mi papá y a todos los que nos acompañaron. Pronto traeremos nuevos conversatorios sobre los temas más importantes para nuestros vecinos #PrimeroChacao  https://t.co/WOjhiSjFdX,es,[],[],['https://pbs.twimg.com/media/Egc-uxrXgAU40qT.jpg'],0,5,15,['primerochacao'],[],https://twitter.com/gabosantana35/status/1299076006872055811,False,,1,https://pbs.twimg.com/media/Egc-uxrXgAU40qT.jpg,,,,,,,[],,,,
1296891694345003008,1296891694345003008,2020-08-21 15:27:29 Venezuela Standard Time,2020-08-21,15:27:29,-0400,216381984,gabosantana35,Gabriel Santana,,"El balance de @ChacaoPJ sobre la situación del Covid-19 en el municipio. Tenemos que aumentar las medidas de prevención, cuidarnos a nosotros, es cuidar a nuestros vecinos.   #PrimeroChacao  https://t.co/k16SaMbaME",es,"[{'screen_name': 'chacaopj', 'name': 'pj chacao', 'id': '2384013134'}]",[],['https://pbs.twimg.com/media/Ef98GyIWkAAiV15.jpg'],1,7,8,['primerochacao'],[],https://twitter.com/gabosantana35/status/1296891694345003008,False,,1,https://pbs.twimg.com/media/Ef98GyIWkAAiV15.jpg,,,,,,,[],,,,
1296069331441385474,1296069331441385474,2020-08-19 08:59:43 Venezuela Standard Time,2020-08-19,08:59:43,-0400,216381984,gabosantana35,Gabriel Santana,,¡Felicidades a todos los baruteños en este día!,es,[],[],[],0,2,12,[],[],https://twitter.com/gabosantana35/status/1296069331441385474,False,https://twitter.com/diegopadronb/status/1296068433193426944,0,,,,,,,,[],,,,
1294751048159105024,1294751048159105024,2020-08-15 17:41:19 Venezuela Standard Time,2020-08-15,17:41:19,-0400,216381984,gabosantana35,Gabriel Santana,,"Con parte del equipo, tomando todas las previsiones, llevamos más de 100 litros de agua potable a la comunidad de Pajaritos.  Cómo está llegando el agua a nuestras casas, no se puede tomar.  #PrimeroChacao  https://t.co/HJXWyBL564",es,[],[],['https://pbs.twimg.com/media/EffhMLmXoAAaVPg.jpg'],0,13,21,['primerochacao'],[],https://twitter.com/gabosantana35/status/1294751048159105024,False,,1,https://pbs.twimg.com/media/EffhMLmXoAAaVPg.jpg,,,,,,,[],,,,
1294730633118457865,1294730633118457865,2020-08-15 16:20:12 Venezuela Standard Time,2020-08-15,16:20:12,-0400,216381984,gabosantana35,Gabriel Santana,,Desde @Pr1meroJusticia rechazamos la Ley de Condominios que le quiere imponer la gobernación de Miranda a los vecinos del estado.  https://t.co/fRCYM06k3O,es,"[{'screen_name': 'pr1merojusticia', 'name': 'primero justicia', 'id': '144164028'}]",['https://vpitv.com/ultimas_noticias_sobre_venezuela/venezuela-primero-justicia-rechazo-planes-de-ley-de-condominio-en-el-estado-miranda/'],[],0,10,18,[],[],https://twitter.com/gabosantana35/status/1294730633118457865,False,,0,,,,,,,,[],,,,
1294249794165252097,1294247971836633089,2020-08-14 08:29:31 Venezuela Standard Time,2020-08-14,08:29:31,-0400,216381984,gabosantana35,Gabriel Santana,,"Como vecinos y ciudadanos, tenemos que rechazar esta propuesta de ley. En Miranda le decimos NO a la ley de condominios.",es,[],[],[],0,31,27,[],[],https://twitter.com/gabosantana35/status/1294249794165252097,False,,0,,,,,,,,[],,,,
1294249670508711939,1294247971836633089,2020-08-14 08:29:02 Venezuela Standard Time,2020-08-14,08:29:02,-0400,216381984,gabosantana35,Gabriel Santana,,"Lastimosamente, el consejo legislativo del Estado Miranda no quiere reconocer a estas formas de organización ciudadanas para apoyarlas y fortalecerlas, si no para meterle la mano a ellas.",es,[],[],[],1,24,19,[],[],https://twitter.com/gabosantana35/status/1294249670508711939,False,,0,,,,,,,,[],,,,
1294249530557259777,1294247971836633089,2020-08-14 08:28:28 Venezuela Standard Time,2020-08-14,08:28:28,-0400,216381984,gabosantana35,Gabriel Santana,,"Hay que destacar que este proyecto de ley reconoce la personalidad jurídica de las asociaciones de vecinos y condominios. Esto no le compete al consejo legislativo del Estado Miranda, es competencia de nuestra Asamblea Nacional legítima el poder reconocer estas figuras.",es,[],[],[],1,25,22,[],[],https://twitter.com/gabosantana35/status/1294249530557259777,False,,0,,,,,,,,[],,,,
1294249327469236225,1294247971836633089,2020-08-14 08:27:40 Venezuela Standard Time,2020-08-14,08:27:40,-0400,216381984,gabosantana35,Gabriel Santana,,Rechazamos esta propuesta por la falta de transparencia que caracteriza todas las gestiones de recursos por parte de los gobiernan. El PSUV será la encargada de decidir a qué edificios se les adjudicará los fondos y a cuáles no. Más exclusión para los venezolanos.,es,[],[],[],2,26,24,[],[],https://twitter.com/gabosantana35/status/1294249327469236225,False,,0,,,,,,,,[],,,,
1294248949419839488,1294247971836633089,2020-08-14 08:26:10 Venezuela Standard Time,2020-08-14,08:26:10,-0400,216381984,gabosantana35,Gabriel Santana,,"Varios alcaldes del estado Miranda se pronunciaron rechazando la propuesta, ni siquiera fueron consultados.",es,[],[],[],1,26,20,[],[],https://twitter.com/gabosantana35/status/1294248949419839488,False,,0,,,,,,,,[],,,,
1294248829513064448,1294247971836633089,2020-08-14 08:25:41 Venezuela Standard Time,2020-08-14,08:25:41,-0400,216381984,gabosantana35,Gabriel Santana,,"Propone que las alcaldías entreguen el 1% de su presupuesto anual a este fondo, que no solo es inconstitucional, si no que busca un Estado más centralizado y a unas alcaldías cada día más débiles.",es,[],[],[],1,32,23,[],[],https://twitter.com/gabosantana35/status/1294248829513064448,False,,0,,,,,,,,[],,,,
1294248657655603200,1294247971836633089,2020-08-14 08:25:00 Venezuela Standard Time,2020-08-14,08:25:00,-0400,216381984,gabosantana35,Gabriel Santana,,El problema de esta propuesta son sus fines políticos. No se busca apoyar a la clase media que tanto ha sufrido por la crisis. Busca llevar el control político y social también a los condominios. Esta ley de condominios pretende ser el CLAP para la clase media.,es,[],[],[],2,32,22,[],[],https://twitter.com/gabosantana35/status/1294248657655603200,False,,0,,,,,,,,[],,,,
1294248383486599168,1294247971836633089,2020-08-14 08:23:55 Venezuela Standard Time,2020-08-14,08:23:55,-0400,216381984,gabosantana35,Gabriel Santana,,"Primero, no es una iniciativa nueva en Venezuela, hemos tenido gestiones que han implementado iniciativas similares, donde se les ha dado recursos a los condominios para pagar reparaciones en el edificio.",es,[],[],[],1,30,20,[],[],https://twitter.com/gabosantana35/status/1294248383486599168,False,,0,,,,,,,,[],,,,
1294248186253639683,1294247971836633089,2020-08-14 08:23:08 Venezuela Standard Time,2020-08-14,08:23:08,-0400,216381984,gabosantana35,Gabriel Santana,,La Gobernación de Miranda propone con una “Ley de condominios” un fondo intergubernamental para los condominios.  ¿Esto qué significa?,es,[],[],[],2,32,24,[],[],https://twitter.com/gabosantana35/status/1294248186253639683,False,,0,,,,,,,,[],,,,
1294247971836633089,1294247971836633089,2020-08-14 08:22:17 Venezuela Standard Time,2020-08-14,08:22:17,-0400,216381984,gabosantana35,Gabriel Santana,,La ley de condominios que propone la gobernación de Miranda pretende ser el CLAP de la clase media. Abro hilo.,es,[],[],[],3,93,57,[],[],https://twitter.com/gabosantana35/status/1294247971836633089,False,,0,,,,,,,,[],,,,
1293616913290080259,1293616913290080259,2020-08-12 14:34:41 Venezuela Standard Time,2020-08-12,14:34:41,-0400,216381984,gabosantana35,Gabriel Santana,,"Ayer llegamos a los 95 casos confirmados de COVID en el municipio Chacao.  Vecinos, tenemos que seguir cuidándonos y aumentando las medidas de prevención.  https://t.co/xf1ZN0chJ2",es,[],[],['https://pbs.twimg.com/media/EfPZtPsXsAAjEH5.jpg'],0,15,10,[],[],https://twitter.com/gabosantana35/status/1293616913290080259,False,,1,https://pbs.twimg.com/media/EfPZtPsXsAAjEH5.jpg,,,,,,,[],,,,
1292978861873999872,1292978861873999872,2020-08-10 20:19:17 Venezuela Standard Time,2020-08-10,20:19:17,-0400,216381984,gabosantana35,Gabriel Santana,,Que tranquilidad habría en Bielorrusia si no hubieran legitimado las elecciones.,es,[],[],[],0,3,16,[],[],https://twitter.com/gabosantana35/status/1292978861873999872,False,,0,,,,,,,,[],,,,
1287594554003267585,1287594554003267585,2020-07-26 23:43:58 Venezuela Standard Time,2020-07-26,23:43:58,-0400,216381984,gabosantana35,Gabriel Santana,,"Para mi, el retiro de @ernesto_talvi de la política uruguaya es comparable con el de @Albert_Rivera en España.  Dos proyectos emocionantes para el centro político, ambos, curiosamente con el mismo nombre.  Ojalá @ciudadanos600 siga con más fuerza y sumando a la coalición.",es,"[{'screen_name': 'ernesto_talvi', 'name': 'ernesto talvi', 'id': '3248057667'}, {'screen_name': 'albert_rivera', 'name': 'albert rivera', 'id': '108994652'}, {'screen_name': 'ciudadanos600', 'name': 'ciudadanos oficial', 'id': '983412143411421186'}]",[],[],0,2,5,[],[],https://twitter.com/gabosantana35/status/1287594554003267585,False,,0,,,,,,,,[],,,,
1284579224926539789,1284579224926539789,2020-07-18 16:02:08 Venezuela Standard Time,2020-07-18,16:02:08,-0400,216381984,gabosantana35,Gabriel Santana,,"Hoy hicimos una pequeña celebración del Día del niño muy acorde con la situación que vivimos.  Primero conversamos con los niños sobre el Coronavirus y cómo prevenirlo, y después comimos un ponque que les hizo mi mamá.  https://t.co/djJoaNtdyW",es,[],[],['https://pbs.twimg.com/media/EdO98U0WAAA0JCf.jpg'],1,4,11,[],[],https://twitter.com/gabosantana35/status/1284579224926539789,False,,1,https://pbs.twimg.com/media/EdO98U0WAAA0JCf.jpg,,,,,,,[],,,,
1283162447935832073,1283092165279834116,2020-07-14 18:12:22 Venezuela Standard Time,2020-07-14,18:12:22,-0400,216381984,gabosantana35,Gabriel Santana,,@Iuminiscente Tas loca,es,[],[],[],0,0,0,[],[],https://twitter.com/gabosantana35/status/1283162447935832073,False,,0,,,,,,,,"[{'screen_name': 'Iuminiscente', 'name': 'Gene🌈✨', 'id': '1963240344'}]",,,,
1282674459795759106,1282674459795759106,2020-07-13 09:53:16 Venezuela Standard Time,2020-07-13,09:53:16,-0400,216381984,gabosantana35,Gabriel Santana,,¿Será que la flexibilización de la cuarentena esta semana (sin ningún tipo de lógica) está relacionada con la apertura del registro electoral?,es,[],[],[],1,4,7,[],[],https://twitter.com/gabosantana35/status/1282674459795759106,False,,0,,,,,,,,[],,,,
1279512847622512640,1279512847622512640,2020-07-04 16:30:09 Venezuela Standard Time,2020-07-04,16:30:09,-0400,216381984,gabosantana35,Gabriel Santana,,"En Chacao no llega el agua desde hace semanas, y cuando llega tiene color y sabor.  Hoy le pudimos entregar a nuestros vecinos del tártago agua potable.  https://t.co/HsrG4TRxkT",es,[],[],['https://pbs.twimg.com/media/EcG-IZ6WkAUX4KR.jpg'],2,15,24,[],[],https://twitter.com/gabosantana35/status/1279512847622512640,False,,1,https://pbs.twimg.com/media/EcG-IZ6WkAUX4KR.jpg,,,,,,,[],,,,
1278312698237902848,1278155525075734529,2020-07-01 09:01:11 Venezuela Standard Time,2020-07-01,09:01:11,-0400,216381984,gabosantana35,Gabriel Santana,,@marcelrouaix Quieren hacer sardinas en lata como los de la ANC,es,[],[],[],1,0,1,[],[],https://twitter.com/gabosantana35/status/1278312698237902848,False,,0,,,,,,,,"[{'screen_name': 'marcelrouaix', 'name': 'Marcel  Rouaix', 'id': '122473619'}]",,,,
1276909496267354114,1276909496267354114,2020-06-27 12:05:22 Venezuela Standard Time,2020-06-27,12:05:22,-0400,216381984,gabosantana35,Gabriel Santana,,Feliz día a los que salen a ejercer su profesión con chaleco. Muy orgulloso de los periodistas venezolanos.  #DíaDelPeriodista  https://t.co/k59xV0dP8U,es,[],[],['https://pbs.twimg.com/media/Ebh-UsqWsAEelcq.jpg'],0,1,14,['díadelperiodista'],[],https://twitter.com/gabosantana35/status/1276909496267354114,False,,1,https://pbs.twimg.com/media/Ebh-UsqWsAEelcq.jpg,,,,,,,[],,,,
1276164683242840064,1276164683242840064,2020-06-25 10:45:45 Venezuela Standard Time,2020-06-25,10:45:45,-0400,216381984,gabosantana35,Gabriel Santana,,"Esto es mañana, si quieres participar, escríbele a las redes de @ChacaoPJ. ¡Te esperamos!  https://t.co/9MF4kwVcXJ",es,"[{'screen_name': 'chacaopj', 'name': 'pj chacao', 'id': '2384013134'}]",[],['https://pbs.twimg.com/media/EbXZAdfXkAAkDkg.jpg'],0,1,2,[],[],https://twitter.com/gabosantana35/status/1276164683242840064,False,,1,https://pbs.twimg.com/media/EbXZAdfXkAAkDkg.jpg,,,,,,,[],,,,
1275861782037499907,1275861782037499907,2020-06-24 14:42:07 Venezuela Standard Time,2020-06-24,14:42:07,-0400,216381984,gabosantana35,Gabriel Santana,,Las recomendaciones del doctor Julio Castro para prevenir el coronavirus.   ¡Ayúdanos a difundir!  @ChacaoAgua  https://t.co/PEYey4BS9M,es,"[{'screen_name': 'chacaoagua', 'name': 'chacao quiere agua', 'id': '3692234116'}]",[],['https://pbs.twimg.com/media/EbTFhJIWoAMOFGh.jpg'],0,17,18,[],[],https://twitter.com/gabosantana35/status/1275861782037499907,False,,1,https://pbs.twimg.com/media/EbTFhJIWoAMOFGh.jpg,,,,,,,[],,,,
1275827908125343744,1275827908125343744,2020-06-24 12:27:31 Venezuela Standard Time,2020-06-24,12:27:31,-0400,216381984,gabosantana35,Gabriel Santana,,"Desde @ChacaoAgua y @MonitorCiudad_ hemos levantado los datos de la crisis del agua en nuestro municipio y toda Caracas.  Lo que hemos vivido los últimas semanas es inhumano, especialmente porque estamos en plena pandemia.  ¡El agua es vital para nuestra salud!  https://t.co/gQcZYZBN0K",es,"[{'screen_name': 'chacaoagua', 'name': 'chacao quiere agua', 'id': '3692234116'}, {'screen_name': 'monitorciudad_', 'name': 'monitor ciudad', 'id': '3351747537'}]",[],['https://pbs.twimg.com/media/EbSmtnFXYAAzYiw.jpg'],0,23,27,[],[],https://twitter.com/gabosantana35/status/1275827908125343744,False,,1,https://pbs.twimg.com/media/EbSmtnFXYAAzYiw.jpg,,,,,,,[],,,,
1275532343416107011,1275526481058422785,2020-06-23 16:53:03 Venezuela Standard Time,2020-06-23,16:53:03,-0400,216381984,gabosantana35,Gabriel Santana,,"Al ver esta denuncia un vecino nos mandó la foto de su tanque.  Así está llegando el agua al casco de Chacao.  Esa es el agua que consumen nuestros chamos y adultos mayores, un abuso total.  https://t.co/Z9rIlRqyDK",es,[],[],['https://pbs.twimg.com/media/EbOZ5eOXkAEiMcb.jpg'],2,9,8,[],[],https://twitter.com/gabosantana35/status/1275532343416107011,False,,1,https://pbs.twimg.com/media/EbOZ5eOXkAEiMcb.jpg,,,,,,,[],,,,
1275526621722746888,1275526481058422785,2020-06-23 16:30:19 Venezuela Standard Time,2020-06-23,16:30:19,-0400,216381984,gabosantana35,Gabriel Santana,,El 60% de los que han recibido agua denuncian que llega de mala calidad.   HIDROCAPITAL viola de manera sistemática nuestro derecho humano al agua.   ¡Ayúdanos a difundir!  @ChacaoAgua  https://t.co/JQ7qU2FdJL,es,"[{'screen_name': 'chacaoagua', 'name': 'chacao quiere agua', 'id': '3692234116'}]",[],['https://pbs.twimg.com/media/EbOUsd-WkAApkDc.jpg'],2,16,12,[],[],https://twitter.com/gabosantana35/status/1275526621722746888,False,,1,https://pbs.twimg.com/media/EbOUsd-WkAApkDc.jpg,,,,,,,[],,,,
1275526481058422785,1275526481058422785,2020-06-23 16:29:45 Venezuela Standard Time,2020-06-23,16:29:45,-0400,216381984,gabosantana35,Gabriel Santana,,El último mes ha sido crítico en nuestro municipio.  A 9 de cada 10 vecinos de Chacao les ha llegado el agua 1 vez o menos durante los últimos 30 días.  https://t.co/iIQLOX07g2,es,[],[],['https://pbs.twimg.com/media/EbOUkQjWsAEUXkz.jpg'],2,34,24,[],[],https://twitter.com/gabosantana35/status/1275526481058422785,False,,1,https://pbs.twimg.com/media/EbOUkQjWsAEUXkz.jpg,,,,,,,[],,,,
1274401100779700224,1274401100779700224,2020-06-20 13:57:54 Venezuela Standard Time,2020-06-20,13:57:54,-0400,216381984,gabosantana35,Gabriel Santana,,"Recorriendo el callejón Poleo de El Pedregal, llevando productos de limpieza, agua potable y comida.  Agradecido con todas las personas que nos han apoyado en esta iniciativa.  En estos momentos tan difíciles, que sea la solidaridad nuestra bandera.  https://t.co/3pkKhdoq3t",es,[],[],"['https://pbs.twimg.com/media/Ea-VCUxXkAcc4Hp.jpg', 'https://pbs.twimg.com/media/Ea-VCUwWoAECPOk.jpg']",1,6,18,[],[],https://twitter.com/gabosantana35/status/1274401100779700224,False,,1,https://pbs.twimg.com/media/Ea-VCUxXkAcc4Hp.jpg,,,,,,,[],,,,
1272969644748550144,1272969644748550144,2020-06-16 15:09:48 Venezuela Standard Time,2020-06-16,15:09:48,-0400,216381984,gabosantana35,Gabriel Santana,,"Primero Justicia es mucho más que una tarjeta.  Es su gente, sus valores y su convicciones. Estoy orgulloso de ser justiciero, y hoy más que nunca vamos a seguir luchando por recuperar la democracia en Venezuela.",es,[],[],[],1,42,54,[],[],https://twitter.com/gabosantana35/status/1272969644748550144,False,,0,,,,,,,,[],,,,
1272959669380755463,1272931610510450696,2020-06-16 14:30:10 Venezuela Standard Time,2020-06-16,14:30:10,-0400,216381984,gabosantana35,Gabriel Santana,,"@AnthonyAbellas @LaLiga @IVCNetworksVE @Gianfigliulo #IVCLaLiga El primero EuroGeta fue en la temporada 2007-2008. Donde nos eliminó el Bayern en cuartos de final.  También llegamos a Europa en la 2010-2011 y en esta temporada, donde eliminamos al Ajax y pronto haremos lo mismo con el Inter.",es,[],[],[],0,0,0,['ivclaliga'],[],https://twitter.com/gabosantana35/status/1272959669380755463,False,,0,,,,,,,,"[{'screen_name': 'AnthonyAbellas', 'name': 'Anthony Abellás', 'id': '111137670'}, {'screen_name': 'LaLiga', 'name': 'LaLiga', 'id': '423384542'}, {'screen_name': 'IVCNetworksVE', 'name': 'IVC Networks Venezuela', 'id': '4519902434'}, {'screen_name': 'Gianfigliulo', 'name': 'Giancarlo Figliulo', 'id': '75285628'}]",,,,
1270394004824301570,1270394004824301570,2020-06-09 12:35:08 Venezuela Standard Time,2020-06-09,12:35:08,-0400,216381984,gabosantana35,Gabriel Santana,,"La pregunta no debería ser si estás de acuerdo o no.  Aquí el tema es si es una propuesta viable.  Creo que si se propone algo así, se debería tener las capacidades para hacerlo, el resto, es decirle a la gente lo que quiere escuchar.",es,[],[],[],2,9,19,[],[],https://twitter.com/gabosantana35/status/1270394004824301570,False,https://twitter.com/VPITV/status/1270347017991176194,0,,,,,,,,[],,,,
1265427615839633408,1265427615839633408,2020-05-26 19:40:28 Venezuela Standard Time,2020-05-26,19:40:28,-0400,216381984,gabosantana35,Gabriel Santana,,Son millones de bolívares que gastan los vecinos cuando pagan un camión cisterna o compran bidones de agua potable. Todo para sustituir un servicio que hidrocapital no nos da.  En Venezuela pagamos el agua más cara del planeta.   #ChacaoQuiereAgua,es,[],[],[],0,21,17,['chacaoquiereagua'],[],https://twitter.com/gabosantana35/status/1265427615839633408,False,,0,,,,,,,,[],,,,
1265423857554505728,1265423857554505728,2020-05-26 19:25:32 Venezuela Standard Time,2020-05-26,19:25:32,-0400,216381984,gabosantana35,Gabriel Santana,,"Durante la cuarentena el único problema no ha sido la falta de agua, si no también la mala calidad con la que llega.  Los vecinos exigimos agua potable las 24 horas del día los 7 días de la semana.  #ChacaoQuiereAgua",es,[],[],[],0,17,15,['chacaoquiereagua'],[],https://twitter.com/gabosantana35/status/1265423857554505728,False,,0,,,,,,,,[],,,,
1265422308249911299,1265422308249911299,2020-05-26 19:19:23 Venezuela Standard Time,2020-05-26,19:19:23,-0400,216381984,gabosantana35,Gabriel Santana,,Cómo nos protegemos del COVID-19 si:  1- No tenemos agua para lavarnos las manos 2- Tenemos que ir a cargar agua rompiendo la cuarentena.  La falta de agua en Chacao atenta contra nuestra salud.  #ChacaoQuiereAgua,es,[],[],[],0,25,21,['chacaoquiereagua'],[],https://twitter.com/gabosantana35/status/1265422308249911299,False,,0,,,,,,,,[],,,,
1265420102746464257,1265420102746464257,2020-05-26 19:10:37 Venezuela Standard Time,2020-05-26,19:10:37,-0400,216381984,gabosantana35,Gabriel Santana,,"Los vecinos hoy celebraron porque llovió, es la única manera que tienen de ver agua durante semanas. ¿Estamos en el sigo XV o en el XXI?  Esto es lo que nos ha dejado el chavismo. #ChacaoQuiereAgua",es,[],[],[],0,40,35,['chacaoquiereagua'],[],https://twitter.com/gabosantana35/status/1265420102746464257,False,,0,,,,,,,,[],,,,
1265419304016756738,1265419304016756738,2020-05-26 19:07:27 Venezuela Standard Time,2020-05-26,19:07:27,-0400,216381984,gabosantana35,Gabriel Santana,,"La solución real a la crisis del agua no pasa por comprar unos camiones cisterna, pasa por invertir en el acueducto metropolitano para tener agua 24/7 como teníamos antes.  ¡Dejen de usar el agua como una herramienta de chantaje!  #ChacaoQuiereAgua",es,[],[],[],0,27,23,['chacaoquiereagua'],[],https://twitter.com/gabosantana35/status/1265419304016756738,False,,0,,,,,,,,[],,,,
1265418127678070790,1265418127678070790,2020-05-26 19:02:46 Venezuela Standard Time,2020-05-26,19:02:46,-0400,216381984,gabosantana35,Gabriel Santana,,"Según Monitor Ciudad, Chacao es el municipio que menos agua ha recibido en el área metropolitana de Caracas durante la cuarentena.  Es un castigo lo que sufrimos los vecinos de Chacao desde 2014.  #ChacaoQuiereAgua",es,[],[],[],3,46,36,['chacaoquiereagua'],[],https://twitter.com/gabosantana35/status/1265418127678070790,False,,0,,,,,,,,[],,,,
1265417701272535041,1265417701272535041,2020-05-26 19:01:04 Venezuela Standard Time,2020-05-26,19:01:04,-0400,216381984,gabosantana35,Gabriel Santana,,Comenzamos con el tuitazo #ChacaoQuiereAgua!  Denunciemos la crisis que vivimos día a día en nuestro municipio.,es,[],[],[],0,35,27,['chacaoquiereagua'],[],https://twitter.com/gabosantana35/status/1265417701272535041,False,,0,,,,,,,,[],,,,
1265286157534990336,1265286157534990336,2020-05-26 10:18:22 Venezuela Standard Time,2020-05-26,10:18:22,-0400,216381984,gabosantana35,Gabriel Santana,,"Vecinos! Hoy a las 7PM vamos con el tuitazo #ChacaoQuiereAgua.  Tenemos que presionar a HIDROCAPITAL.  Por el acueducto metropolitano deberían entrar 12mil litros de agua por segundo, hoy entra en promedio menos de 4mil e Hidrocapital es quien decide que zonas reciben y cuales no  https://t.co/tzv7n3zctf",es,[],[],['https://pbs.twimg.com/media/EY8zB4ZWsAExCXf.jpg'],8,52,37,['chacaoquiereagua'],[],https://twitter.com/gabosantana35/status/1265286157534990336,False,,1,https://pbs.twimg.com/media/EY8zB4ZWsAExCXf.jpg,,,,,,,[],,,,
1262736411305754626,1262736411305754626,2020-05-19 09:26:35 Venezuela Standard Time,2020-05-19,09:26:35,-0400,216381984,gabosantana35,Gabriel Santana,,"Creo que es muy importante agradecer.  Van más de 60 días de confinamiento y he tenido comida sobre la mesa y una familia con quien compartir.  Lastimosamente, esta no es la realidad de la mayoría de los venezolanos.",es,[],[],[],0,3,10,[],[],https://twitter.com/gabosantana35/status/1262736411305754626,False,,0,,,,,,,,[],,,,
1262531263589765121,1262530473118629904,2020-05-18 19:51:24 Venezuela Standard Time,2020-05-18,19:51:24,-0400,216381984,gabosantana35,Gabriel Santana,,"En la ciudad de Caracas, tan solo hay alrededor de 9 llenaderos de cisternas, ¿así piensan llevarle agua a toda la ciudad? No hay capacidad de abastecer. #CisternaNoEsSolución",es,[],[],[],0,4,7,['cisternanoessolución'],[],https://twitter.com/gabosantana35/status/1262531263589765121,False,,0,,,,,,,,[],,,,
1262531168907427841,1262530473118629904,2020-05-18 19:51:02 Venezuela Standard Time,2020-05-18,19:51:02,-0400,216381984,gabosantana35,Gabriel Santana,,"En un país #SinGasolina el #CisternaNoEsSolución, la crisis de servicios es una cadena, sin electricidad no hay bombeo de agua, sin gasolina no se puede mover una cisterna. Sin embargo, Maduro intenta burlarse de los venezolanos.",es,[],[],[],1,3,5,"['singasolina', 'cisternanoessolución']",[],https://twitter.com/gabosantana35/status/1262531168907427841,False,,0,,,,,,,,[],,,,
