id,conversation_id,created_at,date,time,timezone,user_id,username,name,place,tweet,language,mentions,urls,photos,replies_count,retweets_count,likes_count,hashtags,cashtags,link,retweet,quote_url,video,thumbnail,near,geo,source,user_rt_id,user_rt,retweet_id,reply_to,retweet_date,translate,trans_src,trans_dest
1087760235698229251,1087760235698229251,2019-01-22 13:13:44 Venezuela Standard Time,2019-01-22,13:13:44,-0400,216381984,gabosantana35,Gabriel Santana,,El 23 salimos y el 24 seguimos.  https://t.co/CmBO4YfXI0,es,[],[],['https://pbs.twimg.com/media/DxiAJvgXgAAI_C6.jpg'],0,7,3,[],[],https://twitter.com/gabosantana35/status/1087760235698229251,False,,1,https://pbs.twimg.com/media/DxiAJvgXgAAI_C6.jpg,,,,,,,[],,,,
1087745393105031168,1087745393105031168,2019-01-22 12:14:45 Venezuela Standard Time,2019-01-22,12:14:45,-0400,216381984,gabosantana35,Gabriel Santana,,Asamblea estudiantil en la Universiad Metropolitana. Organizándonos como comunidad para el 23 de Enero y futuras acciones.  https://t.co/UOmcO2tKxF,es,[],[],[],0,6,13,[],[],https://twitter.com/gabosantana35/status/1087745393105031168,False,,1,https://pbs.twimg.com/ext_tw_video_thumb/1087745213844594688/pu/img/bYv5_A-meQXx4I3W.jpg,,,,,,,[],,,,
1087527511561551878,1087527511561551878,2019-01-21 21:48:58 Venezuela Standard Time,2019-01-21,21:48:58,-0400,216381984,gabosantana35,Gabriel Santana,,"Después del cabildo en Chacao me quedó algo muy claro, este país nos pertenece y no descansaremos hasta recuperarlo.  https://t.co/0p1RA6pVdw",es,[],[],"['https://pbs.twimg.com/media/DxesfWMX0AAX4vZ.jpg', 'https://pbs.twimg.com/media/DxesfWMWsAAqD3O.jpg']",0,6,17,[],[],https://twitter.com/gabosantana35/status/1087527511561551878,False,,1,https://pbs.twimg.com/media/DxesfWMX0AAX4vZ.jpg,,,,,,,[],,,,
1087392138437054465,1087392138437054465,2019-01-21 12:51:03 Venezuela Standard Time,2019-01-21,12:51:03,-0400,216381984,gabosantana35,Gabriel Santana,,Este #23Ene saldremos de 10 puntos dn el área Metropolitana: Plaza Las Américas  Plaza Madariaga CC Millenium CC Unicentro El Márquez  Santa Fe Puente Nueva Granada  Avenida Victoria  Torre Exa av. Libertador  Cotiza  #NosVemosEl23,es,[],[],[],0,6,8,"['23ene', 'nosvemosel23']",[],https://twitter.com/gabosantana35/status/1087392138437054465,False,,0,,,,,,,,[],,,,
1087132116293468160,1087132116293468160,2019-01-20 19:37:49 Venezuela Standard Time,2019-01-20,19:37:49,-0400,216381984,gabosantana35,Gabriel Santana,,Nos vemos mañana a las 5:30pm en la plaza Los Palos Grandes para el Cabildo Abierto junto a nuestros diputados.  ¡Te esperamos!  https://t.co/5lizcJXw2o,es,[],[],['https://pbs.twimg.com/media/DxZE4azWoAAfMkC.jpg'],0,8,9,[],[],https://twitter.com/gabosantana35/status/1087132116293468160,False,,1,https://pbs.twimg.com/media/DxZE4azWoAAfMkC.jpg,,,,,,,[],,,,
1086744020024549377,1086744020024549377,2019-01-19 17:55:39 Venezuela Standard Time,2019-01-19,17:55:39,-0400,216381984,gabosantana35,Gabriel Santana,,"Cada día veo más esperanza en la calle. Hoy recorrimos el Pedregal, el Tártago y Barrio Nuevo invitando para este 23 de Enero.   ¿Tú cómo sientes los ánimos?  https://t.co/QY4Ui7Qoqy",es,[],[],['https://pbs.twimg.com/media/DxTj6gKW0AIjLUV.jpg'],0,1,11,[],[],https://twitter.com/gabosantana35/status/1086744020024549377,False,,1,https://pbs.twimg.com/media/DxTj6gKW0AIjLUV.jpg,,,,,,,[],,,,
1086402576730521600,1086402576730521600,2019-01-18 19:18:53 Venezuela Standard Time,2019-01-18,19:18:53,-0400,216381984,gabosantana35,Gabriel Santana,,Ayer denunciamos en el ministerio de aguas como hay edificios en 7 zonas de Chacao que solo han recibido horas de agua en lo que va del 2019.  Esto es una violación a nuestros derechos y seguiremos presionando hasta que se restituya el servicio.  https://t.co/VmG59ina3K,es,[],[],[],0,15,11,[],[],https://twitter.com/gabosantana35/status/1086402576730521600,False,,1,https://pbs.twimg.com/ext_tw_video_thumb/1086400594468847617/pu/img/F98nW9DQ7YG52HNm.jpg,,,,,,,[],,,,
1086377347845115905,1086377347845115905,2019-01-18 17:38:38 Venezuela Standard Time,2019-01-18,17:38:38,-0400,216381984,gabosantana35,Gabriel Santana,,"La USB tiene 53 días sin agua. Como no pueden ver clase en su universidad, lo hacen en la puerta de HIDROCAPITAL.  ¡Grandes!  @FCEUSB  https://t.co/2rUKX1GpZN",es,"[{'screen_name': 'fceusb', 'name': 'fceusb', 'id': '51412475'}]",[],['https://pbs.twimg.com/media/DxOWbLcX0AA8dFg.jpg'],1,3,4,[],[],https://twitter.com/gabosantana35/status/1086377347845115905,False,,1,https://pbs.twimg.com/media/DxOWbLcX0AA8dFg.jpg,,,,,,,[],,,,
1086011795507216386,1086011795507216386,2019-01-17 17:26:03 Venezuela Standard Time,2019-01-17,17:26:03,-0400,216381984,gabosantana35,Gabriel Santana,,.@contrapuntovzla “Solo 107 horas de agua han recibido 7 sectores de Chacao en lo que va de año”  https://t.co/7KKa9Za7oC  https://t.co/jWdFVByYX5,es,"[{'screen_name': 'contrapuntovzla', 'name': 'contrapunto', 'id': '2400260346'}]",['http://contrapunto.com/mobile/noticia/solo-107-horas-de-agua-han-recibido-7-sectores-de-chacao-en-lo-que-va-de-ano-241714/'],['https://pbs.twimg.com/media/DxJJ91qX4AAeIfe.jpg'],0,2,3,[],[],https://twitter.com/gabosantana35/status/1086011795507216386,False,,1,https://pbs.twimg.com/media/DxJJ91qX4AAeIfe.jpg,,,,,,,[],,,,
1086002827225432066,1086001741622059009,2019-01-17 16:50:25 Venezuela Standard Time,2019-01-17,16:50:25,-0400,216381984,gabosantana35,Gabriel Santana,,El racionamiento de agua es una estrategia de Maduro.  ¿Quieres agua todos los días?  Nos vemos este 23 de Enero en la calle.  https://t.co/Y3sUHIvleh,es,[],[],['https://pbs.twimg.com/media/DxJBziUWkAEYPre.jpg'],1,3,3,[],[],https://twitter.com/gabosantana35/status/1086002827225432066,False,,1,https://pbs.twimg.com/media/DxJBziUWkAEYPre.jpg,,,,,,,[],,,,
1086002353482989569,1086001741622059009,2019-01-17 16:48:32 Venezuela Standard Time,2019-01-17,16:48:32,-0400,216381984,gabosantana35,Gabriel Santana,,Así de poca ha llegado el agua a las calles de Chacao: Calle Monseñor Juan Grilc: 0 horas.  Av. Andrés Bello: 6 horas.  1ra Av. de Los Palos Grandes: 6 horas.  Calle Páez: 10 horas.  Av. Mohedano: 12 horas.  Calle Sucre: 36 horas.  Calle 3 de Campo Alegre: 36 horas.  https://t.co/iVDXiRkBZm,es,[],[],['https://pbs.twimg.com/media/DxJBX6fWoAAim1G.jpg'],3,3,3,[],[],https://twitter.com/gabosantana35/status/1086002353482989569,False,,1,https://pbs.twimg.com/media/DxJBX6fWoAAim1G.jpg,,,,,,,[],,,,
1086001741622059009,1086001741622059009,2019-01-17 16:46:06 Venezuela Standard Time,2019-01-17,16:46:06,-0400,216381984,gabosantana35,Gabriel Santana,,Hoy denunciamos ante el ministerio de aguas que en lo que va del 2019 tenemos zonas de Chacao que no han recibido una gota de agua.  https://t.co/g7gv7Xi1Vl,es,[],[],['https://pbs.twimg.com/media/DxJA0UXW0AMCOzd.jpg'],1,12,10,[],[],https://twitter.com/gabosantana35/status/1086001741622059009,False,,1,https://pbs.twimg.com/media/DxJA0UXW0AMCOzd.jpg,,,,,,,[],,,,
1084248241280028672,1084248241280028672,2019-01-12 20:38:19 Venezuela Standard Time,2019-01-12,20:38:19,-0400,216381984,gabosantana35,Gabriel Santana,,"Conversando con nuestros vecinos en el mercado de Los Palos Grandes.  El 2019 va a ser un año complejo, tenemos que afrontarlo con energía y convencidos de que podemos cambiar nuestra realidad.  https://t.co/pnkW28E7i9",es,[],[],"['https://pbs.twimg.com/media/DwwGAKTX0AA9UbY.jpg', 'https://pbs.twimg.com/media/DwwGAKRX4AEE4UQ.jpg']",0,3,5,[],[],https://twitter.com/gabosantana35/status/1084248241280028672,False,,1,https://pbs.twimg.com/media/DwwGAKTX0AA9UbY.jpg,,,,,,,[],,,,
1083889119930052608,1083889119930052608,2019-01-11 20:51:18 Venezuela Standard Time,2019-01-11,20:51:18,-0400,216381984,gabosantana35,Gabriel Santana,,"Yo, Gabriel Santana me apego a los artículos 333, 350 y 233 para lograr el cese de la usurpación y convocar elecciones libres con la unión del pueblo, FAN y comunidad internacional #ANRutaPorLaLibertad",es,[],[],[],0,7,3,['anrutaporlalibertad'],[],https://twitter.com/gabosantana35/status/1083889119930052608,False,https://twitter.com/pedro_mendez_d/status/1083874099821273089,0,,,,,,,,[],,,,
1083886256688455683,1083886256688455683,2019-01-11 20:39:55 Venezuela Standard Time,2019-01-11,20:39:55,-0400,216381984,gabosantana35,Gabriel Santana,,"Cada día que pasa leo menos Twitter y escucho más a la gente. Y capaz esté equivocado, pero hoy sentí una esperanza que hace más de un año que no veía en los venezolanos. Queda un largo camino, pero vamos pa lante!  https://t.co/ox7g241AXN",es,[],[],['https://pbs.twimg.com/media/Dwq8gWrXQAAUEaM.jpg'],0,8,14,[],[],https://twitter.com/gabosantana35/status/1083886256688455683,False,,1,https://pbs.twimg.com/media/Dwq8gWrXQAAUEaM.jpg,,,,,,,[],,,,
1083188456380092416,1083188456380092416,2019-01-09 22:27:07 Venezuela Standard Time,2019-01-09,22:27:07,-0400,216381984,gabosantana35,Gabriel Santana,,Dime de que hablas y te diré de lo que careces.  https://t.co/83kZ2Ar6w3,es,[],[],['https://pbs.twimg.com/media/DwhB_REWkAA_ewL.jpg'],1,15,11,[],[],https://twitter.com/gabosantana35/status/1083188456380092416,False,,1,https://pbs.twimg.com/media/DwhB_REWkAA_ewL.jpg,,,,,,,[],,,,
1063438406615789571,1063438406615789571,2018-11-16 10:27:28 Venezuela Standard Time,2018-11-16,10:27:28,-0400,216381984,gabosantana35,Gabriel Santana,,"En la presentación de @NoMasGuiso del resumen ejecutivo de las Empresas del Estado.  10 años de opacidad, decadencia y destrucción.  https://t.co/YONpDRn6eH",es,"[{'screen_name': 'nomasguiso', 'name': 'transparencia vzla', 'id': '317207625'}]",[],['https://pbs.twimg.com/media/DsIXlDTW0AQX6TC.jpg'],0,3,8,[],[],https://twitter.com/gabosantana35/status/1063438406615789571,False,,1,https://pbs.twimg.com/media/DsIXlDTW0AQX6TC.jpg,,,,,,,[],,,,
1063080094128844800,1063080094128844800,2018-11-15 10:43:40 Venezuela Standard Time,2018-11-15,10:43:40,-0400,216381984,gabosantana35,Gabriel Santana,,Hoy acompañando a los familiares del diputado Requesens y los demás presos políticos. Hoy el Juan cumple 100 dias secuestrado.  https://t.co/y19BGTWGcj,es,[],[],['https://pbs.twimg.com/media/DsDRppbX0AAlUFt.jpg'],0,4,7,[],[],https://twitter.com/gabosantana35/status/1063080094128844800,False,,1,https://pbs.twimg.com/media/DsDRppbX0AAlUFt.jpg,,,,,,,[],,,,
1062474339419934720,1062474339419934720,2018-11-13 18:36:36 Venezuela Standard Time,2018-11-13,18:36:36,-0400,216381984,gabosantana35,Gabriel Santana,,"Chacao, en tu cumpleaños 27 te prometemos seguir en la lucha hasta que logremos tener el municipio y el país que nos merecemos!  https://t.co/s2CLf1hhYf",es,[],[],['https://pbs.twimg.com/media/Dr6quv6XcAUq83U.jpg'],0,3,0,[],[],https://twitter.com/gabosantana35/status/1062474339419934720,False,,1,https://pbs.twimg.com/media/Dr6quv6XcAUq83U.jpg,,,,,,,[],,,,
1061628601391636480,1061628601391636480,2018-11-11 10:35:57 Venezuela Standard Time,2018-11-11,10:35:57,-0400,216381984,gabosantana35,Gabriel Santana,,Hoy recorrimos el mercado de la calle el muñeco y el mercado municipal de Chacao.  En estos recorridos hacemos 2 cosas: 1. Darle los consejos prácticos para potabilizar el agua a nuestros vecinos.  2. Recordarles que el responsable de que el agua llegue sucia es HIDROCAPITAL.  https://t.co/rIAe6Zcix1,es,[],[],"['https://pbs.twimg.com/media/Drupj9yWoAIXer4.jpg', 'https://pbs.twimg.com/media/Drupj9yXQAEBs_s.jpg']",2,4,2,[],[],https://twitter.com/gabosantana35/status/1061628601391636480,False,,1,https://pbs.twimg.com/media/Drupj9yWoAIXer4.jpg,,,,,,,[],,,,
1059590601321168896,1059590601321168896,2018-11-05 19:37:40 Venezuela Standard Time,2018-11-05,19:37:40,-0400,216381984,gabosantana35,Gabriel Santana,,"La semana pasada estuvimos en Petare, conversando con los vecinos de San Isidro sobre la crisis del agua.  Este problema, como casi todos, afecta a cada uno de los venezolanos. ¿La solución? El cambio de gobierno.  https://t.co/I787Lpc9pV",es,[],[],[],0,5,10,[],[],https://twitter.com/gabosantana35/status/1059590601321168896,False,,1,https://pbs.twimg.com/ext_tw_video_thumb/1059589348881039360/pu/img/Z3kiYbWnvvquL-q-.jpg,,,,,,,[],,,,
1059199682486984705,1059199682486984705,2018-11-04 17:44:17 Venezuela Standard Time,2018-11-04,17:44:17,-0400,216381984,gabosantana35,Gabriel Santana,,"Ayer recorrimos los mercados a cielo abierto de Bello Campo, dándole a nuestros vecinos los consejos para potabilizar el agua.  https://t.co/rq8BJdVqjm",es,[],[],"['https://pbs.twimg.com/media/DrMEA1UWwAEbVHK.jpg', 'https://pbs.twimg.com/media/DrMEA1MWkAAptZA.jpg']",0,1,0,[],[],https://twitter.com/gabosantana35/status/1059199682486984705,False,,1,https://pbs.twimg.com/media/DrMEA1UWwAEbVHK.jpg,,,,,,,[],,,,
1058837303546789888,1058837303546789888,2018-11-03 17:44:20 Venezuela Standard Time,2018-11-03,17:44:20,-0400,216381984,gabosantana35,Gabriel Santana,,Hoy denunciamos el colapso en Chacao por culpa de las colas para echar gasolina.  Es una burla que en el país con las reservas de petróleo más grandes de la región suceda esto.  https://t.co/hWx1lFkRkB,es,[],[],"['https://pbs.twimg.com/media/DrG-5HCX4AIvuLA.jpg', 'https://pbs.twimg.com/media/DrG-5HOW4AAS1pb.jpg']",0,5,7,[],[],https://twitter.com/gabosantana35/status/1058837303546789888,False,,1,https://pbs.twimg.com/media/DrG-5HCX4AIvuLA.jpg,,,,,,,[],,,,
1058765193977778181,1058765193977778181,2018-11-03 12:57:47 Venezuela Standard Time,2018-11-03,12:57:47,-0400,216381984,gabosantana35,Gabriel Santana,,"Desde el jueves vemos colas y colas en Caracas para echar gasolina, donde cada venezolano tiene que esperar 2 horas para poder llenar el tanque.  Este problema se suma a la falta de agua, luz, transporte, gas, medicinas y comida. Un colapso total de los servicios públicos.  https://t.co/bfOs5uB1eX",es,[],[],[],34,114,56,[],[],https://twitter.com/gabosantana35/status/1058765193977778181,False,,1,https://pbs.twimg.com/ext_tw_video_thumb/1058764413199572995/pu/img/GEQKS6n0RHk9Ng0N.jpg,,,,,,,[],,,,
1058134411508637696,1058134411508637696,2018-11-01 19:11:17 Venezuela Standard Time,2018-11-01,19:11:17,-0400,216381984,gabosantana35,Gabriel Santana,,"Hoy estuvimos en Petare, en el sector San Isidro. Conversando con los vecinos de la zona sobre la crisis del agua y las propuestas para enfrentarla.  Agradecido con la Asamblea Nacional, la diputado @manuelabolivar y el concejal @RafaDelRosario por la invitación.  https://t.co/mNZuhbcHSw",es,"[{'screen_name': 'manuelabolivar', 'name': 'manuela bolívar', 'id': '41575911'}, {'screen_name': 'rafadelrosario', 'name': 'rafael del rosario', 'id': '58899744'}]",[],['https://pbs.twimg.com/media/Dq8_oZvXgAIYKbq.jpg'],0,6,8,[],[],https://twitter.com/gabosantana35/status/1058134411508637696,False,,1,https://pbs.twimg.com/media/Dq8_oZvXgAIYKbq.jpg,,,,,,,[],,,,
1057037443222904832,1057037443222904832,2018-10-29 18:32:19 Venezuela Standard Time,2018-10-29,18:32:19,-0400,216381984,gabosantana35,Gabriel Santana,,Comparto con ustedes la reflexión final en el programa de Ricardo Rico.  Tenemos que convertir los problemas de los venezolanos en el principal motor para lograr el cambio político en el país.  https://t.co/PJT9aqq1ez,es,[],[],[],1,5,10,[],[],https://twitter.com/gabosantana35/status/1057037443222904832,False,,1,https://pbs.twimg.com/ext_tw_video_thumb/1057037037617008643/pu/img/fpa2lPl628wWf-PH.jpg,,,,,,,[],,,,
1054730086161829888,1054730086161829888,2018-10-23 09:43:43 Venezuela Standard Time,2018-10-23,09:43:43,-0400,216381984,gabosantana35,Gabriel Santana,,"Ayer por culpa de las lluvias se le inundó la casa a la señora Aura, perdió mucha de su ropa. Todos los que puedan ayudar escríbanos!  https://t.co/sScAirfTni",es,[],[],[],0,15,6,[],[],https://twitter.com/gabosantana35/status/1054730086161829888,False,,1,https://pbs.twimg.com/ext_tw_video_thumb/1054729762961309696/pu/img/nLeYmVUbjh6Gugd7.jpg,,,,,,,[],,,,
1054512424303378433,1054512424303378433,2018-10-22 19:18:48 Venezuela Standard Time,2018-10-22,19:18:48,-0400,216381984,gabosantana35,Gabriel Santana,,Ya lo decíamos hace unas semanas y hoy el colapso de la ciudad lo ratifica.  Lo caraqueños queremos inversión en soluciones reales y no en adornos y decoración.  https://t.co/00UTZSjd14,es,[],[],[],0,9,3,[],[],https://twitter.com/gabosantana35/status/1054512424303378433,False,,1,https://pbs.twimg.com/ext_tw_video_thumb/1054512140449734657/pu/img/vmauwbldmsMsBsJ1.jpg,,,,,,,[],,,,
1054497032717639680,1054497032717639680,2018-10-22 18:17:38 Venezuela Standard Time,2018-10-22,18:17:38,-0400,216381984,gabosantana35,Gabriel Santana,,Más claro imposible.  https://t.co/yYWotRgyFC,es,[],[],['https://pbs.twimg.com/media/DqJTdU0WwAIG4rh.jpg'],0,9,3,[],[],https://twitter.com/gabosantana35/status/1054497032717639680,False,,1,https://pbs.twimg.com/media/DqJTdU0WwAIG4rh.jpg,,,,,,,[],,,,
1054491897669009408,1054491897669009408,2018-10-22 17:57:14 Venezuela Standard Time,2018-10-22,17:57:14,-0400,216381984,gabosantana35,Gabriel Santana,,"Así está la autopista Francisco Fajardo a la altura de Altamira, Chacao.  Una ciudad que se paraliza con la lluvia y el gobierno invirtiendo en maticas y pintando aceras.  https://t.co/mxT8jqq9D1",es,[],[],[],5,47,28,[],[],https://twitter.com/gabosantana35/status/1054491897669009408,False,,1,https://pbs.twimg.com/ext_tw_video_thumb/1054491108590452740/pu/img/Jh4cxzmXEweIRHVo.jpg,,,,,,,[],,,,
1053742947051757568,1053742947051757568,2018-10-20 16:21:10 Venezuela Standard Time,2018-10-20,16:21:10,-0400,216381984,gabosantana35,Gabriel Santana,,No se puede ser tan cara dura!  Todos los apagones son responsabilidad de la incompetencia y guisos que caracterizan al gobierno,es,[],[],[],0,2,0,[],[],https://twitter.com/gabosantana35/status/1053742947051757568,False,https://twitter.com/NTN24ve/status/1053728698594136065,0,,,,,,,,[],,,,
1053096343735017473,1053096343735017473,2018-10-18 21:31:48 Venezuela Standard Time,2018-10-18,21:31:48,-0400,216381984,gabosantana35,Gabriel Santana,,"El gran reto que tenemos los Venezolanos es lograr convertir la hiperinflación, la falta de servicios públicos, la escasez y los otros factores de nuestra crisis en el motor que impulse el cambio político en Venezuela.  https://t.co/JG09KE6zXM",es,[],[],['https://pbs.twimg.com/media/Dp1ZfD4XgAAT_1G.jpg'],0,8,12,[],[],https://twitter.com/gabosantana35/status/1053096343735017473,False,,1,https://pbs.twimg.com/media/Dp1ZfD4XgAAT_1G.jpg,,,,,,,[],,,,
1052890779725819904,1052890779725819904,2018-10-18 07:54:58 Venezuela Standard Time,2018-10-18,07:54:58,-0400,216381984,gabosantana35,Gabriel Santana,,"Los consejos para potabilizar el agua no son resignación, es resistencia mientras seguimos la presión a HIDROCAPITAL para que se restituya el servicio y mejore la calidad del agua.  https://t.co/yBYbFuO69r",es,[],[],[],0,10,5,[],[],https://twitter.com/gabosantana35/status/1052890779725819904,False,,1,https://pbs.twimg.com/ext_tw_video_thumb/1052890397159108608/pu/img/4QXJDT6tjYuCloRB.jpg,,,,,,,[],,,,
1052738665934249984,1052738665934249984,2018-10-17 21:50:31 Venezuela Standard Time,2018-10-17,21:50:31,-0400,216381984,gabosantana35,Gabriel Santana,,¿Qué hacer para mejorar el agua que llega a nuestras casas? Hoy comenzamos una campaña para darle a nuestros vecinos consejos prácticos de como potabilizar el agua.  ¿Nos quieres ayudar a difundir esta información? ¡Escríbeme!  https://t.co/j9LumcdWjK,es,[],[],"['https://pbs.twimg.com/media/DpwUNROXgAA927I.jpg', 'https://pbs.twimg.com/media/DpwUNRPW4AA4vm2.jpg', 'https://pbs.twimg.com/media/DpwUNRoXoAA10IF.jpg']",0,5,4,[],[],https://twitter.com/gabosantana35/status/1052738665934249984,False,,1,https://pbs.twimg.com/media/DpwUNROXgAA927I.jpg,,,,,,,[],,,,
1052697794505531392,1052697794505531392,2018-10-17 19:08:07 Venezuela Standard Time,2018-10-17,19:08:07,-0400,216381984,gabosantana35,Gabriel Santana,,"La poca agua que llega a nuestras casas lo hace turbia o marrón. Aquí les dejamos unos consejos para potabilizarla de forma casera, ayúdenos a difundirlos!  https://t.co/zyIqZV14f2",es,[],[],['https://pbs.twimg.com/media/DpvvDXcXcAA5Az6.jpg'],2,80,43,[],[],https://twitter.com/gabosantana35/status/1052697794505531392,False,,1,https://pbs.twimg.com/media/DpvvDXcXcAA5Az6.jpg,,,,,,,[],,,,
1050535816462782464,1050535185635262465,2018-10-11 19:57:11 Venezuela Standard Time,2018-10-11,19:57:11,-0400,216381984,gabosantana35,Gabriel Santana,,"Los apagones se han vuelto casi diarios en Chacao, en menos de lo que esperamos CORPOELEC nos dará un calendario de racionamiento como el de HIDROCAPITAL.  Tenemos que ejercer una presión ciudadana real para que esto no suceda!",es,[],[],[],1,4,5,[],[],https://twitter.com/gabosantana35/status/1050535816462782464,False,,0,,,,,,,,[],,,,
1050535185635262465,1050535185635262465,2018-10-11 19:54:40 Venezuela Standard Time,2018-10-11,19:54:40,-0400,216381984,gabosantana35,Gabriel Santana,,"De nuevo varias zonas de Chacao sin servicio eléctrico.  Hay reportes de la calle Paez, Av. Uslar Pietri y calle Bolívar. Cada día más deficiente el servicio de CORPOELEC en nuestro municipio y toda Caracas.",es,[],[],[],3,14,6,[],[],https://twitter.com/gabosantana35/status/1050535185635262465,False,,0,,,,,,,,[],,,,
1049814401572904960,1049814401572904960,2018-10-09 20:10:32 Venezuela Standard Time,2018-10-09,20:10:32,-0400,216381984,gabosantana35,Gabriel Santana,,Fernando Albán tiene que ser fuerza para seguir luchando por Venezuela.  https://t.co/kQbkxC6c2A,es,[],[],['https://pbs.twimg.com/media/DpGwl3eX4AACwMD.jpg'],0,1,2,[],[],https://twitter.com/gabosantana35/status/1049814401572904960,False,,1,https://pbs.twimg.com/media/DpGwl3eX4AACwMD.jpg,,,,,,,[],,,,
1049796578456801280,1049796578456801280,2018-10-09 18:59:43 Venezuela Standard Time,2018-10-09,18:59:43,-0400,216381984,gabosantana35,Gabriel Santana,,Nos vemos mañana.  https://t.co/mn831VSIFh,es,[],[],['https://pbs.twimg.com/media/DpGgahmWkAAdAQp.jpg'],0,1,1,[],[],https://twitter.com/gabosantana35/status/1049796578456801280,False,,1,https://pbs.twimg.com/media/DpGgahmWkAAdAQp.jpg,,,,,,,[],,,,
1049404993277702144,1049404993277702144,2018-10-08 17:03:42 Venezuela Standard Time,2018-10-08,17:03:42,-0400,216381984,gabosantana35,Gabriel Santana,,"Con el corazón roto por el asesinato de Fernando Alban. Ninguna muerte puede ser en vano. Vamos a cambiar a Venezuela, luchemos por la justicia.",es,[],[],[],1,12,6,[],[],https://twitter.com/gabosantana35/status/1049404993277702144,False,,0,,,,,,,,[],,,,
1049080985751568390,1049080985751568390,2018-10-07 19:36:12 Venezuela Standard Time,2018-10-07,19:36:12,-0400,216381984,gabosantana35,Gabriel Santana,,Sin luz y sin agua. Así está gran parte de Chacao.  El colapso de los servicios públicos muestra día a día la ineficiencia e incapacidad que tiene el gobierno para resolver los problemas de los venezolanos.,es,[],[],[],0,20,13,[],[],https://twitter.com/gabosantana35/status/1049080985751568390,False,,0,,,,,,,,[],,,,
1047215683463987200,1047215683463987200,2018-10-02 16:04:09 Venezuela Standard Time,2018-10-02,16:04:09,-0400,216381984,gabosantana35,Gabriel Santana,,"Estamos buscando técnicas caseras para mejorar la calidad del agua y desarrollar una guía para nuestros vecinos.  Si tienes algún consejo, mándanoslo para incluirlo!",es,[],[],[],0,6,9,[],[],https://twitter.com/gabosantana35/status/1047215683463987200,False,,0,,,,,,,,[],,,,
1047204202584444929,1047204202584444929,2018-10-02 15:18:32 Venezuela Standard Time,2018-10-02,15:18:32,-0400,216381984,gabosantana35,Gabriel Santana,,"Hoy a las 4pm estaré en Radio Sintonía 1420AM, para conversar sobre la Crisis del Agua que vivimos en Chacao y la denuncia que hicimos hace unos días sobre la calidad del agua que llega a nuestras casas.",es,[],[],[],1,4,2,[],[],https://twitter.com/gabosantana35/status/1047204202584444929,False,,0,,,,,,,,[],,,,
1046837095451557890,1046154771386773504,2018-10-01 14:59:47 Venezuela Standard Time,2018-10-01,14:59:47,-0400,216381984,gabosantana35,Gabriel Santana,,@Caalpeel Los estamos desarrollando y diseñando una infografía para poder subirlo en las redes. Apenas estén listos se los mando. Saludos!,es,[],[],[],1,0,1,[],[],https://twitter.com/gabosantana35/status/1046837095451557890,False,,0,,,,,,,,"[{'screen_name': 'Caalpeel', 'name': 'Carlos Peláez', 'id': '845828618'}]",,,,
1046793507434827777,1046793507434827777,2018-10-01 12:06:35 Venezuela Standard Time,2018-10-01,12:06:35,-0400,216381984,gabosantana35,Gabriel Santana,,"En minutos estaré en Tu voz en la radio por @Radio_Comunidad, para conversar sobre nuestra denuncia de la calidad del agua que está llegando a Chacao.",es,"[{'screen_name': 'radio_comunidad', 'name': 'radiocomunidad.com', 'id': '220721801'}]",[],[],1,1,4,[],[],https://twitter.com/gabosantana35/status/1046793507434827777,False,,0,,,,,,,,[],,,,
1046154771386773504,1046154771386773504,2018-09-29 17:48:28 Venezuela Standard Time,2018-09-29,17:48:28,-0400,216381984,gabosantana35,Gabriel Santana,,#DENUNCIA  Así está llegando el agua a nuestro municipio Chacao. Esto es una violación de nuestro derecho al agua y a la salud.  Ayúdanos a visibilizar esta denuncia compartiendo este vídeo.  https://t.co/33eKnkVuq7,es,[],[],[],8,76,50,['denuncia'],[],https://twitter.com/gabosantana35/status/1046154771386773504,False,,1,https://pbs.twimg.com/ext_tw_video_thumb/1046153714380296192/pu/img/fBNqFus5Q9NM_r9y.jpg,,,,,,,[],,,,
1046108702800060416,1046108702800060416,2018-09-29 14:45:25 Venezuela Standard Time,2018-09-29,14:45:25,-0400,216381984,gabosantana35,Gabriel Santana,,Agradecido con @jesusarmasccs por el espacio en @RCR750 para denunciar la Crisis de servicios públicos que vivimos en Chacao y toda el área metropolitana.,es,"[{'screen_name': 'jesusarmasccs', 'name': 'jesús armas', 'id': '48170205'}, {'screen_name': 'rcr750', 'name': 'radio caracas radio', 'id': '70879905'}]",[],[],0,0,1,[],[],https://twitter.com/gabosantana35/status/1046108702800060416,False,,0,,,,,,,,[],,,,
