tweet,tweet_tokenized,tweet_translated,tweet_translated_tokenized
Eficiencia o nada ¿no? Hasta para invitarte a seguirlos en Twitter se equivocan  http://t.co/DWBFYZ9E4W,"['eficiencia', '¿no', 'invitarte', 'seguirlos', 'twitter', 'equivocan']",Efficiency or nothing right? Even to invite you to follow them on Twitter they are wrong http://t.co/DWBFYZ9E4W,"['efficiency', 'nothing', 'right', 'even', 'invite', 'follow', 'twitter', 'wrong']"
"Pasaron a la sala todas las personas que van a dejar entrar, dicen que ahora si debe empezar la audiencia","['pasaron', 'sala', 'todas', 'personas', 'van', 'dejar', 'entrar', 'dicen', 'ahora', 'si', 'debe', 'empezar', 'audiencia']","All the people who are going to let in, they say that now if the hearing should begin","['people', 'going', 'let', 'say', 'hearing', 'begin']"
"Inicialmente habían dicho que podrían ingresar como ""audiencia"" 20 personas al juicio ahora no las dejan pasar alegando ""razones de espacio""","['inicialmente', 'dicho', 'podrían', 'ingresar', 'audiencia', 'personas', 'juicio', 'ahora', 'dejan', 'pasar', 'alegando', 'razones', 'espacio']","Initially, they had said that 20 people could enter the trial as a ""hearing"", now they are not allowed to pass, citing ""space reasons.""","['initially', 'said', 'people', 'could', 'enter', 'trial', 'hearing', 'allowed', 'pass', 'citing', 'space', 'reasons']"
"También negaron otras 5 solicitudes, entre ellas una sobre la publicidad del juicio y acceso a medios y otra de diferimiento de la audiencia","['negaron', 'solicitudes', 'publicidad', 'juicio', 'acceso', 'medios', 'diferimiento', 'audiencia']","They also denied another 5 requests, including one about publicity of the trial and access to the media and another for deferral of the hearing","['also', 'denied', 'another', 'requests', 'including', 'one', 'publicity', 'trial', 'access', 'media', 'another', 'deferral', 'hearing']"
"Temprano en la mañana negaron la recusación de la Juez, argumentan que es ""extemporánea"" pese a que se hizo en el lapso pertinente","['temprano', 'mañana', 'negaron', 'recusación', 'juez', 'argumentan', 'extemporánea', 'pese', 'hizo', 'lapso', 'pertinente']","Early in the morning they denied the judge's challenge, arguing that it is ""untimely"" despite the fact that it was done in the relevant period.","['early', 'morning', 'denied', 'judge', 'challenge', 'arguing', 'untimely', 'despite', 'fact', 'done', 'relevant', 'period']"
"Esperamos por la Juez, que aún no ha bajado","['esperamos', 'juez', 'aún', 'bajado']","We wait for the Judge, who has not yet come down","['wait', 'judge', 'yet', 'come']"
"Ya entró a la Sala la defensa, no dejan entrar a parte de las personas que estaban en la lista como público a la audiencia","['entró', 'sala', 'defensa', 'dejan', 'entrar', 'parte', 'personas', 'lista', 'público', 'audiencia']","The defense has already entered the Chamber, they do not allow part of the people who were on the list as public to the audience","['defense', 'already', 'entered', 'chamber', 'allow', 'part', 'people', 'list', 'public', 'audience']"
"La audiencia de juicio de @leopoldolopez, Marco, Christian, Angel y Damián está por empezar. Largos retrasos sin justificación","['audiencia', 'juicio', 'leopoldolopez', 'marco', 'christian', 'angel', 'damián', 'empezar', 'largos', 'retrasos', 'justificación']","The trial hearing of @leopoldolopez, Marco, Christian, Angel and Damián is about to begin. Long delays without justification","['trial', 'hearing', 'leopoldolopez', 'marco', 'christian', 'angel', 'damián', 'begin', 'long', 'delays', 'without', 'justification']"
@Vzla_21 Gracias!,"['vzla', 'gracias']",@ Vzla_21 Thank you!,"['vzla', 'thank']"
"Si en verdad lo fueran... ¿por que habría que asegurarlo? ""@noticierovv: Ortega asegura que fiscales del Min. Público son independientes""","['si', 'verdad', '¿por', 'asegurarlo', 'noticierovv', 'ortega', 'asegura', 'fiscales', 'min', 'público', 'independientes']","If they really were ... why should it be ensured? ""@noticierovv: Ortega assures that Public Ministry prosecutors are independent""","['really', 'ensured', 'noticierovv', 'ortega', 'assures', 'public', 'ministry', 'prosecutors', 'independent']"
"Una ventana más que cierran por pensar distinto, una violación más a la libertad de expresión ¡fuerza @LuisChataing!","['ventana', 'cierran', 'pensar', 'distinto', 'violación', 'libertad', 'expresión', '¡fuerza', 'luischataing']","One more window that they close for thinking differently, one more violation of freedom of expression, force @LuisChataing!","['one', 'window', 'close', 'thinking', 'differently', 'one', 'violation', 'freedom', 'expression', 'force', 'luischataing']"
"@dulcineA_bm @elbicho_80 @dgnb64 no se, pero hubiese sido útil la grabación para ahorrarnos tiempo en las 6hrs de revisión de acta...","['dulcinea', 'bm', 'elbicho', 'dgnb', 'sido', 'útil', 'grabación', 'ahorrarnos', 'tiempo', 'hrs', 'revisión', 'acta']","@dulcineA_bm @ elbicho_80 @ dgnb64 I don't know, but the recording would have been useful to save us time in the 6hrs of reviewing the minutes ...","['dulcinea', 'bm', 'elbicho', 'dgnb', 'know', 'recording', 'would', 'useful', 'save', 'us', 'time', 'hrs', 'reviewing', 'minutes']"
"Impresionado de este audio, a los abogados de la defensa nos revisaron antes de entrar y nos hicieron sacar baterías del celular","['impresionado', 'audio', 'abogados', 'defensa', 'revisaron', 'entrar', 'hicieron', 'sacar', 'baterías', 'celular']","Impressed by this audio, the defense attorneys checked us before entering and made us remove batteries from the cell phone","['impressed', 'audio', 'defense', 'attorneys', 'checked', 'us', 'entering', 'made', 'us', 'remove', 'batteries', 'cell', 'phone']"
"Me contenta que puedan oír lo que dijo @leopoldolopez, para los que lo oímos en la audiencia fue motivación y fuerza para seguir luchando","['contenta', 'puedan', 'oír', 'dijo', 'leopoldolopez', 'oímos', 'audiencia', 'motivación', 'fuerza', 'seguir', 'luchando']","I'm glad you can hear what @leopoldolopez said, for those of us who heard it in the audience it was motivation and strength to keep fighting","['glad', 'hear', 'leopoldolopez', 'said', 'us', 'heard', 'audience', 'motivation', 'strength', 'keep', 'fighting']"
Impresionante el audio del juicio que están pasando en #ConcluJUICIO por @CNNEE son las palabras que dijo Leopoldo en su defensa ese lunes,"['impresionante', 'audio', 'juicio', 'pasando', 'conclujuicio', 'cnnee', 'palabras', 'dijo', 'leopoldo', 'defensa', 'lunes']",Impressive the audio of the trial that is happening in #ConcluJUICIO by @CNNEE are the words that Leopoldo said in his defense that Monday,"['impressive', 'audio', 'trial', 'happening', 'conclujuicio', 'cnnee', 'words', 'leopoldo', 'said', 'defense', 'monday']"
"@yrui256 para una persona con una bio tan religiosa, que mensaje tan poco piadoso. Uno es lo que predica...","['yrui', 'persona', 'bio', 'tan', 'religiosa', 'mensaje', 'tan', 'piadoso', 'predica']","@ yrui256 for a person with such a religious bio, what an unpious message. You are what you preach ...","['yrui', 'person', 'religious', 'bio', 'unpious', 'message', 'preach']"
"Ahora vamos a juicio, un juicio que empieza amañado, aunque sabemos ante qué nos enfrentamos, seguiremos dando la lucha por la verdad","['ahora', 'vamos', 'juicio', 'juicio', 'empieza', 'amañado', 'aunque', 'sabemos', 'enfrentamos', 'seguiremos', 'dando', 'lucha', 'verdad']","Now we are going to trial, a trial that begins rigged, although we know what we are facing, we will continue to fight for the truth","['going', 'trial', 'trial', 'begins', 'rigged', 'although', 'know', 'facing', 'continue', 'fight', 'truth']"
"Se deja injustamente preso a Leopoldo, a Marco Aurelio y a Christian, la injusticia es la regla","['deja', 'injustamente', 'preso', 'leopoldo', 'marco', 'aurelio', 'christian', 'injusticia', 'regla']","Leopoldo, Marco Aurelio and Christian are unjustly imprisoned, injustice is the rule","['leopoldo', 'marco', 'aurelio', 'christian', 'unjustly', 'imprisoned', 'injustice', 'rule']"
La Juez Adriana Lopez no acepto nulidades ni excepciones así como tampoco revisión de medidas,"['juez', 'adriana', 'lopez', 'acepto', 'nulidades', 'excepciones', 'así', 'tampoco', 'revisión', 'medidas']",Judge Adriana Lopez did not accept nullities or exceptions as well as review of measures,"['judge', 'adriana', 'lopez', 'accept', 'nullities', 'exceptions', 'well', 'review', 'measures']"
"El tribunal acaba de leer la decisión, acepta la acusación de manera integra, vamos a juicio","['tribunal', 'acaba', 'leer', 'decisión', 'acepta', 'acusación', 'manera', 'integra', 'vamos', 'juicio']","The court has just read the decision, accepts the accusation in a comprehensive manner, we go to trial","['court', 'read', 'decision', 'accepts', 'accusation', 'comprehensive', 'manner', 'go', 'trial']"
"La juez presentó si decisión, ratificó todas las peticiones del Ministerio Público, lamentablemente no se hizo justicia","['juez', 'presentó', 'si', 'decisión', 'ratificó', 'todas', 'peticiones', 'ministerio', 'público', 'lamentablemente', 'hizo', 'justicia']","The judge presented her decision, ratified all the requests of the Public Ministry, unfortunately justice was not done","['judge', 'presented', 'decision', 'ratified', 'requests', 'public', 'ministry', 'unfortunately', 'justice', 'done']"
"Audiencia de @leopoldolopez: diferida para mañana a las 9 am, concluye la audiencia por el día de hoy","['audiencia', 'leopoldolopez', 'diferida', 'mañana', 'am', 'concluye', 'audiencia', 'día', 'hoy']","Hearing of @leopoldolopez: deferred to tomorrow at 9 am, the hearing concludes for today","['hearing', 'leopoldolopez', 'deferred', 'tomorrow', 'hearing', 'concludes', 'today']"
"Dijo @leopoldolopez: Crecí pensando que las dictaduras eran en blanco y negro, resulta que también son a color y las vivimos hoy en el SXXI","['dijo', 'leopoldolopez', 'crecí', 'pensando', 'dictaduras', 'blanco', 'negro', 'resulta', 'color', 'vivimos', 'hoy', 'sxxi']","Said @leopoldolopez: I grew up thinking that dictatorships were in black and white, it turns out that they are also in color and we live them today in the SXXI","['said', 'leopoldolopez', 'grew', 'thinking', 'dictatorships', 'black', 'white', 'turns', 'also', 'color', 'live', 'today', 'sxxi']"
Palabras de @leopoldolopez: Prefiero explicarle a mi hija porque estoy en la cárcel que tener que explicarle mañana porque no tenemos país,"['palabras', 'leopoldolopez', 'prefiero', 'explicarle', 'hija', 'cárcel', 'tener', 'explicarle', 'mañana', 'país']",Words from @leopoldolopez: I'd rather explain to my daughter why I'm in jail than have to explain to her tomorrow because we don't have a country,"['words', 'leopoldolopez', 'rather', 'explain', 'daughter', 'jail', 'explain', 'tomorrow', 'country']"
"Audiencia @leopoldolopez: Por lo prolongado de la audiencia (11 horas) se solicitó se difiera, la juez está decidiendo","['audiencia', 'leopoldolopez', 'prolongado', 'audiencia', 'horas', 'solicitó', 'difiera', 'juez', 'decidiendo']","Hearing @leopoldolopez: Due to the length of the hearing (11 hours), it was requested that it be deferred, the judge is deciding","['hearing', 'leopoldolopez', 'due', 'length', 'hearing', 'hours', 'requested', 'deferred', 'judge', 'deciding']"
"Audiencia @leopoldolopez: llevamos más de 11 horas de audiencia, acaban de terminar de declarar los acusados con la declaración de Leopoldo","['audiencia', 'leopoldolopez', 'llevamos', 'horas', 'audiencia', 'acaban', 'terminar', 'declarar', 'acusados', 'declaración', 'leopoldo']","Hearing @leopoldolopez: we have been in the audience for more than 11 hours, the defendants have just finished declaring with Leopoldo's statement","['hearing', 'leopoldolopez', 'audience', 'hours', 'defendants', 'finished', 'declaring', 'leopoldo', 'statement']"
Audiencia @leopoldolopez: Cuando regresemos del receso empiezan a declarar los imputados (4 estudiantes y Leopoldo) y luego habla la defensa,"['audiencia', 'leopoldolopez', 'regresemos', 'receso', 'empiezan', 'declarar', 'imputados', 'estudiantes', 'leopoldo', 'luego', 'habla', 'defensa']","Audience @leopoldolopez: When we return from recess, the defendants begin to testify (4 students and Leopoldo) and then the defense speaks","['audience', 'leopoldolopez', 'return', 'recess', 'defendants', 'begin', 'testify', 'students', 'leopoldo', 'defense', 'speaks']"
"Audiencia @leopoldolopez: La fiscal dice ""Si no hubiera hecho la convocatoria nada de esto hubiera ocurrido por eso es culpable""","['audiencia', 'leopoldolopez', 'fiscal', 'dice', 'si', 'hecho', 'convocatoria', 'ocurrido', 'culpable']","Audience @leopoldolopez: The prosecutor says ""If he had not made the call, none of this would have happened, that is why he is guilty""","['audience', 'leopoldolopez', 'prosecutor', 'says', 'made', 'call', 'none', 'would', 'happened', 'guilty']"
"Audiencia @leopoldolopez: El Ministerio Público basa su caso en la ""influencia subliminal"" del discurso y tweets de Leopoldo","['audiencia', 'leopoldolopez', 'ministerio', 'público', 'basa', 'caso', 'influencia', 'subliminal', 'discurso', 'tweets', 'leopoldo']","Audience @leopoldolopez: The Public Ministry bases its case on the ""subliminal influence"" of Leopoldo's speech and tweets","['audience', 'leopoldolopez', 'public', 'ministry', 'bases', 'case', 'subliminal', 'influence', 'leopoldo', 'speech', 'tweets']"
"Audiencia @leopoldolopez: Estamos en receso, ya habló la fiscalía y la procuraduría","['audiencia', 'leopoldolopez', 'receso', 'habló', 'fiscalía', 'procuraduría']","Audience @leopoldolopez: We are in recess, the prosecution and the attorney general have already spoken","['audience', 'leopoldolopez', 'recess', 'prosecution', 'attorney', 'general', 'already', 'spoken']"
@daily_yarid que bueno que les haya gustado! Les cuento de esto la semana que viene!,"['daily', 'yarid', 'bueno', 'gustado', 'cuento', 'semana', 'viene']",@daily_yarid so good that you liked it! I'll tell you about this next week!,"['daily', 'yarid', 'good', 'liked', 'tell', 'next', 'week']"
"@mfsa56 esta bien mala la conexión de wifi, pero trato","['mfsa', 'bien', 'mala', 'conexión', 'wifi', 'trato']","@ mfsa56 the wifi connection is very bad, but I try","['mfsa', 'wifi', 'connection', 'bad', 'try']"
"Hoy en Venezuela vivimos todos con libertad condicional, en toque de queda sin decretar y con sentencia de muerte esperando por ejecución","['hoy', 'venezuela', 'vivimos', 'libertad', 'condicional', 'toque', 'queda', 'decretar', 'sentencia', 'muerte', 'esperando', 'ejecución']","Today in Venezuela we all live with conditional freedom, a curfew without decreeing and with a death sentence awaiting execution.","['today', 'venezuela', 'live', 'conditional', 'freedom', 'curfew', 'without', 'decreeing', 'death', 'sentence', 'awaiting', 'execution']"
"Libertad condicional para Rodrigo Diamanti (@RDiamanti). Al igual que todos en Venezuela, condicionada a los antojos del régimen...","['libertad', 'condicional', 'rodrigo', 'diamanti', 'rdiamanti', 'igual', 'venezuela', 'condicionada', 'antojos', 'régimen']","Probation for Rodrigo Diamanti (@RDiamanti). Like everyone in Venezuela, conditioned to the whims of the regime ...","['probation', 'rodrigo', 'diamanti', 'rdiamanti', 'like', 'everyone', 'venezuela', 'conditioned', 'whims', 'regime']"
@mapaula5 que por decisión administrativa de la propia juez no trabajan el día de hoy,"['mapaula', 'decisión', 'administrativa', 'propia', 'juez', 'trabajan', 'día', 'hoy']",@ mapaula5 that by administrative decision of the judge herself they do not work today,"['mapaula', 'administrative', 'decision', 'judge', 'work', 'today']"
"Difieren la audiencia de @leopoldolopez, el tribunal no tiene ""despacho"", aún no sabemos para cuando será diferida la audiencia","['difieren', 'audiencia', 'leopoldolopez', 'tribunal', 'despacho', 'aún', 'sabemos', 'diferida', 'audiencia']","They differ the hearing of @leopoldolopez, the court does not have an ""office"", we still do not know for when the hearing will be deferred","['differ', 'hearing', 'leopoldolopez', 'court', 'office', 'still', 'know', 'hearing', 'deferred']"
"@lornamarcano no, el ataque a los campamentos es simplemente una muestra más del carácter autoritario del régimen","['lornamarcano', 'ataque', 'campamentos', 'simplemente', 'muestra', 'carácter', 'autoritario', 'régimen']","@lornamarcano no, the attack on the camps is simply one more example of the authoritarian character of the regime","['lornamarcano', 'attack', 'camps', 'simply', 'one', 'example', 'authoritarian', 'character', 'regime']"
"@aaron_nahum también luchamos por ellos, no podemos dejar de hacerlo!","['aaron', 'nahum', 'luchamos', 'podemos', 'dejar', 'hacerlo']","@aaron_nahum we fight for them too, we can't stop doing it!","['aaron', 'nahum', 'fight', 'stop']"
"Hoy es la audiencia preliminar de @leopoldolopez, esperamos que pese a lo difícil que parece, ¡se haga justicia!","['hoy', 'audiencia', 'preliminar', 'leopoldolopez', 'esperamos', 'pese', 'difícil', 'parece', '¡se', 'haga', 'justicia']","Today is the preliminary hearing of @leopoldolopez, we hope that despite how difficult it seems, justice will be done!","['today', 'preliminary', 'hearing', 'leopoldolopez', 'hope', 'despite', 'difficult', 'seems', 'justice', 'done']"
"Detuvieron a mi amigo @RDiamanti (Rodrigo Diamanti), quien es activista y defensor de DDHH. Parece que defender derechos es ahora delito...","['detuvieron', 'amigo', 'rdiamanti', 'rodrigo', 'diamanti', 'activista', 'defensor', 'ddhh', 'parece', 'defender', 'derechos', 'ahora', 'delito']","They arrested my friend @RDiamanti (Rodrigo Diamanti), who is an activist and human rights defender. It seems that defending rights is now a crime ...","['arrested', 'friend', 'rdiamanti', 'rodrigo', 'diamanti', 'activist', 'human', 'rights', 'defender', 'seems', 'defending', 'rights', 'crime']"
"@isabelcecilia1 le suspendieron la visita familiar, a los abogados de él no deberían poder negarnos el acceso","['isabelcecilia', 'suspendieron', 'visita', 'familiar', 'abogados', 'deberían', 'poder', 'negarnos', 'acceso']","@ isabelcecilia1 his family visit was suspended, his lawyers should not be able to deny us access","['isabelcecilia', 'family', 'visit', 'suspended', 'lawyers', 'able', 'deny', 'us', 'access']"
El mejor regalo que todos podemos hacerle a @leopoldolopez es seguir trabajando por una mejor Venezuela #CumpleLeopoldo,"['mejor', 'regalo', 'podemos', 'hacerle', 'leopoldolopez', 'seguir', 'trabajando', 'mejor', 'venezuela', 'cumpleleopoldo']",The best gift we can all give @leopoldolopez is to continue working for a better Venezuela #CumpleLeopoldo,"['best', 'gift', 'give', 'leopoldolopez', 'continue', 'working', 'better', 'venezuela', 'cumpleleopoldo']"
@hjmalonso la visita de los abogados no puede ser restringida,"['hjmalonso', 'visita', 'abogados', 'puede', 'ser', 'restringida']",@hjmalonso the visit of the lawyers cannot be restricted,"['hjmalonso', 'visit', 'lawyers', 'cannot', 'restricted']"
"Lamentablemente hoy no podré ir a su casa para celebrar su cumpleaños, me toca visitarlo en la cárcel #CumpleLeopoldo #INJusticia","['lamentablemente', 'hoy', 'podré', 'ir', 'casa', 'celebrar', 'cumpleaños', 'toca', 'visitarlo', 'cárcel', 'cumpleleopoldo', 'injusticia']","Unfortunately today I will not be able to go to his house to celebrate his birthday, I have to visit him in jail #CumpleLeopoldo #INJusticia","['unfortunately', 'today', 'able', 'go', 'house', 'celebrate', 'birthday', 'visit', 'jail', 'cumpleleopoldo', 'injusticia']"
Hoy @leopoldolopez cumple 43 años privado de libertad. 70 días le han robado por tratar de construir una mejor Venezuela #CumpleLeopoldo,"['hoy', 'leopoldolopez', 'cumple', 'años', 'privado', 'libertad', 'días', 'robado', 'tratar', 'construir', 'mejor', 'venezuela', 'cumpleleopoldo']",Today @leopoldolopez celebrates 43 years deprived of liberty. 70 days have been robbed for trying to build a better Venezuela #CumpleLeopoldo,"['today', 'leopoldolopez', 'celebrates', 'years', 'deprived', 'liberty', 'days', 'robbed', 'trying', 'build', 'better', 'venezuela', 'cumpleleopoldo']"
"Mientras el diálogo sea discurso y no conversación poco sirve. Repito, siguen siendo necesarios respeto e igualdad de condiciones","['mientras', 'diálogo', 'discurso', 'conversación', 'sirve', 'repito', 'siguen', 'siendo', 'necesarios', 'respeto', 'igualdad', 'condiciones']","As long as the dialogue is speech and not conversation, it is of little use. I repeat, respect and equal conditions are still necessary","['long', 'dialogue', 'speech', 'conversation', 'little', 'use', 'repeat', 'respect', 'equal', 'conditions', 'still', 'necessary']"
"Nicolás paga y se da el vuelto. Este discurso, arrogante y poco reflexivo, resume la noche: no vinimos a escuchar, sólo a hablarle a la TV","['nicolás', 'paga', 'da', 'vuelto', 'discurso', 'arrogante', 'reflexivo', 'resume', 'noche', 'vinimos', 'escuchar', 'sólo', 'hablarle', 'tv']","Nicolás pays and gives himself the change. This arrogant and unreflective speech sums up the night: we did not come to listen, only to talk to the TV","['nicolás', 'pays', 'gives', 'change', 'arrogant', 'unreflective', 'speech', 'sums', 'night', 'come', 'listen', 'talk', 'tv']"
"Que fastidio el eterno cuento del 11 de Abril, eso fue hace 12 años... ¿Cuántos años más vamos a oír esta cantaleta?","['fastidio', 'eterno', 'cuento', 'abril', 'hace', 'años', '¿cuántos', 'años', 'vamos', 'oír', 'cantaleta']","What annoying the eternal story of April 11, that was 12 years ago ... How many more years are we going to hear this song?","['annoying', 'eternal', 'story', 'april', 'years', 'ago', 'many', 'years', 'going', 'hear', 'song']"
Hablando de nuevo de espacios no institucionales... ¿Por qué no se habla de las soluciones económicas en la AN?,"['hablando', 'nuevo', 'espacios', 'institucionales', '¿por', 'habla', 'soluciones', 'económicas', 'an']",Speaking again of non-institutional spaces ... Why is it not talked about economic solutions in the AN?,"['speaking', 'non', 'institutional', 'spaces', 'talked', 'economic', 'solutions']"
@angelar86 y pusimos a batear varios que se han debido quedar en la banca,"['angelar', 'pusimos', 'batear', 'varios', 'debido', 'quedar', 'banca']",@ angelar86 and we hit several that should have stayed on the bench,"['angelar', 'hit', 'several', 'stayed', 'bench']"
"Para todo hay una comisión, para todo hay una conferencia, para nada se usa el espacio institucional...","['comisión', 'conferencia', 'usa', 'espacio', 'institucional']","There is a commission for everything, for everything there is a conference, the institutional space is not used at all ...","['commission', 'everything', 'everything', 'conference', 'institutional', 'space', 'used']"
"@PepeClavijoA pareciera que la memoria es colectiva es corta, quien recuerda tiene el deber de alzar su bandera y los demás deben respetarlo","['pepeclavijoa', 'pareciera', 'memoria', 'colectiva', 'corta', 'recuerda', 'deber', 'alzar', 'bandera', 'demás', 'deben', 'respetarlo']","@PepeClavijoA it seems that collective memory is short, whoever remembers has the duty to raise their flag and others must respect it","['pepeclavijoa', 'seems', 'collective', 'memory', 'short', 'whoever', 'remembers', 'duty', 'raise', 'flag', 'others', 'must', 'respect']"
"Si es.. Pero valga la reflexión!, si al menos uno deja de hacerlo valdrá la pena! RT @Mariaiginia: Creo que ya es tarde","['si', 'valga', 'reflexión', 'si', 'menos', 'deja', 'hacerlo', 'valdrá', 'pena', 'rt', 'mariaiginia', 'creo', 'tarde']","If it is .. But worth the reflection! If at least one stops doing it, it will be worth it! RT @Mariaiginia: I think it's too late","['worth', 'reflection', 'least', 'one', 'stops', 'worth', 'rt', 'mariaiginia', 'think', 'late']"
"@dayerleen es así, no nos representan a todos. Pero en la discusión no podemos rebajarnos a la agresión, ese nunca debe ser nuestro camino","['dayerleen', 'así', 'representan', 'discusión', 'podemos', 'rebajarnos', 'agresión', 'nunca', 'debe', 'ser', 'camino']","@dayerleen is like that, they don't represent us all. But in discussion we cannot stoop to aggression, that should never be our way","['dayerleen', 'like', 'represent', 'us', 'discussion', 'cannot', 'stoop', 'aggression', 'never', 'way']"
Me preocupa también que en defensa u oposición del diálogo insultemos a otros. ¿Cómo promover algo que nosotros mismos no practicamos?,"['preocupa', 'defensa', 'oposición', 'diálogo', 'insultemos', '¿cómo', 'promover', 'mismos', 'practicamos']",I am also concerned that in defense or opposition to dialogue we insult others. How to promote something that we ourselves do not practice?,"['also', 'concerned', 'defense', 'opposition', 'dialogue', 'insult', 'others', 'promote', 'something', 'practice']"
Me preocupa también que muchas personas en defensa u oposición del diálogo insulten a otras. ¿Cómo promuevo algo que no práctico?,"['preocupa', 'muchas', 'personas', 'defensa', 'oposición', 'diálogo', 'insulten', '¿cómo', 'promuevo', 'práctico']",I am also concerned that many people in defense or opposition to dialogue insult others. How do I promote something that is not practical?,"['also', 'concerned', 'many', 'people', 'defense', 'opposition', 'dialogue', 'insult', 'others', 'promote', 'something', 'practical']"
