tweet,tweet_tokenized,tweet_translated,tweet_translated_tokenized
"@Awesomejoha uhi que chimbo, vamos a pedirle a Yu el lunes que le pregunte al guardia, el usa esa oficina. Que mal en verdad, pero ese aparc","['awesomejoha', 'uhi', 'chimbo', 'vamos', 'pedirle', 'yu', 'lunes', 'pregunte', 'guardia', 'usa', 'oficina', 'mal', 'verdad', 'aparc']","@Awesomejoha ​​uhi que chimbo, we are going to ask Yu on Monday to ask the guard, he uses that office. Too bad indeed, but that parking","['awesomejoha', '\u200b\u200buhi', 'que', 'chimbo', 'going', 'ask', 'yu', 'monday', 'ask', 'guard', 'uses', 'office', 'bad', 'indeed', 'parking']"
"@Awesomejoha Joha, estaba tratando de responderte por DM pero no me deja, no recuerdo haberlo visto :s","['awesomejoha', 'joha', 'tratando', 'responderte', 'dm', 'deja', 'recuerdo', 'haberlo', 'visto']","@Awesomejoha ​​Joha, I was trying to answer you for DM but it won't let me, I don't remember seeing it: s","['awesomejoha', '\u200b\u200bjoha', 'trying', 'answer', 'dm', 'let', 'remember', 'seeing']"
@IsaBellera por qué pasa eso? Estoy igual! No logro concentrarme en nada! Jejeje,"['isabellera', 'pasa', 'igual', 'logro', 'concentrarme', 'jejeje']",@IsaBellera why does that happen? I am the same! I can't focus on anything! Hahaha,"['isabellera', 'happen', 'focus', 'anything', 'hahaha']"
"@ManuelAvendano Gracias... Si hubieras dicho comunicador o administrador sería creible, pero de ingeniero esta difícil","['manuelavendano', 'gracias', 'si', 'dicho', 'comunicador', 'administrador', 'creible', 'ingeniero', 'difícil']","@ManuelAvendano Thank you ... If you had said communicator or administrator it would be credible, but as an engineer it is difficult","['manuelavendano', 'thank', 'said', 'communicator', 'administrator', 'would', 'credible', 'engineer', 'difficult']"
@gustavoguaido Gracias Gus!,"['gustavoguaido', 'gracias', 'gus']",@gustavoguaido Thanks Gus!,"['gustavoguaido', 'thanks', 'gus']"
@yiyipulido Muchas gracias! A ti también colega!,"['yiyipulido', 'muchas', 'gracias', 'colega']",@yiyipulido Thank you very much! You too colleague!,"['yiyipulido', 'thank', 'much', 'colleague']"
"Así es! Gracias RT @Robirote: ""La abogacía es la profesión más hermosa ya que te enseña a luchar por el respeto de los derechos d los demás""","['así', 'gracias', 'rt', 'robirote', 'abogacía', 'profesión', 'hermosa', 'enseña', 'luchar', 'respeto', 'derechos', 'demás']","That's how it is! Thanks RT @Robirote: ""Law is the most beautiful profession since it teaches you to fight for the respect of the rights of others""","['thanks', 'rt', 'robirote', 'law', 'beautiful', 'profession', 'since', 'teaches', 'fight', 'respect', 'rights', 'others']"
"Decir esto es insólito, peeeero... No saben cuanto odio que justo esta semana sea fin largo. ¡Yo necesito el viernes!","['decir', 'insólito', 'peeeero', 'saben', 'cuanto', 'odio', 'justo', 'semana', 'fin', 'largo', '¡yo', 'necesito', 'viernes']","Saying this is unusual, peeeero ... You don't know how much I hate that just this week is a long weekend. I need Friday!","['saying', 'unusual', 'peeeero', 'know', 'much', 'hate', 'week', 'long', 'weekend', 'need', 'friday']"
RT@ligiabolivar: En Vzla cerca d 90% de solicitudes de refugio son rechazds sin suficiente fundamentación de negativa #DDHH DíadelRefugiado,"['rt', 'ligiabolivar', 'vzla', 'cerca', 'solicitudes', 'refugio', 'rechazds', 'suficiente', 'fundamentación', 'negativa', 'ddhh', 'díadelrefugiado']",RT @ ligiabolivar: In Vzla about 90% of refugee applications are rejected without sufficient grounds for refusal #DDHH Refugee Day,"['rt', 'ligiabolivar', 'vzla', 'refugee', 'applications', 'rejected', 'without', 'sufficient', 'grounds', 'refusal', 'ddhh', 'refugee', 'day']"
Si la cola sigue así al momento que entre me van a decir que se van...,"['si', 'cola', 'sigue', 'así', 'momento', 'van', 'decir', 'van']",If the queue continues like this when I enter they will tell me that they are leaving ...,"['queue', 'continues', 'like', 'enter', 'tell', 'leaving']"
Para esto necesitamos tanto armamento de guerra:  http://yfrog.com/kfoyzphj ¡agredir a los ciudadanos!,"['necesitamos', 'armamento', 'guerra', '¡agredir', 'ciudadanos']",For this we need so many weapons of war: http://yfrog.com/kfoyzphj attack the citizens!,"['need', 'many', 'weapons', 'war', 'attack', 'citizens']"
¿Por qué no se están allanando e investigando a todas las empresas metalúrgicas del Estado? Estoy seguro que allí si hay cosas extrañas,"['¿por', 'allanando', 'investigando', 'todas', 'empresas', 'metalúrgicas', 'seguro', 'allí', 'si', 'cosas', 'extrañas']",Why aren't all the state's metallurgical companies being raided and investigated? I'm sure there are strange things there,"['state', 'metallurgical', 'companies', 'raided', 'investigated', 'sure', 'strange', 'things']"
Cabe destacar que todo este show empezó porque un director de Sidor sí estaba implicado en el tráfico de cabillas,"['cabe', 'destacar', 'show', 'empezó', 'director', 'sidor', 'implicado', 'tráfico', 'cabillas']",It should be noted that this whole show began because a director of Sidor was involved in the traffic of rebar,"['noted', 'whole', 'show', 'began', 'director', 'sidor', 'involved', 'traffic', 'rebar']"
Tratando de cubrir la ineficiencia del gobierno se hace una cacería de brujas contra todas aquellas empresas que funcionan eficientemente,"['tratando', 'cubrir', 'ineficiencia', 'gobierno', 'hace', 'cacería', 'brujas', 'todas', 'aquellas', 'empresas', 'funcionan', 'eficientemente']","Trying to cover the inefficiency of the government, a witch hunt is carried out against all those companies that function efficiently","['trying', 'cover', 'inefficiency', 'government', 'witch', 'hunt', 'carried', 'companies', 'function', 'efficiently']"
Otro ataque a la Empresa Privada: RT @la_patilla: DIM allanó galpón de Maploca en Bolívar  http://bit.ly/jZqsXj,"['ataque', 'empresa', 'privada', 'rt', 'patilla', 'dim', 'allanó', 'galpón', 'maploca', 'bolívar']",Another attack on the Private Company: RT @la_patilla: DIM raided the Maploca warehouse in Bolívar http://bit.ly/jZqsXj,"['another', 'attack', 'private', 'company', 'rt', 'la', 'patilla', 'dim', 'raided', 'maploca', 'warehouse', 'bolívar']"
Are we Human or are we dancers???!!!!!,"['are', 'we', 'human', 'or', 'are', 'we', 'dancers']",Are we Human or are we dancers???!!!!!,"['human', 'dancers']"
@IsaBellera que éxito! Mi cita es en un mes!,"['isabellera', 'éxito', 'cita', 'mes']",@IsaBellera what a success! My appointment is in a month!,"['isabellera', 'success', 'appointment', 'month']"
Acoso y persecución a la empresa privada: RT @la_patilla: DIM allana Hierrobeco en Puerto Ordaz  http://bit.ly/k64Bma,"['acoso', 'persecución', 'empresa', 'privada', 'rt', 'patilla', 'dim', 'allana', 'hierrobeco', 'puerto', 'ordaz']",Harassment and persecution of private companies: RT @la_patilla: DIM raids Hierrobeco in Puerto Ordaz http://bit.ly/k64Bma,"['harassment', 'persecution', 'private', 'companies', 'rt', 'la', 'patilla', 'dim', 'raids', 'hierrobeco', 'puerto', 'ordaz']"
@VeronicaBakhos si buscas azucar o harina seguro que te confundes y no sabes en qué país estás,"['veronicabakhos', 'si', 'buscas', 'azucar', 'harina', 'seguro', 'confundes', 'sabes', 'país']",@VeronicaBakhos if you are looking for sugar or flour you are sure to get confused and you do not know which country you are in,"['veronicabakhos', 'looking', 'sugar', 'flour', 'sure', 'get', 'confused', 'know', 'country']"
"El Cjal. @FreddyGuevara presenta hoy el Consejo Metropolitano de Seguridad Ciudadana, espacio de articulación entre las policías de Caracas","['cjal', 'freddyguevara', 'presenta', 'hoy', 'consejo', 'metropolitano', 'seguridad', 'ciudadana', 'espacio', 'articulación', 'policías', 'caracas']","The Cjal. @FreddyGuevara today presents the Metropolitan Council for Citizen Security, a space for articulation between the Caracas police","['cjal', 'freddyguevara', 'today', 'presents', 'metropolitan', 'council', 'citizen', 'security', 'space', 'articulation', 'caracas', 'police']"
@rafbello @CaroRodriguezO Felicitaciones Caro! Que éxito!,"['rafbello', 'carorodriguezo', 'felicitaciones', 'caro', 'éxito']",@rafbello @CaroRodriguezO Congratulations Caro! What a success!,"['rafbello', 'carorodriguezo', 'congratulations', 'caro', 'success']"
Que triste es cuando con discurso tratan de disfrazar una cruda realidad de pobreza e ineficiencia estatal,"['triste', 'discurso', 'tratan', 'disfrazar', 'cruda', 'realidad', 'pobreza', 'ineficiencia', 'estatal']",How sad it is when with speech they try to disguise a stark reality of poverty and state inefficiency,"['sad', 'speech', 'try', 'disguise', 'stark', 'reality', 'poverty', 'state', 'inefficiency']"
"Ahora no los llaman damnificados, les dicen dignificados... Estoy seguro que los que están en carpas en La Carlota se sienten así","['ahora', 'llaman', 'damnificados', 'dicen', 'dignificados', 'seguro', 'carpas', 'carlota', 'sienten', 'así']","Now they don't call them victims, they call them dignified ... I'm sure those who are in tents in La Carlota feel that way","['call', 'victims', 'call', 'dignified', 'sure', 'tents', 'la', 'carlota', 'feel', 'way']"
Buena rumba no??? RT @lele_candiales: @elisatot @bpulidom  http://yfrog.com/eh6v8mj,"['buena', 'rumba', 'rt', 'lele', 'candiales', 'elisatot', 'bpulidom']",Good rumba right ??? RT @lele_candiales: @elisatot @bpulidom http://yfrog.com/eh6v8mj,"['good', 'rumba', 'right', 'rt', 'lele', 'candiales', 'elisatot', 'bpulidom']"
Algún problema con mi chullo peruano??? @JvSalcedoM @gustavoguaido @jguaido @elisatot  http://lockerz.com/s/106516827,"['algún', 'problema', 'chullo', 'peruano', 'jvsalcedom', 'gustavoguaido', 'jguaido', 'elisatot']",Any problem with my Peruvian chullo ??? @JvSalcedoM @gustavoguaido @jguaido @elisatot http://lockerz.com/s/106516827,"['problem', 'peruvian', 'chullo', 'jvsalcedom', 'gustavoguaido', 'jguaido', 'elisatot']"
"@virginiazamora Yo quiero el ministerio de los ""Caucasicodescendientes""","['virginiazamora', 'quiero', 'ministerio', 'caucasicodescendientes']","@virginiazamora I want the ministry of the ""Caucasian descendants""","['virginiazamora', 'want', 'ministry', 'caucasian', 'descendants']"
@arianisha  http://lockerz.com/s/105244309 ese laberinto es demasiado fino!!!,"['arianisha', 'laberinto', 'demasiado', 'fino']",@arianisha http://lockerz.com/s/105244309 that labyrinth is too fine !!!,"['arianisha', 'labyrinth', 'fine']"
Excelente! RT @anapalacios2710: Equipo #UCAB ganador del Concurso Interamericano de Derechos Humanos!!! Felicidades!!!!   http://t.co/OacSgCE,"['excelente', 'rt', 'anapalacios', 'equipo', 'ucab', 'ganador', 'concurso', 'interamericano', 'derechos', 'humanos', 'felicidades']",Excellent! RT @ anapalacios2710: Team #UCAB winner of the Inter-American Human Rights Contest !!! Congratulations!!!! http://t.co/OacSgCE,"['excellent', 'rt', 'anapalacios', 'team', 'ucab', 'winner', 'inter', 'american', 'human', 'rights', 'contest', 'congratulations']"
El concurso Interamericano de DDHH es la simulación de la Corte Interamericana más importante y de más nivel.,"['concurso', 'interamericano', 'ddhh', 'simulación', 'corte', 'interamericana', 'importante', 'nivel']",The Inter-American Human Rights Contest is the most important and highest-level simulation of the Inter-American Court.,"['inter', 'american', 'human', 'rights', 'contest', 'important', 'highest', 'level', 'simulation', 'inter', 'american', 'court']"
"Manuel Andrés (@ManuelCasas) y Rolando, son unos duros! Felicitaciones!!!","['manuel', 'andrés', 'manuelcasas', 'rolando', 'duros', 'felicitaciones']","Manuel Andrés (@ManuelCasas) and Rolando, they are tough! Congratulations!!!","['manuel', 'andrés', 'manuelcasas', 'rolando', 'tough', 'congratulations']"
Felicitaciones a la delegación UCAB en el Moot Court de American University! Reventaron!,"['felicitaciones', 'delegación', 'ucab', 'moot', 'court', 'american', 'university', 'reventaron']",Congratulations to the UCAB delegation at the American University Moot Court! They blew up!,"['congratulations', 'ucab', 'delegation', 'american', 'university', 'moot', 'court', 'blew']"
@ligiabolivar lo que no cabía era mi maletín de mano! Avisa en lo que hayan noticias de American!,"['ligiabolivar', 'cabía', 'maletín', 'mano', 'avisa', 'noticias', 'american']",@ligiabolivar what didn't fit was my handbag! Let us know when there is news from American!,"['ligiabolivar', 'fit', 'handbag', 'let', 'us', 'know', 'news', 'american']"
@ligiabolivar Barquisimeto hoy y mañana. Sabemos algo de American?,"['ligiabolivar', 'barquisimeto', 'hoy', 'mañana', 'sabemos', 'american']",@ligiabolivar Barquisimeto today and tomorrow. Do we know anything about American?,"['ligiabolivar', 'barquisimeto', 'today', 'tomorrow', 'know', 'anything', 'american']"
Lo que mas rabia me da es que: 1) No hay nadie que responda por las quejas de uno y 2) No hay opciones distintas a esta porquería...,"['mas', 'rabia', 'da', 'nadie', 'responda', 'quejas', 'opciones', 'distintas', 'porquería']",What angers me the most is that: 1) There is no one to answer for one's complaints and 2) There are no options other than this crap ...,"['angers', 'one', 'answer', 'one', 'complaints', 'options', 'crap']"
"Aserca: El vuelo sale 3:30 tarde, me quitan mi puesto y no cabe el equipaje ¿Calidad? ¿Buen servicio?","['aserca', 'vuelo', 'sale', 'tarde', 'quitan', 'puesto', 'cabe', 'equipaje', '¿calidad', '¿buen', 'servicio']","Aserca: The flight leaves 3:30 late, they take my seat and my luggage does not fit. Quality? Great service?","['aserca', 'flight', 'leaves', 'late', 'take', 'seat', 'luggage', 'fit', 'quality', 'great', 'service']"
"Aserca es la peor aereolinea que existe. Me iba en el vuelo de las 7:30 a.m., acá sigo esperando.","['aserca', 'peor', 'aereolinea', 'existe', 'iba', 'vuelo', 'acá', 'sigo', 'esperando']","Aserca is the worst airline there is. I was leaving on the 7:30 a.m. flight, I'm still waiting here.","['aserca', 'worst', 'airline', 'leaving', 'flight', 'still', 'waiting']"
Felicitación en Farsi??? Gracias! RT @eddyacs: @bpulidom Tavalodet Mobarak!!! Alguien te felicitó en farsi ya? Jeje q cumplas muchos más :),"['felicitación', 'farsi', 'gracias', 'rt', 'eddyacs', 'bpulidom', 'tavalodet', 'mobarak', 'alguien', 'felicitó', 'farsi', 'jeje', 'cumplas']","Congratulations on Farsi ??? Thanks! RT @eddyacs: @bpulidom Tavalodet Mobarak !!! Has someone congratulated you in Farsi already? Hehe, you meet many more :)","['congratulations', 'farsi', 'thanks', 'rt', 'eddyacs', 'bpulidom', 'tavalodet', 'mobarak', 'someone', 'congratulated', 'farsi', 'already', 'hehe', 'meet', 'many']"
Todavía te faltan unos 4 años para decir eso! RT @andrespulidom: No hay cuarto malo @bpulidom,"['todavía', 'faltan', 'años', 'decir', 'rt', 'andrespulidom', 'cuarto', 'malo', 'bpulidom']",You still have about 4 years to say that! RT @andrespulidom: There is no bad room @bpulidom,"['still', 'years', 'say', 'rt', 'andrespulidom', 'bad', 'room', 'bpulidom']"
@mcarolinarojas Muuuuuchas Gracias!,"['mcarolinarojas', 'muuuuuchas', 'gracias']",@mcarolinarojas Muuuuuchas Thank you!,"['mcarolinarojas', 'muuuuuchas', 'thank']"
@lomejor18 ya lo tiene @andrespulidom síguelo! (Empezó hace poco así que no escribe mucho),"['lomejor', 'andrespulidom', 'síguelo', 'empezó', 'hace', 'así', 'escribe']",@ lomejor18 already has it @andrespulidom follow him! (He started recently so he doesn't write much),"['lomejor', 'already', 'andrespulidom', 'follow', 'started', 'recently', 'write', 'much']"
"jejejeje si, es mi hermano menor! RT @lomejor18: ese andres pulido será hermano de @bpulidom (?)","['jejejeje', 'si', 'hermano', 'menor', 'rt', 'lomejor', 'andres', 'pulido', 'hermano', 'bpulidom']","hehehehe yes, he is my younger brother! RT @ lomejor18: that polished andres will be @bpulidom's brother (?)","['hehehehe', 'yes', 'younger', 'brother', 'rt', 'lomejor', 'polished', 'andres', 'bpulidom', 'brother']"
¡Mi hermano @andrespulidom hablando en @globovision!,"['¡mi', 'hermano', 'andrespulidom', 'hablando', 'globovision']",My brother @andrespulidom speaking on @globovision!,"['brother', 'andrespulidom', 'speaking', 'globovision']"
"@CDelgadoSalas @rafbello @TomasHHR @dsmolansky esta en la otra llave de CU, pero también @EdwardJ6","['cdelgadosalas', 'rafbello', 'tomashhr', 'dsmolansky', 'llave', 'cu', 'edwardj']","@CDelgadoSalas @rafbello @TomasHHR @dsmolansky is in the other CU key, but also @ EdwardJ6","['cdelgadosalas', 'rafbello', 'tomashhr', 'dsmolansky', 'cu', 'key', 'also', 'edwardj']"
!Escuchen a @YonGoicoechea y @darielasosa que están estrenando programa en RCR (750 AM) justo ahora!,"['escuchen', 'yongoicoechea', 'darielasosa', 'estrenando', 'programa', 'rcr', 'am', 'justo', 'ahora']",Listen to @YonGoicoechea and @darielasosa who are premiering show on RCR (750 AM) right now!,"['listen', 'yongoicoechea', 'darielasosa', 'premiering', 'show', 'rcr', 'right']"
Y hoy tengo a otra Pulido (@hpulidom) empezando su 1era campaña RT @TomasHHR: Un dia como hoy..  @dsmolansky @rafbello @CdelgadoSalas,"['hoy', 'pulido', 'hpulidom', 'empezando', 'campaña', 'rt', 'tomashhr', 'dia', 'hoy', 'dsmolansky', 'rafbello', 'cdelgadosalas']",And today I have another Pulido (@hpulidom) starting his 1st RT campaign @TomasHHR: A day like today .. @dsmolansky @rafbello @CdelgadoSalas,"['today', 'another', 'pulido', 'hpulidom', 'starting', 'st', 'rt', 'campaign', 'tomashhr', 'day', 'like', 'today', 'dsmolansky', 'rafbello', 'cdelgadosalas']"
(Aparte en el Comité Ejecutivo y dirigiendo a @ECO_UCAB esta mi hermanita @helenapulidom) Así que sigan a los dos usuarios!,"['aparte', 'comité', 'ejecutivo', 'dirigiendo', 'eco', 'ucab', 'hermanita', 'helenapulidom', 'así', 'sigan', 'dos', 'usuarios']",(Apart from the Executive Committee and directing @ECO_UCAB is my little sister @helenapulidom) So follow the two users!,"['apart', 'executive', 'committee', 'directing', 'eco', 'ucab', 'little', 'sister', 'helenapulidom', 'follow', 'two', 'users']"
"A los ucabistas que me siguen, los recomiendo seguir a @ECO_UCAB excelente plancha de Comunicación Social","['ucabistas', 'siguen', 'recomiendo', 'seguir', 'eco', 'ucab', 'excelente', 'plancha', 'comunicación', 'social']","To the ucabistas who follow me, I recommend you follow @ECO_UCAB, an excellent Social Communication plate","['ucabistas', 'follow', 'recommend', 'follow', 'eco', 'ucab', 'excellent', 'social', 'communication', 'plate']"
Veo contento como muchas excelentes personas con las que trabajé cuando yo era representante estudiantil están optando por distintos cargos,"['veo', 'contento', 'muchas', 'excelentes', 'personas', 'trabajé', 'representante', 'estudiantil', 'optando', 'distintos', 'cargos']",I am happy how many excellent people I worked with when I was a student representative are opting for different positions,"['happy', 'many', 'excellent', 'people', 'worked', 'student', 'representative', 'opting', 'different', 'positions']"
Hoy comenzó la campaña para las elecciones de Representantes Estudiantiles en @lacatolica,"['hoy', 'comenzó', 'campaña', 'elecciones', 'representantes', 'estudiantiles', 'lacatolica']",Today began the campaign for the elections of Student Representatives in @lacatolica,"['today', 'began', 'campaign', 'elections', 'student', 'representatives', 'lacatolica']"
#LaMejorVzla es respetuosa de los Derechos Humanos y se preocupa por que cada ciudadano entienda que derechos tiene y como exigirlos,"['lamejorvzla', 'respetuosa', 'derechos', 'humanos', 'preocupa', 'cada', 'ciudadano', 'entienda', 'derechos', 'exigirlos']",#LaMejorVzla is respectful of Human Rights and cares that each citizen understands what rights they have and how to demand them,"['lamejorvzla', 'respectful', 'human', 'rights', 'cares', 'citizen', 'understands', 'rights', 'demand']"
"#LaMejorVzla tiene instituciones sólidas, respetadas y acatadas por sus autoridades y ciudadanos","['lamejorvzla', 'instituciones', 'sólidas', 'respetadas', 'acatadas', 'autoridades', 'ciudadanos']","#LaMejorVzla has solid institutions, respected and abided by its authorities and citizens","['lamejorvzla', 'solid', 'institutions', 'respected', 'abided', 'authorities', 'citizens']"
#LaMejorVzla es una donde todos tenemos igual oportunidades para crecer y progresar,"['lamejorvzla', 'igual', 'oportunidades', 'crecer', 'progresar']",#LaMejorVzla is one where we all have equal opportunities to grow and progress,"['lamejorvzla', 'one', 'equal', 'opportunities', 'grow', 'progress']"
RT @JordyMoncada: @leopoldolopez Derechos Humanos como eje transversal a todas las políticas públicas #LaMejorVzla,"['rt', 'jordymoncada', 'leopoldolopez', 'derechos', 'humanos', 'eje', 'transversal', 'todas', 'políticas', 'públicas', 'lamejorvzla']",RT @JordyMoncada: @leopoldolopez Human Rights as a transversal axis to all public policies #LaMejorVzla,"['rt', 'jordymoncada', 'leopoldolopez', 'human', 'rights', 'transversal', 'axis', 'public', 'policies', 'lamejorvzla']"
"Interesante sería preguntarse, de cuál sueldo esta el presidente donando ese 10%... ¿Del formal o del otro que tiene?","['interesante', 'preguntarse', 'cuál', 'sueldo', 'presidente', 'donando', '¿del', 'formal']","It would be interesting to ask oneself, of what salary is the president donating that 10% ... Of the formal one or the other one that he has?","['would', 'interesting', 'ask', 'oneself', 'salary', 'president', 'donating', 'formal', 'one', 'one']"
"No es primera vez que Chávez ""dona"" o ""renuncia"" a su sueldo lo hizo en el 2007 y con la ley de emolumentos","['primera', 'vez', 'chávez', 'dona', 'renuncia', 'sueldo', 'hizo', 'ley', 'emolumentos']","It is not the first time that Chávez ""donates"" or ""renounces"" his salary, he did it in 2007 and with the emoluments law.","['first', 'time', 'chávez', 'donates', 'renounces', 'salary', 'emoluments', 'law']"
"Chavez anuncia que donará el 10% de su sueldo al PSUV ¿Él no había renunciado a su sueldo? ¿Qué pasó con el discurso de ""no lo necesito""?","['chavez', 'anuncia', 'donará', 'sueldo', 'psuv', '¿él', 'renunciado', 'sueldo', '¿qué', 'pasó', 'discurso', 'necesito']","Chavez announces that he will donate 10% of his salary to the PSUV. Hadn't he given up his salary? What happened to the ""I don't need it"" speech?","['chavez', 'announces', 'donate', 'salary', 'psuv', 'given', 'salary', 'happened', 'need', 'speech']"
"@miguelsabal @NiHuskey es muy bizarro, muy bizarro...","['miguelsabal', 'nihuskey', 'bizarro', 'bizarro']","@miguelsabal @NiHuskey is very bizarre, very bizarre ...","['miguelsabal', 'nihuskey', 'bizarre', 'bizarre']"
"Eran tantos los tweets que puse Venevisión y me encontré a la Tigresa del Oriente, Venezuelan Version y al Cubo","['tantos', 'tweets', 'puse', 'venevisión', 'encontré', 'tigresa', 'oriente', 'venezuelan', 'version', 'cubo']","There were so many tweets that I put on Venevisión and I found La Tigresa del Oriente, Venezuelan Version and Al Cubo","['many', 'tweets', 'put', 'venevisión', 'found', 'la', 'tigresa', 'del', 'oriente', 'venezuelan', 'version', 'al', 'cubo']"
"@miguelsabal @NiHuskey ahhhh si... Ni que Nicole no se estuviera gozando a Lila, Liliana y Lilibeth","['miguelsabal', 'nihuskey', 'ahhhh', 'si', 'nicole', 'gozando', 'lila', 'liliana', 'lilibeth']","@miguelsabal @NiHuskey ahhhh yes ... Nor that Nicole was not enjoying Lila, Liliana and Lilibeth","['miguelsabal', 'nihuskey', 'ahhhh', 'yes', 'nicole', 'enjoying', 'lila', 'liliana', 'lilibeth']"
RT @CDH_UCAB: Consejo del Poder Judicial español: Estima que juicio a @mariafiuni es ataque al estado de derecho  http://bit.ly/kPg6e4,"['rt', 'cdh', 'ucab', 'consejo', 'poder', 'judicial', 'español', 'estima', 'juicio', 'mariafiuni', 'ataque', 'derecho']",RT @CDH_UCAB: Council of the Spanish Judicial Power: It considers that the trial of @mariafiuni is an attack on the rule of law http://bit.ly/kPg6e4,"['rt', 'cdh', 'ucab', 'council', 'spanish', 'judicial', 'power', 'considers', 'trial', 'mariafiuni', 'attack', 'rule', 'law']"
"Hay mas de 400 trabajadores, delegados y representantes de los movimientos de @VoluntadPopular  http://lockerz.com/s/99572251","['mas', 'trabajadores', 'delegados', 'representantes', 'movimientos', 'voluntadpopular']","There are more than 400 workers, delegates and representatives of @VoluntadPopular movements http://lockerz.com/s/99572251","['workers', 'delegates', 'representatives', 'voluntadpopular', 'movements']"
Los trabajadores en @VoluntadPopular se organizan en los movimientos sociales de Gremios y el de Sindicatos  http://lockerz.com/s/99571112,"['trabajadores', 'voluntadpopular', 'organizan', 'movimientos', 'sociales', 'gremios', 'sindicatos']",The workers in @VoluntadPopular organize themselves in the social movements of Gremios and Sindicatos http://lockerz.com/s/99571112,"['workers', 'voluntadpopular', 'organize', 'social', 'movements', 'gremios', 'sindicatos']"
"Aquí están los Trabajadores con Voluntad, Gremios y sindicatos comprometidos con @VoluntadPopular  http://lockerz.com/s/99569937","['aquí', 'trabajadores', 'voluntad', 'gremios', 'sindicatos', 'comprometidos', 'voluntadpopular']","Here are the Willing Workers, Unions and unions committed to @VoluntadPopular http://lockerz.com/s/99569937","['willing', 'workers', 'unions', 'unions', 'committed', 'voluntadpopular']"
