tweet,tweet_tokenized,tweet_translated,tweet_translated_tokenized
@helenapulidom @Gracesosa15 que es eso? No estan como grandes pa la gracia?,"['helenapulidom', 'gracesosa', 'estan', 'grandes', 'pa', 'gracia']",@helenapulidom @ Gracesosa15 what is that? Are they not as big for grace?,"['helenapulidom', 'gracesosa', 'big', 'grace']"
"@EdwardJ6 Me acabo de enterar que vamos a la misma conferencia en DC, Yo por Stanford, tu por la UCAB... Nos vemos el lunes!","['edwardj', 'acabo', 'enterar', 'vamos', 'misma', 'conferencia', 'dc', 'stanford', 'ucab', 'vemos', 'lunes']","@ EdwardJ6 I just found out that we are going to the same conference in DC, I for Stanford, you for UCAB ... See you on Monday!","['edwardj', 'found', 'going', 'conference', 'dc', 'stanford', 'ucab', 'see', 'monday']"
"@GerardoBelloA Estimado, Muy Muy Feliz Cumpleaños, fuerte abrazo desde acá en el norte.","['gerardobelloa', 'estimado', 'feliz', 'cumpleaños', 'fuerte', 'abrazo', 'acá', 'norte']","@GerardoBelloA Dear, Very Very Happy Birthday, big hug from here in the north.","['gerardobelloa', 'dear', 'happy', 'birthday', 'big', 'hug', 'north']"
@GerardoBelloA @elisatot @VeronicaBakhos El bellas era tambien conmigo? Gracias! Bella tu también!,"['gerardobelloa', 'elisatot', 'veronicabakhos', 'bellas', 'tambien', 'conmigo', 'gracias', 'bella']",@GerardoBelloA @elisatot @VeronicaBakhos Was the beauty also with me? Thanks! Beautiful you too!,"['gerardobelloa', 'elisatot', 'veronicabakhos', 'beauty', 'also', 'thanks', 'beautiful']"
@GerardoBelloA @VeronicaBakhos @elisatot En un rato les puedo mandar mi foto vestido de Verde.,"['gerardobelloa', 'veronicabakhos', 'elisatot', 'rato', 'puedo', 'mandar', 'foto', 'vestido', 'verde']",@GerardoBelloA @VeronicaBakhos @elisatot In a little while I can send you my photo dressed in Green.,"['gerardobelloa', 'veronicabakhos', 'elisatot', 'little', 'send', 'photo', 'dressed', 'green']"
"@GerardoBelloA @VeronicaBakhos @elisatot No entiendo como llegué yo hasta acá... Pero si, yo si voy a celebrar St Patrick's","['gerardobelloa', 'veronicabakhos', 'elisatot', 'entiendo', 'llegué', 'acá', 'si', 'si', 'voy', 'celebrar', 'st', 'patrick']","@GerardoBelloA @VeronicaBakhos @elisatot I don't understand how I got here ... But yes, I am going to celebrate St Patrick's","['gerardobelloa', 'veronicabakhos', 'elisatot', 'understand', 'got', 'yes', 'going', 'celebrate', 'st', 'patrick']"
Llego a mi casa y Stanford esta regalando desayuno!  http://t.co/eB43MJTu,"['llego', 'casa', 'stanford', 'regalando', 'desayuno']",I come home and Stanford is giving away breakfast! http://t.co/eB43MJTu,"['come', 'home', 'stanford', 'giving', 'away', 'breakfast']"
"Hoy es mi ""Twittersario"", 3 años tratando de decir algo coherente en 140 caracteres.","['hoy', 'twittersario', 'años', 'tratando', 'decir', 'coherente', 'caracteres']","Today is my ""Twittersario"", 3 years trying to say something coherent in 140 characters.","['today', 'twittersario', 'years', 'trying', 'say', 'something', 'coherent', 'characters']"
"@ManuelAvendano Si, pero la premiación esta muy aburrida así que desfilamos en el Red Carpet y ahora estamos en una fiesta...","['manuelavendano', 'si', 'premiación', 'aburrida', 'así', 'desfilamos', 'red', 'carpet', 'ahora', 'fiesta']","@ManuelAvendano Yes, but the award ceremony is very boring so we parade on the Red Carpet and now we are at a party ...","['manuelavendano', 'yes', 'award', 'ceremony', 'boring', 'parade', 'red', 'carpet', 'party']"
"@francocasella @worldmunucab @Fmarquez77 @elisatot Fuerte abrazo! Se les tiene muy presente, ¡éxito!","['francocasella', 'worldmunucab', 'fmarquez', 'elisatot', 'fuerte', 'abrazo', 'presente', '¡éxito']","@francocasella @worldmunucab @ Fmarquez77 @elisatot Strong hug! They are kept in mind, success!","['francocasella', 'worldmunucab', 'fmarquez', 'elisatot', 'strong', 'hug', 'kept', 'mind', 'success']"
RT @JacksonDiehl: Hugo Chavez's 1st response to his new challenger: he's part of the international Zionist conspiracy  http://t.co/e4cZEMV7,"['rt', 'jacksondiehl', 'hugo', 'chavez', 'st', 'response', 'to', 'his', 'new', 'challenger', 'part', 'of', 'the', 'international', 'zionist', 'conspiracy']",RT @JacksonDiehl: Hugo Chavez's 1st response to his new challenger: he's part of the international Zionist conspiracy  http://t.co/e4cZEMV7,"['rt', 'jacksondiehl', 'hugo', 'chavez', 'st', 'response', 'new', 'challenger', 'part', 'international', 'zionist', 'conspiracy']"
No es lo mismo que estar allí pero muy emocionante igual!  http://t.co/wuCTKbBu,"['mismo', 'allí', 'emocionante', 'igual']",It is not the same as being there but still very exciting! http://t.co/wuCTKbBu,"['still', 'exciting']"
Viendo a la LAPhil y OSJVSB en un cine. Impresionante la cantidad de gente y que emocionante poderlos ver desde tan lejos,"['viendo', 'laphil', 'osjvsb', 'cine', 'impresionante', 'cantidad', 'gente', 'emocionante', 'poderlos', 'ver', 'tan', 'lejos']",Watching LAPhil and OSJVSB in a movie theater. Impressive the number of people and how exciting to be able to see them from so far,"['watching', 'laphil', 'osjvsb', 'movie', 'theater', 'impressive', 'number', 'people', 'exciting', 'able', 'see', 'far']"
"Lo bueno de esta elección es que no hay ni perdedores ni ganadores, ¡hoy ganamos todos!","['bueno', 'elección', 'perdedores', 'ganadores', '¡hoy', 'ganamos']","The good thing about this election is that there are neither losers nor winners, today we all win!","['good', 'thing', 'election', 'neither', 'losers', 'winners', 'today', 'win']"
"Si no has votado, ¡sal ya! Todavía hay tiempo, pero no lo dejes para más tarde.","['si', 'votado', '¡sal', 'todavía', 'tiempo', 'dejes', 'tarde']","If you haven't voted, get out now! There is still time, but don't leave it for later.","['voted', 'get', 'still', 'time', 'leave', 'later']"
"A todos los que están votando, trabajando y participando hoy: ¡Felicitaciones! Así construímos un mejor país.","['votando', 'trabajando', 'participando', 'hoy', '¡felicitaciones', 'así', 'construímos', 'mejor', 'país']","To everyone who is voting, working and participating today: Congratulations! This is how we build a better country.","['everyone', 'voting', 'working', 'participating', 'today', 'congratulations', 'build', 'better', 'country']"
Viendo un Play con uno de los Jonas Bros. e impresionantemente es bastante bueno  http://t.co/sSstAQbs,"['viendo', 'play', 'jonas', 'bros', 'impresionantemente', 'bastante', 'bueno']",Watching a Play with one of the Jonas Bros. and impressively it's pretty good http://t.co/sSstAQbs,"['watching', 'play', 'one', 'jonas', 'bros', 'impressively', 'pretty', 'good']"
Rosted Lamb Sandwich in NYC! I'm in heaven!,"['rosted', 'lamb', 'sandwich', 'in', 'nyc', 'in', 'heaven']",Rosted Lamb Sandwich in NYC! I'm in heaven!,"['rosted', 'lamb', 'sandwich', 'nyc', 'heaven']"
Start spreading the news. I am leaving today. I want to be a part of it...,"['start', 'spreading', 'the', 'news', 'am', 'leaving', 'today', 'want', 'to', 'be', 'part', 'of', 'it']",Start spreading the news. I am leaving today. I want to be a part of it...,"['start', 'spreading', 'news', 'leaving', 'today', 'want', 'part']"
"@weilmiguel @marianodealba Claro, ademas todos los arbitrajes que estan en curso, mas los que estan por venir (prox 2 años) siguien vigentes","['weilmiguel', 'marianodealba', 'claro', 'ademas', 'arbitrajes', 'estan', 'curso', 'mas', 'estan', 'venir', 'prox', 'años', 'siguien', 'vigentes']","@weilmiguel @marianodealba Claro, also all the arbitrations that are in progress, plus those that are to come (next 2 years) are still valid","['weilmiguel', 'marianodealba', 'claro', 'also', 'arbitrations', 'progress', 'plus', 'come', 'next', 'years', 'still', 'valid']"
"Me contenta saber que una vez más estaremos trabajando con muchos amigos, en los cuales confiamos y compartimos una visión","['contenta', 'saber', 'vez', 'trabajando', 'amigos', 'cuales', 'confiamos', 'compartimos', 'visión']","I am happy to know that once again we will be working with many friends, in whom we trust and share a vision.","['happy', 'know', 'working', 'many', 'friends', 'trust', 'share', 'vision']"
"Ahora todos a votar el 12F y el 7O, cualquier espacio de participación debe ser aprovechado al máximo!","['ahora', 'votar', 'cualquier', 'espacio', 'participación', 'debe', 'ser', 'aprovechado', 'máximo']","Now everyone to vote on 12F and 7O, any participation space must be used to the maximum!","['everyone', 'vote', 'participation', 'space', 'must', 'used', 'maximum']"
Muy contento con la alianza que se ha generado entre Leopoldo y Henrique. ¡El futuro requiere de todos!,"['contento', 'alianza', 'generado', 'leopoldo', 'henrique', '¡el', 'futuro', 'requiere']",Very happy with the alliance that has been generated between Leopoldo and Henrique. The future requires everyone!,"['happy', 'alliance', 'generated', 'leopoldo', 'henrique', 'future', 'requires', 'everyone']"
"@Fmarquez77 Es necesario cambios pero cuidando formas. Me da flojera seguir desarrollando el argumento por acá, dsps lo hablamos con calma.","['fmarquez', 'necesario', 'cambios', 'cuidando', 'formas', 'da', 'flojera', 'seguir', 'desarrollando', 'argumento', 'acá', 'dsps', 'hablamos', 'calma']","@ Fmarquez77 Changes are necessary but taking care of forms. I am lazy to continue developing the argument here, dsps we speak it calmly.","['fmarquez', 'changes', 'necessary', 'taking', 'care', 'forms', 'lazy', 'continue', 'developing', 'argument', 'dsps', 'speak', 'calmly']"
@Fmarquez77 Lamentablemente pareciera q casi todos los candidatos quiere pasarse la autonomia por el forro y en vdd tiene q ser prioridad,"['fmarquez', 'lamentablemente', 'pareciera', 'casi', 'candidatos', 'quiere', 'pasarse', 'autonomia', 'forro', 'vdd', 'ser', 'prioridad']",@ Fmarquez77 Unfortunately it seems that almost all the candidates want to pass autonomy through the lining and in vdd it has to be a priority,"['fmarquez', 'unfortunately', 'seems', 'almost', 'candidates', 'want', 'pass', 'autonomy', 'lining', 'vdd', 'priority']"
@Fmarquez77 Y crees que en Vzla pasaría distinto? En régimenes presidencialistas como el nuestro esas afirmaciones terminan en abuso d poder,"['fmarquez', 'crees', 'vzla', 'pasaría', 'distinto', 'régimenes', 'presidencialistas', 'afirmaciones', 'terminan', 'abuso', 'poder']","@ Fmarquez77 And do you think that in Vzla it would happen differently? In presidential regimes like ours, these statements end in abuse of power.","['fmarquez', 'think', 'vzla', 'would', 'happen', 'differently', 'presidential', 'regimes', 'like', 'statements', 'end', 'abuse', 'power']"
@Fmarquez77 Si no preguntale a tu pana Obama como le salio el Health Care reform y que quedó de su propuesta...,"['fmarquez', 'si', 'preguntale', 'pana', 'obama', 'salio', 'health', 'care', 'reform', 'quedó', 'propuesta']",@ Fmarquez77 If you don't ask your friend Obama how the Health Care reform came out and what was left of his proposal ...,"['fmarquez', 'ask', 'friend', 'obama', 'health', 'care', 'reform', 'came', 'left', 'proposal']"
"@Fmarquez77 Completamente de acuerdo, pero por eso no puede ser el centro del plan de gob, la efectividad del mismo no depende del presidt","['fmarquez', 'completamente', 'acuerdo', 'puede', 'ser', 'centro', 'plan', 'gob', 'efectividad', 'mismo', 'depende', 'presidt']","@ Fmarquez77 Completely agree, but that is why it cannot be the center of the gob plan, its effectiveness does not depend on the presidt","['fmarquez', 'completely', 'agree', 'cannot', 'center', 'gob', 'plan', 'effectiveness', 'depend', 'presidt']"
@Fmarquez77 me mandaste un tweet vacío...,"['fmarquez', 'mandaste', 'tweet', 'vacío']",@ Fmarquez77 you sent me an empty tweet ...,"['fmarquez', 'sent', 'empty', 'tweet']"
Es contradictorio hablar de instituciones fuertes e independientes y que la reforma judicial sea parte del programa de gob. Presidencial,"['contradictorio', 'hablar', 'instituciones', 'fuertes', 'independientes', 'reforma', 'judicial', 'parte', 'programa', 'gob', 'presidencial']",It is contradictory to speak of strong and independent institutions and that judicial reform is part of the government's program. Presidential,"['contradictory', 'speak', 'strong', 'independent', 'institutions', 'judicial', 'reform', 'part', 'government', 'program', 'presidential']"
Esto es una mezcla extraña...  http://t.co/PGcT2NrI,"['mezcla', 'extraña']",This is a weird mix ... http://t.co/PGcT2NrI,"['weird', 'mix']"
¡Felicitaciones! que sigan los éxitos y el buen trabajo  RT @francocasella: Feliz 9no Aniversario Fundacion Generacion de Lideres,"['¡felicitaciones', 'sigan', 'éxitos', 'buen', 'trabajo', 'rt', 'francocasella', 'feliz', 'aniversario', 'fundacion', 'generacion', 'lideres']",Congratulations! May the successes and the good work continue RT @francocasella: Happy 9th Anniversary Generacion de Lideres Foundation,"['congratulations', 'may', 'successes', 'good', 'work', 'continue', 'rt', 'francocasella', 'happy', 'th', 'anniversary', 'generacion', 'de', 'lideres', 'foundation']"
Nuestro carro! (Un tanto nevado)  http://t.co/ItRh7DnK,"['carro', 'nevado']",Our car! (A bit snowy) http://t.co/ItRh7DnK,"['car', 'bit', 'snowy']"
Welcome to South Park!!! (Or Park City)  http://t.co/Ycn9VZHy,"['welcome', 'to', 'south', 'park', 'or', 'park', 'city']",Welcome to South Park!!! (Or Park City)  http://t.co/Ycn9VZHy,"['welcome', 'south', 'park', 'park', 'city']"
First Sundance waitlist ticket...  http://t.co/4nvWAOIa,"['first', 'sundance', 'waitlist', 'ticket']",First Sundance waitlist ticket...  http://t.co/4nvWAOIa,"['first', 'sundance', 'waitlist', 'ticket']"
@helenapulidom Sundance,"['helenapulidom', 'sundance']",@helenapulidom Sundance,"['helenapulidom', 'sundance']"
Momento groupie: Andy Samberg está en el mismo avión que yo!,"['momento', 'groupie', 'andy', 'samberg', 'mismo', 'avión']",Groupie moment: Andy Samberg is on the same plane as me!,"['groupie', 'moment', 'andy', 'samberg', 'plane']"
"Just saw Cirque du Soleil's ""Michael Jackson - The Immortal World Tour"" Excellent!","['just', 'saw', 'cirque', 'du', 'soleil', 'michael', 'jackson', 'the', 'immortal', 'world', 'tour', 'excellent']","Just saw Cirque du Soleil's ""Michael Jackson - The Immortal World Tour"" Excellent!","['saw', 'cirque', 'du', 'soleil', 'michael', 'jackson', 'immortal', 'world', 'tour', 'excellent']"
"@elisatot @VeronicaBakhos Acabo de ver Cirque du Soleil & MJ's ""The inmortal tour"", creo que les hubiera gustado...","['elisatot', 'veronicabakhos', 'acabo', 'ver', 'cirque', 'du', 'soleil', 'mj', 'the', 'inmortal', 'tour', 'creo', 'gustado']","@elisatot @VeronicaBakhos I just saw Cirque du Soleil & MJ's ""The immortal tour"", I think they would have liked ...","['elisatot', 'veronicabakhos', 'saw', 'cirque', 'du', 'soleil', 'mj', 'immortal', 'tour', 'think', 'would', 'liked']"
@nathassianselmi @FroyMonteverde @NabilFT @nawys @jmarzorati @lccanor @maitealgocen @PattyVG @CarmenFreda Estamos viejos! Slds dsd el norte,"['nathassianselmi', 'froymonteverde', 'nabilft', 'nawys', 'jmarzorati', 'lccanor', 'maitealgocen', 'pattyvg', 'carmenfreda', 'viejos', 'slds', 'dsd', 'norte']",@nathassianselmi @FroyMonteverde @NabilFT @nawys @jmarzorati @lccanor @maitealgocen @PattyVG @CarmenFreda We are old! Slds dsd north,"['nathassianselmi', 'froymonteverde', 'nabilft', 'nawys', 'jmarzorati', 'lccanor', 'maitealgocen', 'pattyvg', 'carmenfreda', 'old', 'slds', 'dsd', 'north']"
Casablanca en el Stanford Theater  http://t.co/eLwLr1vJ,"['casablanca', 'stanford', 'theater']",Casablanca at the Stanford Theater http://t.co/eLwLr1vJ,"['casablanca', 'stanford', 'theater']"
"Items impronunciables del menú: ""Nikolaihof biodynamic elderflower syrup""","['items', 'impronunciables', 'menú', 'nikolaihof', 'biodynamic', 'elderflower', 'syrup']","Items impronunciables del menú: ""Nikolaihof biodynamic elderflower syrup""","['items', 'impronunciables', 'del', 'menú', 'nikolaihof', 'biodynamic', 'elderflower', 'syrup']"
Ley de Murphy: 1) Perdí el vuelo; 2) El avión al que me cambian se retrasa; 3) Por el tiempo de espera hay que recargar combustible,"['ley', 'murphy', 'perdí', 'vuelo', 'avión', 'cambian', 'retrasa', 'tiempo', 'espera', 'recargar', 'combustible']",Murphy's Law: 1) I missed my flight; 2) The plane I am being transferred to is delayed; 3) For the waiting time you have to refuel,"['murphy', 'law', 'missed', 'flight', 'plane', 'transferred', 'delayed', 'waiting', 'time', 'refuel']"
RT @ignandez: Recordando a Roscio. Depender de un hombre solo es esclavitud...,"['rt', 'ignandez', 'recordando', 'roscio', 'depender', 'hombre', 'solo', 'esclavitud']",RT @ignandez: Remembering Roscio. To depend on one man is only slavery ...,"['rt', 'ignandez', 'remembering', 'roscio', 'depend', 'one', 'man', 'slavery']"
"Y yo la completo: El que oye consejo llega a viejo... RT @elisatot: @corict me enseñó una buena frase: ""el que repite no estrena"" jaja","['completo', 'oye', 'consejo', 'llega', 'viejo', 'rt', 'elisatot', 'corict', 'enseñó', 'buena', 'frase', 'repite', 'estrena', 'jaja']","And I complete it: He who hears advice becomes old ... RT @elisatot: @corict taught me a good phrase: ""he who repeats does not premiere"" haha","['complete', 'hears', 'advice', 'becomes', 'old', 'rt', 'elisatot', 'corict', 'taught', 'good', 'phrase', 'repeats', 'premiere', 'haha']"
"@ligiabolivar Nada malo! Me tienen haciendo cola y voy a perder la conexión, pero nada que un tanto de paciencia no solucione.","['ligiabolivar', 'malo', 'haciendo', 'cola', 'voy', 'perder', 'conexión', 'paciencia', 'solucione']","@ligiabolivar Nothing bad! They have me queuing and I'm going to lose connection, but nothing that a little patience doesn't solve.","['ligiabolivar', 'nothing', 'bad', 'queuing', 'going', 'lose', 'connection', 'nothing', 'little', 'patience', 'solve']"
Por suerte se dieron cuenta que no nos podían tener haciendo cola y sin usar el celular y te dejan sacarlo...,"['suerte', 'dieron', 'cuenta', 'podían', 'tener', 'haciendo', 'cola', 'usar', 'celular', 'dejan', 'sacarlo']",Luckily they realized that they couldn't have us queuing without using the cell phone and they let you take it out ...,"['luckily', 'realized', 'us', 'queuing', 'without', 'using', 'cell', 'phone', 'let', 'take']"
La entrada al Imperio no está fácil...,"['entrada', 'imperio', 'fácil']",Entering the Empire is not easy ...,"['entering', 'empire', 'easy']"
Deberían proponer un trueque: Avión Espía por Barco Pesquero. Jeje RT @FranciscoPoleoR: La Marina de EEUU rescató a un barco pesquero iraní.,"['deberían', 'proponer', 'trueque', 'avión', 'espía', 'barco', 'pesquero', 'jeje', 'rt', 'franciscopoleor', 'marina', 'eeuu', 'rescató', 'barco', 'pesquero', 'iraní']",They should propose a trade: Spy Plane for Fishing Boat. Hehe RT @FranciscoPoleoR: The US Navy rescued an Iranian fishing boat.,"['propose', 'trade', 'spy', 'plane', 'fishing', 'boat', 'hehe', 'rt', 'franciscopoleor', 'us', 'navy', 'rescued', 'iranian', 'fishing', 'boat']"
"@cesaperaza de pana, de freshman y hasta allí llegó.","['cesaperaza', 'pana', 'freshman', 'allí', 'llegó']","@cesaperaza from corduroy, from freshman and he got there.","['cesaperaza', 'corduroy', 'freshman', 'got']"
"Good Bowl, Sad end...","['good', 'bowl', 'sad', 'end']","Good Bowl, Sad end...","['good', 'bowl', 'sad', 'end']"
Otro touchdown!!! Excelente #GoCards !!!!,"['touchdown', 'excelente', 'gocards']",Another touchdown !!! Excellent #GoCards !!!!,"['another', 'touchdown', 'excellent', 'gocards']"
Go Card!!! RT @VirginiaZamora: @BPulidoM --&gt; Ready for the Tostitos Fiesta Bowl! #GoStanford :),"['go', 'card', 'rt', 'virginiazamora', 'bpulidom', 'gt', 'ready', 'for', 'the', 'tostitos', 'fiesta', 'bowl', 'gostanford']",Go Card!!! RT @VirginiaZamora: @BPulidoM --&gt; Ready for the Tostitos Fiesta Bowl! #GoStanford :),"['go', 'card', 'rt', 'virginiazamora', 'bpulidom', 'gt', 'ready', 'tostitos', 'fiesta', 'bowl', 'gostanford']"
@corict me engañaste vilmente tú! Te invite por FB a una cosa en mi casa y ni respondiste :(,"['corict', 'engañaste', 'vilmente', 'invite', 'fb', 'cosa', 'casa', 'respondiste']",@corict you fool me vilely! I invited you by FB to something in my house and you didn't even respond :(,"['corict', 'fool', 'vilely', 'invited', 'fb', 'something', 'house', 'even', 'respond']"
@JuanBarrozzi gracias dr!,"['juanbarrozzi', 'gracias', 'dr']",@JuanBarrozzi thank you dr!,"['juanbarrozzi', 'thank', 'dr']"
@MarjorieChejin el mismo de siempre!!! Ya te lo remando por DM,"['marjoriechejin', 'mismo', 'siempre', 'remando', 'dm']",@MarjorieChejin the same as always !!! I'm already rowing it for you for DM,"['marjoriechejin', 'always', 'already', 'rowing', 'dm']"
"@VeronicaBakhos creo que Bancaribe te medio malandreó con ese ultimo tweet... Suena como: ""callate rata""","['veronicabakhos', 'creo', 'bancaribe', 'medio', 'malandreó', 'ultimo', 'tweet', 'suena', 'callate', 'rata']","@VeronicaBakhos I think Bancaribe half misled you with that last tweet ... It sounds like: ""shut up rat""","['veronicabakhos', 'think', 'bancaribe', 'half', 'misled', 'last', 'tweet', 'sounds', 'like', 'shut', 'rat']"
Contigo y con @LauSolorzano buena siempre tigresa!!! RT @TigresaOriente: Espero que todos estén pasando una feliz noche. Besos #Grr,"['contigo', 'lausolorzano', 'buena', 'siempre', 'tigresa', 'rt', 'tigresaoriente', 'espero', 'pasando', 'feliz', 'noche', 'besos', 'grr']",With you and with @LauSolorzano always good tigress !!! RT @TigresaOriente: I hope everyone is having a happy night. Kisses #Grr,"['lausolorzano', 'always', 'good', 'tigress', 'rt', 'tigresaoriente', 'hope', 'everyone', 'happy', 'night', 'kisses', 'grr']"
Borracho no come dulce porque: (a) Corta la pea; (b) Potencia la pea?????,"['borracho', 'come', 'dulce', 'corta', 'pea', 'potencia', 'pea']",Drunkard does not eat candy because: (a) He cuts the pea; (b) Power the pea ?????,"['drunkard', 'eat', 'candy', 'cuts', 'pea', 'power', 'pea']"
"Me llegó un SMS de Chavez, ¿quién carrizo le habrá dicho que yo quiero que mi plata se gaste en eso?","['llegó', 'sms', 'chavez', '¿quién', 'carrizo', 'dicho', 'quiero', 'plata', 'gaste']","I received an SMS from Chavez, who would have told him that I want my money to be spent on that?","['received', 'sms', 'chavez', 'would', 'told', 'want', 'money', 'spent']"
¡Después el show de tratar de calzar la maleta en el espacio para medirlas!,"['¡después', 'show', 'tratar', 'calzar', 'maleta', 'espacio', 'medirlas']",After the show of trying to fit the suitcase in the space to measure them!,"['show', 'trying', 'fit', 'suitcase', 'space', 'measure']"
Las excusas: Lo que pasa es que esta roto; tengo los regalos de navidad; ¡pero ya me dejaron pasarlo!; Pero si lo meto todo acá es una pieza,"['excusas', 'pasa', 'roto', 'regalos', 'navidad', '¡pero', 'dejaron', 'pasarlo', 'si', 'meto', 'acá', 'pieza']",The excuses: What happens is that it is broken; I have the Christmas gifts; But they already let me pass it !; But if I put everything here it is a piece,"['excuses', 'happens', 'broken', 'christmas', 'gifts', 'already', 'let', 'pass', 'put', 'everything', 'piece']"
Que desesperación que no podamos seguir instrucciones... 1 pieza de equipaje: Todos con 20. Tiene que chequearlo: Mil excusas...,"['desesperación', 'podamos', 'seguir', 'instrucciones', 'pieza', 'equipaje', 'chequearlo', 'mil', 'excusas']",What despair that we cannot follow instructions ... 1 piece of luggage: All with 20. You have to check it: A thousand excuses ...,"['despair', 'cannot', 'follow', 'instructions', 'piece', 'luggage', 'check', 'thousand', 'excuses']"
@helenapulidom No te acostumbres... Después te pasa factura!,"['helenapulidom', 'acostumbres', 'después', 'pasa', 'factura']",@helenapulidom Don't get used to it ... Then it takes its toll!,"['helenapulidom', 'get', 'used', 'takes', 'toll']"
"Ella se llama ""Linda"", sus papás no entendían de ironía...","['llama', 'linda', 'papás', 'entendían', 'ironía']","Her name is ""Linda"", her parents did not understand irony ...","['name', 'linda', 'parents', 'understand', 'irony']"
Felicitaciones! RT @andonigoico: Felicitaciones al sinvergüenza quien hoy se postgradua @gafrontado cursoooo!,"['felicitaciones', 'rt', 'andonigoico', 'felicitaciones', 'sinvergüenza', 'hoy', 'postgradua', 'gafrontado', 'cursoooo']",Congratulations! RT @andonigoico: Congratulations to the scoundrel who today graduated @gafrontado coursooo!,"['congratulations', 'rt', 'andonigoico', 'congratulations', 'scoundrel', 'today', 'graduated', 'gafrontado', 'coursooo']"
Going home!!! (But not arriving 'till tomorrow),"['going', 'home', 'but', 'not', 'arriving', 'till', 'tomorrow']",Going home!!! (But not arriving 'till tomorrow),"['going', 'home', 'arriving', 'till', 'tomorrow']"
"El primer problema era llegar a la cantidad de páginas, el segundo problema es que quitar para que no se pase de las páginas","['primer', 'problema', 'llegar', 'cantidad', 'páginas', 'segundo', 'problema', 'quitar', 'pase', 'páginas']","The first problem was to get to the number of pages, the second problem is to remove so that it does not go over the pages","['first', 'problem', 'get', 'number', 'pages', 'second', 'problem', 'remove', 'go', 'pages']"
"@helenapulidom Te cambio las luces por el trabajo que estoy haciendo pues!!! Llego en 1 semana, asi que calma pueblo!","['helenapulidom', 'cambio', 'luces', 'trabajo', 'haciendo', 'pues', 'llego', 'semana', 'asi', 'calma', 'pueblo']","@helenapulidom I'll change the lights for the work I'm doing well !!! I arrive in 1 week, so calm down town!","['helenapulidom', 'change', 'lights', 'work', 'well', 'arrive', 'week', 'calm', 'town']"
Mumford & Sons: Increible!!!!!  http://t.co/sm3pHCJp,"['mumford', 'sons', 'increible']",Mumford & Sons: Increible!!!!!  http://t.co/sm3pHCJp,"['mumford', 'sons', 'increible']"
