id,conversation_id,created_at,date,time,timezone,user_id,username,name,place,tweet,language,mentions,urls,photos,replies_count,retweets_count,likes_count,hashtags,cashtags,link,retweet,quote_url,video,thumbnail,near,geo,source,user_rt_id,user_rt,retweet_id,reply_to,retweet_date,translate,trans_src,trans_dest
87579707641561088,87579707641561088,2011-07-03 13:53:24 Venezuela Standard Time,2011-07-03,13:53:24,-0400,23865123,bpulidom,Bernardo Pulido M,,"Jaua: ""Cuando el pueblo se divide o deja que lo dividen"" ¿Quiénes son los que han fomentado la división?",es,[],[],[],0,0,0,[],[],https://twitter.com/bpulidom/status/87579707641561088,False,,0,,,,,,,,[],,,,
87573689037627392,87572968842084352,2011-07-03 13:29:29 Venezuela Standard Time,2011-07-03,13:29:29,-0400,23865123,bpulidom,Bernardo Pulido M,,"@miguelsabal ahhh no, estas tarde. Chiste de anoche, Que @dandmv te explique!",es,"[{'screen_name': 'dandmv', 'name': 'daniel de majo', 'id': '112892772'}]",[],[],0,0,0,[],[],https://twitter.com/bpulidom/status/87573689037627392,False,,0,,,,,,,,[],,,,
87416879970394112,87416879970394112,2011-07-03 03:06:22 Venezuela Standard Time,2011-07-03,03:06:22,-0400,23865123,bpulidom,Bernardo Pulido M,,@miguelsabal es un latifundista!!!!,es,[],[],[],0,0,0,[],[],https://twitter.com/bpulidom/status/87416879970394112,False,,0,,,,,,,,[],,,,
87407386331070464,87407386331070464,2011-07-03 02:28:39 Venezuela Standard Time,2011-07-03,02:28:39,-0400,23865123,bpulidom,Bernardo Pulido M,,Felicitaciones al pana @NachoHernandezB que ya esta todo matrimoniaó!!!,es,"[{'screen_name': 'nachohernandezb', 'name': 'nacho hernandez', 'id': '30586599'}]",[],[],0,0,0,[],[],https://twitter.com/bpulidom/status/87407386331070464,False,,0,,,,,,,,[],,,,
87350497094287360,87350497094287360,2011-07-02 22:42:36 Venezuela Standard Time,2011-07-02,22:42:36,-0400,23865123,bpulidom,Bernardo Pulido M,,Por lo menos unos buenos! Pq los del Gobierno no!RT @CodigoVenezuela: Maduro: órganos de Chávez están perfectos -  http://tinyurl.com/5swlwut,es,"[{'screen_name': 'codigovenezuela', 'name': 'codigo venezuela', 'id': '991357202345709568'}]",[],[],0,0,0,[],[],https://twitter.com/bpulidom/status/87350497094287360,False,,0,,,,,,,,[],,,,
86909524337897472,86909524337897472,2011-07-01 17:30:19 Venezuela Standard Time,2011-07-01,17:30:19,-0400,23865123,bpulidom,Bernardo Pulido M,,"@Chacao Hora Pico y en el Boulevard Uslar hay carros y motos estacionados, ocupando canales necesarios para circular... Importante quitarlos",es,[],[],[],0,0,0,[],[],https://twitter.com/bpulidom/status/86909524337897472,False,,0,,,,,,,,[],,,,
86900386694316032,86900386694316032,2011-07-01 16:54:01 Venezuela Standard Time,2011-07-01,16:54:01,-0400,23865123,bpulidom,Bernardo Pulido M,,¡Este gobierno es tan Pitiyanqui que hasta el 4 de julio (día de la independencia Norteamericana) es feriado!,es,[],[],[],0,0,0,[],[],https://twitter.com/bpulidom/status/86900386694316032,False,,0,,,,,,,,[],,,,
86566529214316545,86566529214316545,2011-06-30 18:47:23 Venezuela Standard Time,2011-06-30,18:47:23,-0400,23865123,bpulidom,Bernardo Pulido M,,Muchas gracias! Fue todo un honor! RT @FreddyGuevara: Felicitaciones a @bpulidom por haber recibido condecoración del Cabildo Metropolitano,es,"[{'screen_name': 'freddyguevara', 'name': 'freddyguevara', 'id': '2977029640'}, {'screen_name': 'bpulidom', 'name': 'bernardo pulido m', 'id': '23865123'}]",[],[],1,0,0,[],[],https://twitter.com/bpulidom/status/86566529214316545,False,,0,,,,,,,,[],,,,
86461868604014592,86461868604014592,2011-06-30 11:51:30 Venezuela Standard Time,2011-06-30,11:51:30,-0400,23865123,bpulidom,Bernardo Pulido M,,"Próximos a presentar #LaMejorVzla en Zulia, excelente trabajo del equipo de @VP_Zulia",es,[],[],[],0,1,0,['lamejorvzla'],[],https://twitter.com/bpulidom/status/86461868604014592,False,,0,,,,,,,,[],,,,
86164371717373952,86164371717373952,2011-06-29 16:09:21 Venezuela Standard Time,2011-06-29,16:09:21,-0400,23865123,bpulidom,Bernardo Pulido M,,"En el MacZul va a se mañana la presentación de La Mejor Venezuela en Zulia, por eso estamos acá hoy",es,[],[],[],0,0,0,[],[],https://twitter.com/bpulidom/status/86164371717373952,False,,0,,,,,,,,[],,,,
86164178821332992,86164178821332992,2011-06-29 16:08:35 Venezuela Standard Time,2011-06-29,16:08:35,-0400,23865123,bpulidom,Bernardo Pulido M,,"Es impresionante como el MacZul podría ser un museo de talla mundial, lamentablemente no hay inversión en cultura",es,[],[],[],0,0,0,[],[],https://twitter.com/bpulidom/status/86164178821332992,False,,0,,,,,,,,[],,,,
86163907022028800,86163907022028800,2011-06-29 16:07:30 Venezuela Standard Time,2011-06-29,16:07:30,-0400,23865123,bpulidom,Bernardo Pulido M,,"Lamentablemente solo funcionan 3 salas y hay muy pocas obras pero la estructura es muy bonita, son atentos y esta bien conservado",es,[],[],[],0,0,0,[],[],https://twitter.com/bpulidom/status/86163907022028800,False,,0,,,,,,,,[],,,,
86163667263029249,86163667263029249,2011-06-29 16:06:33 Venezuela Standard Time,2011-06-29,16:06:33,-0400,23865123,bpulidom,Bernardo Pulido M,,"Saliendo del MacZul (Museo de Arte Contemporaneo del Zulia), gratamente impresionado",es,[],[],[],0,0,0,[],[],https://twitter.com/bpulidom/status/86163667263029249,False,,0,,,,,,,,[],,,,
85745395988312064,85745395988312064,2011-06-28 12:24:30 Venezuela Standard Time,2011-06-28,12:24:30,-0400,23865123,bpulidom,Bernardo Pulido M,,El artículo 279 es claro en la selección del Contralor: 1) Comité de Postulaciones 2) Postulación de terna 3) Votación por 2/3 de la AN,es,[],[],[],0,1,0,[],[],https://twitter.com/bpulidom/status/85745395988312064,False,,0,,,,,,,,[],,,,
85744910011072513,85744910011072513,2011-06-28 12:22:34 Venezuela Standard Time,2011-06-28,12:22:34,-0400,23865123,bpulidom,Bernardo Pulido M,,"Saliendo de la fiscalía, solicitamos a la Fiscal como pdta del P. Ciudadano q se siga el procedimiento correcto para designar Contralor",es,[],[],[],0,2,0,[],[],https://twitter.com/bpulidom/status/85744910011072513,False,,0,,,,,,,,[],,,,
84113114882248704,84112088364097536,2011-06-24 00:18:23 Venezuela Standard Time,2011-06-24,00:18:23,-0400,23865123,bpulidom,Bernardo Pulido M,,"@Awesomejoha uhi que chimbo, vamos a pedirle a Yu el lunes que le pregunte al guardia, el usa esa oficina. Que mal en verdad, pero ese aparc",es,[],[],[],1,0,0,[],[],https://twitter.com/bpulidom/status/84113114882248704,False,,0,,,,,,,,[],,,,
84111398443032576,84111398443032576,2011-06-24 00:11:34 Venezuela Standard Time,2011-06-24,00:11:34,-0400,23865123,bpulidom,Bernardo Pulido M,,"@Awesomejoha Joha, estaba tratando de responderte por DM pero no me deja, no recuerdo haberlo visto :s",es,[],[],[],2,0,0,[],[],https://twitter.com/bpulidom/status/84111398443032576,False,,0,,,,,,,,[],,,,
83950508238323712,83947915114065920,2011-06-23 13:32:15 Venezuela Standard Time,2011-06-23,13:32:15,-0400,23865123,bpulidom,Bernardo Pulido M,,@IsaBellera por qué pasa eso? Estoy igual! No logro concentrarme en nada! Jejeje,es,[],[],[],0,0,0,[],[],https://twitter.com/bpulidom/status/83950508238323712,False,,0,,,,,,,,[],,,,
83902739062587392,83901874830450688,2011-06-23 10:22:26 Venezuela Standard Time,2011-06-23,10:22:26,-0400,23865123,bpulidom,Bernardo Pulido M,,"@ManuelAvendano Gracias... Si hubieras dicho comunicador o administrador sería creible, pero de ingeniero esta difícil",es,[],[],[],1,0,0,[],[],https://twitter.com/bpulidom/status/83902739062587392,False,,0,,,,,,,,[],,,,
83902447747215362,83894829855145984,2011-06-23 10:21:17 Venezuela Standard Time,2011-06-23,10:21:17,-0400,23865123,bpulidom,Bernardo Pulido M,,@gustavoguaido Gracias Gus!,es,[],[],[],0,0,0,[],[],https://twitter.com/bpulidom/status/83902447747215362,False,,0,,,,,,,,[],,,,
83894125707001856,83879790137982976,2011-06-23 09:48:12 Venezuela Standard Time,2011-06-23,09:48:12,-0400,23865123,bpulidom,Bernardo Pulido M,,@yiyipulido Muchas gracias! A ti también colega!,es,[],[],[],0,1,0,[],[],https://twitter.com/bpulidom/status/83894125707001856,False,,0,,,,,,,,[],,,,
83894012049768448,83894012049768448,2011-06-23 09:47:45 Venezuela Standard Time,2011-06-23,09:47:45,-0400,23865123,bpulidom,Bernardo Pulido M,,"Así es! Gracias RT @Robirote: ""La abogacía es la profesión más hermosa ya que te enseña a luchar por el respeto de los derechos d los demás""",es,"[{'screen_name': 'robirote', 'name': 'robirote .·.', 'id': '48998272'}]",[],[],0,0,0,[],[],https://twitter.com/bpulidom/status/83894012049768448,False,,0,,,,,,,,[],,,,
83757296500477952,83757296500477952,2011-06-23 00:44:30 Venezuela Standard Time,2011-06-23,00:44:30,-0400,23865123,bpulidom,Bernardo Pulido M,,"Decir esto es insólito, peeeero... No saben cuanto odio que justo esta semana sea fin largo. ¡Yo necesito el viernes!",es,[],[],[],0,0,0,[],[],https://twitter.com/bpulidom/status/83757296500477952,False,,0,,,,,,,,[],,,,
82847802710953984,82847802710953984,2011-06-20 12:30:30 Venezuela Standard Time,2011-06-20,12:30:30,-0400,23865123,bpulidom,Bernardo Pulido M,,RT@ligiabolivar: En Vzla cerca d 90% de solicitudes de refugio son rechazds sin suficiente fundamentación de negativa #DDHH DíadelRefugiado,es,"[{'screen_name': 'ligiabolivar', 'name': 'ligia bolivar', 'id': '67643026'}]",[],[],0,0,0,['ddhh'],[],https://twitter.com/bpulidom/status/82847802710953984,False,,0,,,,,,,,[],,,,
82301732952096769,82301732952096769,2011-06-19 00:20:36 Venezuela Standard Time,2011-06-19,00:20:36,-0400,23865123,bpulidom,Bernardo Pulido M,,Si la cola sigue así al momento que entre me van a decir que se van...,es,[],[],[],1,0,0,[],[],https://twitter.com/bpulidom/status/82301732952096769,False,,0,,,,,,,,[],,,,
81792725833359360,81792725833359360,2011-06-17 14:38:00 Venezuela Standard Time,2011-06-17,14:38:00,-0400,23865123,bpulidom,Bernardo Pulido M,,Para esto necesitamos tanto armamento de guerra:  http://yfrog.com/kfoyzphj ¡agredir a los ciudadanos!,es,[],[],[],0,0,0,[],[],https://twitter.com/bpulidom/status/81792725833359360,False,,0,,,,,,,,[],,,,
81789961841557505,81789961841557505,2011-06-17 14:27:01 Venezuela Standard Time,2011-06-17,14:27:01,-0400,23865123,bpulidom,Bernardo Pulido M,,¿Por qué no se están allanando e investigando a todas las empresas metalúrgicas del Estado? Estoy seguro que allí si hay cosas extrañas,es,[],[],[],0,0,0,[],[],https://twitter.com/bpulidom/status/81789961841557505,False,,0,,,,,,,,[],,,,
81789625433194496,81789625433194496,2011-06-17 14:25:40 Venezuela Standard Time,2011-06-17,14:25:40,-0400,23865123,bpulidom,Bernardo Pulido M,,Cabe destacar que todo este show empezó porque un director de Sidor sí estaba implicado en el tráfico de cabillas,es,[],[],[],0,0,0,[],[],https://twitter.com/bpulidom/status/81789625433194496,False,,0,,,,,,,,[],,,,
81789387557437440,81789387557437440,2011-06-17 14:24:44 Venezuela Standard Time,2011-06-17,14:24:44,-0400,23865123,bpulidom,Bernardo Pulido M,,Tratando de cubrir la ineficiencia del gobierno se hace una cacería de brujas contra todas aquellas empresas que funcionan eficientemente,es,[],[],[],0,0,0,[],[],https://twitter.com/bpulidom/status/81789387557437440,False,,0,,,,,,,,[],,,,
81788994475659264,81788994475659264,2011-06-17 14:23:10 Venezuela Standard Time,2011-06-17,14:23:10,-0400,23865123,bpulidom,Bernardo Pulido M,,Otro ataque a la Empresa Privada: RT @la_patilla: DIM allanó galpón de Maploca en Bolívar  http://bit.ly/jZqsXj,es,"[{'screen_name': 'la_patilla', 'name': 'la patilla', 'id': '124172948'}]",[],[],0,0,0,[],[],https://twitter.com/bpulidom/status/81788994475659264,False,,0,,,,,,,,[],,,,
81637439210397696,81637439210397696,2011-06-17 04:20:56 Venezuela Standard Time,2011-06-17,04:20:56,-0400,23865123,bpulidom,Bernardo Pulido M,,Are we Human or are we dancers???!!!!!,en,[],[],[],0,0,0,[],[],https://twitter.com/bpulidom/status/81637439210397696,False,,0,,,,,,,,[],,,,
81519047447035904,81514137166938112,2011-06-16 20:30:30 Venezuela Standard Time,2011-06-16,20:30:30,-0400,23865123,bpulidom,Bernardo Pulido M,,@IsaBellera que éxito! Mi cita es en un mes!,es,[],[],[],0,0,0,[],[],https://twitter.com/bpulidom/status/81519047447035904,False,,0,,,,,,,,[],,,,
81426223292612608,81426223292612608,2011-06-16 14:21:39 Venezuela Standard Time,2011-06-16,14:21:39,-0400,23865123,bpulidom,Bernardo Pulido M,,Acoso y persecución a la empresa privada: RT @la_patilla: DIM allana Hierrobeco en Puerto Ordaz  http://bit.ly/k64Bma,es,"[{'screen_name': 'la_patilla', 'name': 'la patilla', 'id': '124172948'}]",[],[],0,0,0,[],[],https://twitter.com/bpulidom/status/81426223292612608,False,,0,,,,,,,,[],,,,
80410747196276736,80409005398306816,2011-06-13 19:06:30 Venezuela Standard Time,2011-06-13,19:06:30,-0400,23865123,bpulidom,Bernardo Pulido M,,@VeronicaBakhos si buscas azucar o harina seguro que te confundes y no sabes en qué país estás,es,[],[],[],0,0,0,[],[],https://twitter.com/bpulidom/status/80410747196276736,False,,0,,,,,,,,[],,,,
80304717221216256,80304717221216256,2011-06-13 12:05:11 Venezuela Standard Time,2011-06-13,12:05:11,-0400,23865123,bpulidom,Bernardo Pulido M,,"El Cjal. @FreddyGuevara presenta hoy el Consejo Metropolitano de Seguridad Ciudadana, espacio de articulación entre las policías de Caracas",es,"[{'screen_name': 'freddyguevara', 'name': 'freddyguevara', 'id': '2977029640'}]",[],[],0,0,0,[],[],https://twitter.com/bpulidom/status/80304717221216256,False,,0,,,,,,,,[],,,,
80278409275641857,80273968346562560,2011-06-13 10:20:38 Venezuela Standard Time,2011-06-13,10:20:38,-0400,23865123,bpulidom,Bernardo Pulido M,,@rafbello @CaroRodriguezO Felicitaciones Caro! Que éxito!,es,"[{'screen_name': 'carorodriguezo', 'name': 'caror', 'id': '46134053'}]",[],[],0,0,0,[],[],https://twitter.com/bpulidom/status/80278409275641857,False,,0,,,,,,,,[],,,,
78911920119365632,78911920119365632,2011-06-09 15:50:42 Venezuela Standard Time,2011-06-09,15:50:42,-0400,23865123,bpulidom,Bernardo Pulido M,,Que triste es cuando con discurso tratan de disfrazar una cruda realidad de pobreza e ineficiencia estatal,es,[],[],[],0,0,0,[],[],https://twitter.com/bpulidom/status/78911920119365632,False,,0,,,,,,,,[],,,,
78911615763877888,78911615763877888,2011-06-09 15:49:29 Venezuela Standard Time,2011-06-09,15:49:29,-0400,23865123,bpulidom,Bernardo Pulido M,,"Ahora no los llaman damnificados, les dicen dignificados... Estoy seguro que los que están en carpas en La Carlota se sienten así",es,[],[],[],0,0,0,[],[],https://twitter.com/bpulidom/status/78911615763877888,False,,0,,,,,,,,[],,,,
77277102260494336,77277102260494336,2011-06-05 03:34:31 Venezuela Standard Time,2011-06-05,03:34:31,-0400,23865123,bpulidom,Bernardo Pulido M,,Buena rumba no??? RT @lele_candiales: @elisatot @bpulidom  http://yfrog.com/eh6v8mj,es,"[{'screen_name': 'lele_candiales', 'name': 'valeria candiales', 'id': '70473950'}, {'screen_name': 'elisatot', 'name': 'elisa totaro', 'id': '29254278'}, {'screen_name': 'bpulidom', 'name': 'bernardo pulido m', 'id': '23865123'}]",[],[],0,0,0,[],[],https://twitter.com/bpulidom/status/77277102260494336,False,,0,,,,,,,,[],,,,
75649546633486336,75649546633486336,2011-05-31 15:47:12 Venezuela Standard Time,2011-05-31,15:47:12,-0400,23865123,bpulidom,Bernardo Pulido M,,Algún problema con mi chullo peruano??? @JvSalcedoM @gustavoguaido @jguaido @elisatot  http://lockerz.com/s/106516827,es,"[{'screen_name': 'gustavoguaido', 'name': 'gustavo guaido', 'id': '66577664'}, {'screen_name': 'jguaido', 'name': 'juan guaidó', 'id': '39176902'}, {'screen_name': 'elisatot', 'name': 'elisa totaro', 'id': '29254278'}]",[],[],0,0,0,[],[],https://twitter.com/bpulidom/status/75649546633486336,False,,0,,,,,,,,[],,,,
75558057433763840,75555150521053184,2011-05-31 09:43:39 Venezuela Standard Time,2011-05-31,09:43:39,-0400,23865123,bpulidom,Bernardo Pulido M,,"@virginiazamora Yo quiero el ministerio de los ""Caucasicodescendientes""",es,[],[],[],0,0,0,[],[],https://twitter.com/bpulidom/status/75558057433763840,False,,0,,,,,,,,[],,,,
74161420559859712,74158885426053120,2011-05-27 13:13:55 Venezuela Standard Time,2011-05-27,13:13:55,-0400,23865123,bpulidom,Bernardo Pulido M,,@arianisha  http://lockerz.com/s/105244309 ese laberinto es demasiado fino!!!,es,[],[],[],0,0,0,[],[],https://twitter.com/bpulidom/status/74161420559859712,False,,0,,,,,,,,[],,,,
74158282167693312,74158282167693312,2011-05-27 13:01:26 Venezuela Standard Time,2011-05-27,13:01:26,-0400,23865123,bpulidom,Bernardo Pulido M,,Excelente! RT @anapalacios2710: Equipo #UCAB ganador del Concurso Interamericano de Derechos Humanos!!! Felicidades!!!!   http://t.co/OacSgCE,es,[],['http://yfrog.com/h3vdfumyj'],[],0,3,0,['ucab'],[],https://twitter.com/bpulidom/status/74158282167693312,False,,0,,,,,,,,[],,,,
74156611324751872,74156611324751872,2011-05-27 12:54:48 Venezuela Standard Time,2011-05-27,12:54:48,-0400,23865123,bpulidom,Bernardo Pulido M,,El concurso Interamericano de DDHH es la simulación de la Corte Interamericana más importante y de más nivel.,es,[],[],[],0,0,0,[],[],https://twitter.com/bpulidom/status/74156611324751872,False,,0,,,,,,,,[],,,,
74155564506161152,74155564506161152,2011-05-27 12:50:38 Venezuela Standard Time,2011-05-27,12:50:38,-0400,23865123,bpulidom,Bernardo Pulido M,,"Manuel Andrés (@ManuelCasas) y Rolando, son unos duros! Felicitaciones!!!",es,"[{'screen_name': 'manuelcasas', 'name': 'manuel casas', 'id': '74824536'}]",[],[],0,1,0,[],[],https://twitter.com/bpulidom/status/74155564506161152,False,,0,,,,,,,,[],,,,
74155345626406912,74155345626406912,2011-05-27 12:49:46 Venezuela Standard Time,2011-05-27,12:49:46,-0400,23865123,bpulidom,Bernardo Pulido M,,Felicitaciones a la delegación UCAB en el Moot Court de American University! Reventaron!,es,[],[],[],0,2,0,[],[],https://twitter.com/bpulidom/status/74155345626406912,False,,0,,,,,,,,[],,,,
74151098746810368,74140543680118784,2011-05-27 12:32:54 Venezuela Standard Time,2011-05-27,12:32:54,-0400,23865123,bpulidom,Bernardo Pulido M,,@ligiabolivar lo que no cabía era mi maletín de mano! Avisa en lo que hayan noticias de American!,es,[],[],[],0,0,0,[],[],https://twitter.com/bpulidom/status/74151098746810368,False,,0,,,,,,,,[],,,,
74139989037953025,74138956610027520,2011-05-27 11:48:45 Venezuela Standard Time,2011-05-27,11:48:45,-0400,23865123,bpulidom,Bernardo Pulido M,,@ligiabolivar Barquisimeto hoy y mañana. Sabemos algo de American?,es,[],[],[],0,0,0,[],[],https://twitter.com/bpulidom/status/74139989037953025,False,,0,,,,,,,,[],,,,
74138277006942208,74138277006942208,2011-05-27 11:41:57 Venezuela Standard Time,2011-05-27,11:41:57,-0400,23865123,bpulidom,Bernardo Pulido M,,Lo que mas rabia me da es que: 1) No hay nadie que responda por las quejas de uno y 2) No hay opciones distintas a esta porquería...,es,[],[],[],0,0,0,[],[],https://twitter.com/bpulidom/status/74138277006942208,False,,0,,,,,,,,[],,,,
74137837339017217,74137837339017217,2011-05-27 11:40:12 Venezuela Standard Time,2011-05-27,11:40:12,-0400,23865123,bpulidom,Bernardo Pulido M,,"Aserca: El vuelo sale 3:30 tarde, me quitan mi puesto y no cabe el equipaje ¿Calidad? ¿Buen servicio?",es,[],[],[],0,0,0,[],[],https://twitter.com/bpulidom/status/74137837339017217,False,,0,,,,,,,,[],,,,
74110672832696320,74110672832696320,2011-05-27 09:52:15 Venezuela Standard Time,2011-05-27,09:52:15,-0400,23865123,bpulidom,Bernardo Pulido M,,"Aserca es la peor aereolinea que existe. Me iba en el vuelo de las 7:30 a.m., acá sigo esperando.",es,[],[],[],0,0,0,[],[],https://twitter.com/bpulidom/status/74110672832696320,False,,0,,,,,,,,[],,,,
73131502187192321,73131502187192321,2011-05-24 17:01:23 Venezuela Standard Time,2011-05-24,17:01:23,-0400,23865123,bpulidom,Bernardo Pulido M,,Felicitación en Farsi??? Gracias! RT @eddyacs: @bpulidom Tavalodet Mobarak!!! Alguien te felicitó en farsi ya? Jeje q cumplas muchos más :),es,"[{'screen_name': 'eddyacs', 'name': 'eddy', 'id': '33834140'}, {'screen_name': 'bpulidom', 'name': 'bernardo pulido m', 'id': '23865123'}]",[],[],0,0,0,[],[],https://twitter.com/bpulidom/status/73131502187192321,False,,0,,,,,,,,[],,,,
73131361619296256,73131361619296256,2011-05-24 17:00:49 Venezuela Standard Time,2011-05-24,17:00:49,-0400,23865123,bpulidom,Bernardo Pulido M,,Todavía te faltan unos 4 años para decir eso! RT @andrespulidom: No hay cuarto malo @bpulidom,es,"[{'screen_name': 'andrespulidom', 'name': 'andres pulido', 'id': '303472948'}, {'screen_name': 'bpulidom', 'name': 'bernardo pulido m', 'id': '23865123'}]",[],[],0,0,0,[],[],https://twitter.com/bpulidom/status/73131361619296256,False,,0,,,,,,,,[],,,,
73131192236511232,73130186840875008,2011-05-24 17:00:09 Venezuela Standard Time,2011-05-24,17:00:09,-0400,23865123,bpulidom,Bernardo Pulido M,,@mcarolinarojas Muuuuuchas Gracias!,es,[],[],[],0,0,0,[],[],https://twitter.com/bpulidom/status/73131192236511232,False,,0,,,,,,,,[],,,,
72841455919570944,72840337361612800,2011-05-23 21:48:51 Venezuela Standard Time,2011-05-23,21:48:51,-0400,23865123,bpulidom,Bernardo Pulido M,,@lomejor18 ya lo tiene @andrespulidom síguelo! (Empezó hace poco así que no escribe mucho),es,"[{'screen_name': 'andrespulidom', 'name': 'andres pulido', 'id': '303472948'}]",[],[],0,0,0,[],[],https://twitter.com/bpulidom/status/72841455919570944,False,,0,,,,,,,,[],,,,
72829261353979904,72829261353979904,2011-05-23 21:00:23 Venezuela Standard Time,2011-05-23,21:00:23,-0400,23865123,bpulidom,Bernardo Pulido M,,"jejejeje si, es mi hermano menor! RT @lomejor18: ese andres pulido será hermano de @bpulidom (?)",es,"[{'screen_name': 'lomejor18', 'name': 'tony', 'id': '40397510'}, {'screen_name': 'bpulidom', 'name': 'bernardo pulido m', 'id': '23865123'}]",[],[],0,0,0,[],[],https://twitter.com/bpulidom/status/72829261353979904,False,,0,,,,,,,,[],,,,
72823912672669696,72823912672669696,2011-05-23 20:39:08 Venezuela Standard Time,2011-05-23,20:39:08,-0400,23865123,bpulidom,Bernardo Pulido M,,¡Mi hermano @andrespulidom hablando en @globovision!,es,"[{'screen_name': 'andrespulidom', 'name': 'andres pulido', 'id': '303472948'}, {'screen_name': 'globovision', 'name': 'globovisión', 'id': '17485551'}]",[],[],0,0,0,[],[],https://twitter.com/bpulidom/status/72823912672669696,False,,0,,,,,,,,[],,,,
72702879537963010,72701506570289152,2011-05-23 12:38:11 Venezuela Standard Time,2011-05-23,12:38:11,-0400,23865123,bpulidom,Bernardo Pulido M,,"@CDelgadoSalas @rafbello @TomasHHR @dsmolansky esta en la otra llave de CU, pero también @EdwardJ6",es,"[{'screen_name': 'rafbello', 'name': 'rafael bello', 'id': '45682047'}, {'screen_name': 'tomashhr', 'name': 'tomas hernandez', 'id': '62649769'}, {'screen_name': 'dsmolansky', 'name': 'david smolansky', 'id': '78944377'}, {'screen_name': 'edwardj6', 'name': 'edward pérez', 'id': '69513878'}]",[],[],0,1,0,[],[],https://twitter.com/bpulidom/status/72702879537963010,False,,0,,,,,,,,[],,,,
72702485038497792,72702485038497792,2011-05-23 12:36:37 Venezuela Standard Time,2011-05-23,12:36:37,-0400,23865123,bpulidom,Bernardo Pulido M,,!Escuchen a @YonGoicoechea y @darielasosa que están estrenando programa en RCR (750 AM) justo ahora!,es,"[{'screen_name': 'yongoicoechea', 'name': 'yon goicoechea', 'id': '55478032'}, {'screen_name': 'darielasosa', 'name': 'd a r i e l a', 'id': '53551839'}]",[],[],0,1,0,[],[],https://twitter.com/bpulidom/status/72702485038497792,False,,0,,,,,,,,[],,,,
72700299843874816,72700299843874816,2011-05-23 12:27:56 Venezuela Standard Time,2011-05-23,12:27:56,-0400,23865123,bpulidom,Bernardo Pulido M,,Y hoy tengo a otra Pulido (@hpulidom) empezando su 1era campaña RT @TomasHHR: Un dia como hoy..  @dsmolansky @rafbello @CdelgadoSalas,es,"[{'screen_name': 'hpulidom', 'name': 'hector jose pulido m', 'id': '1226192635'}, {'screen_name': 'tomashhr', 'name': 'tomas hernandez', 'id': '62649769'}, {'screen_name': 'dsmolansky', 'name': 'david smolansky', 'id': '78944377'}, {'screen_name': 'rafbello', 'name': 'rafael bello', 'id': '45682047'}, {'screen_name': 'cdelgadosalas', 'name': 'carlos delgado salas', 'id': '87115433'}]",[],[],0,0,0,[],[],https://twitter.com/bpulidom/status/72700299843874816,False,,0,,,,,,,,[],,,,
72670828269027330,72670828269027330,2011-05-23 10:30:50 Venezuela Standard Time,2011-05-23,10:30:50,-0400,23865123,bpulidom,Bernardo Pulido M,,(Aparte en el Comité Ejecutivo y dirigiendo a @ECO_UCAB esta mi hermanita @helenapulidom) Así que sigan a los dos usuarios!,es,"[{'screen_name': 'eco_ucab', 'name': '.....', 'id': '301235891'}, {'screen_name': 'helenapulidom', 'name': 'helena pulido', 'id': '108715748'}]",[],[],0,1,0,[],[],https://twitter.com/bpulidom/status/72670828269027330,False,,0,,,,,,,,[],,,,
72670588556152832,72670588556152832,2011-05-23 10:29:53 Venezuela Standard Time,2011-05-23,10:29:53,-0400,23865123,bpulidom,Bernardo Pulido M,,"A los ucabistas que me siguen, los recomiendo seguir a @ECO_UCAB excelente plancha de Comunicación Social",es,"[{'screen_name': 'eco_ucab', 'name': '.....', 'id': '301235891'}]",[],[],0,1,0,[],[],https://twitter.com/bpulidom/status/72670588556152832,False,,0,,,,,,,,[],,,,
72635807776780288,72635807776780288,2011-05-23 08:11:40 Venezuela Standard Time,2011-05-23,08:11:40,-0400,23865123,bpulidom,Bernardo Pulido M,,Veo contento como muchas excelentes personas con las que trabajé cuando yo era representante estudiantil están optando por distintos cargos,es,[],[],[],0,0,0,[],[],https://twitter.com/bpulidom/status/72635807776780288,False,,0,,,,,,,,[],,,,
72635439105843200,72635439105843200,2011-05-23 08:10:12 Venezuela Standard Time,2011-05-23,08:10:12,-0400,23865123,bpulidom,Bernardo Pulido M,,Hoy comenzó la campaña para las elecciones de Representantes Estudiantiles en @lacatolica,es,"[{'screen_name': 'lacatolica', 'name': 'ucab', 'id': '966399183568756736'}]",[],[],0,0,0,[],[],https://twitter.com/bpulidom/status/72635439105843200,False,,0,,,,,,,,[],,,,
