id,conversation_id,created_at,date,time,timezone,user_id,username,name,place,tweet,language,mentions,urls,photos,replies_count,retweets_count,likes_count,hashtags,cashtags,link,retweet,quote_url,video,thumbnail,near,geo,source,user_rt_id,user_rt,retweet_id,reply_to,retweet_date,translate,trans_src,trans_dest
473638759259725825,473638759259725825,2014-06-02 21:34:14 Venezuela Standard Time,2014-06-02,21:34:14,-0400,23865123,bpulidom,Bernardo Pulido M,,"Audiencia @leopoldolopez: Por lo prolongado de la audiencia (11 horas) se solicitó se difiera, la juez está decidiendo",es,"[{'screen_name': 'leopoldolopez', 'name': 'leopoldo lópez', 'id': '42434332'}]",[],[],3,91,5,[],[],https://twitter.com/bpulidom/status/473638759259725825,False,,0,,,,,,,,[],,,,
473638372574257153,473638372574257153,2014-06-02 21:32:42 Venezuela Standard Time,2014-06-02,21:32:42,-0400,23865123,bpulidom,Bernardo Pulido M,,"Audiencia @leopoldolopez: llevamos más de 11 horas de audiencia, acaban de terminar de declarar los acusados con la declaración de Leopoldo",es,"[{'screen_name': 'leopoldolopez', 'name': 'leopoldo lópez', 'id': '42434332'}]",[],[],1,87,11,[],[],https://twitter.com/bpulidom/status/473638372574257153,False,,0,,,,,,,,[],,,,
473576538395672576,473576538395672576,2014-06-02 17:27:00 Venezuela Standard Time,2014-06-02,17:27:00,-0400,23865123,bpulidom,Bernardo Pulido M,,Audiencia @leopoldolopez: Cuando regresemos del receso empiezan a declarar los imputados (4 estudiantes y Leopoldo) y luego habla la defensa,es,"[{'screen_name': 'leopoldolopez', 'name': 'leopoldo lópez', 'id': '42434332'}]",[],[],4,195,10,[],[],https://twitter.com/bpulidom/status/473576538395672576,False,,0,,,,,,,,[],,,,
473575854870904832,473575854870904832,2014-06-02 17:24:17 Venezuela Standard Time,2014-06-02,17:24:17,-0400,23865123,bpulidom,Bernardo Pulido M,,"Audiencia @leopoldolopez: La fiscal dice ""Si no hubiera hecho la convocatoria nada de esto hubiera ocurrido por eso es culpable""",es,"[{'screen_name': 'leopoldolopez', 'name': 'leopoldo lópez', 'id': '42434332'}]",[],[],70,443,18,[],[],https://twitter.com/bpulidom/status/473575854870904832,False,,0,,,,,,,,[],,,,
473575577891639297,473575577891639297,2014-06-02 17:23:11 Venezuela Standard Time,2014-06-02,17:23:11,-0400,23865123,bpulidom,Bernardo Pulido M,,"Audiencia @leopoldolopez: El Ministerio Público basa su caso en la ""influencia subliminal"" del discurso y tweets de Leopoldo",es,"[{'screen_name': 'leopoldolopez', 'name': 'leopoldo lópez', 'id': '42434332'}]",[],[],40,324,15,[],[],https://twitter.com/bpulidom/status/473575577891639297,False,,0,,,,,,,,[],,,,
473575350770085888,473575350770085888,2014-06-02 17:22:16 Venezuela Standard Time,2014-06-02,17:22:16,-0400,23865123,bpulidom,Bernardo Pulido M,,"Audiencia @leopoldolopez: Estamos en receso, ya habló la fiscalía y la procuraduría",es,"[{'screen_name': 'leopoldolopez', 'name': 'leopoldo lópez', 'id': '42434332'}]",[],[],1,59,2,[],[],https://twitter.com/bpulidom/status/473575350770085888,False,,0,,,,,,,,[],,,,
472367401674506240,472126006447587329,2014-05-30 09:22:19 Venezuela Standard Time,2014-05-30,09:22:19,-0400,23865123,bpulidom,Bernardo Pulido M,,@daily_yarid que bueno que les haya gustado! Les cuento de esto la semana que viene!,es,[],[],[],0,0,0,[],[],https://twitter.com/bpulidom/status/472367401674506240,False,,0,,,,,,,,[],,,,
472125834158161921,472125515034558464,2014-05-29 17:22:25 Venezuela Standard Time,2014-05-29,17:22:25,-0400,23865123,bpulidom,Bernardo Pulido M,,"@mfsa56 esta bien mala la conexión de wifi, pero trato",es,[],[],[],1,0,0,[],[],https://twitter.com/bpulidom/status/472125834158161921,False,,0,,,,,,,,[],,,,
464946491057246208,464946491057246208,2014-05-09 21:54:16 Venezuela Standard Time,2014-05-09,21:54:16,-0400,23865123,bpulidom,Bernardo Pulido M,,"Hoy en Venezuela vivimos todos con libertad condicional, en toque de queda sin decretar y con sentencia de muerte esperando por ejecución",es,[],[],[],1,160,22,[],[],https://twitter.com/bpulidom/status/464946491057246208,False,,0,,,,,,,,[],,,,
464946070259499008,464946070259499008,2014-05-09 21:52:36 Venezuela Standard Time,2014-05-09,21:52:36,-0400,23865123,bpulidom,Bernardo Pulido M,,"Libertad condicional para Rodrigo Diamanti (@RDiamanti). Al igual que todos en Venezuela, condicionada a los antojos del régimen...",es,"[{'screen_name': 'rdiamanti', 'name': 'rodrigo diamanti', 'id': '41714095'}]",[],[],0,48,3,[],[],https://twitter.com/bpulidom/status/464946070259499008,False,,0,,,,,,,,[],,,,
464424663566024704,464415532260024320,2014-05-08 11:20:43 Venezuela Standard Time,2014-05-08,11:20:43,-0400,23865123,bpulidom,Bernardo Pulido M,,@mapaula5 que por decisión administrativa de la propia juez no trabajan el día de hoy,es,[],[],[],1,1,0,[],[],https://twitter.com/bpulidom/status/464424663566024704,False,,0,,,,,,,,[],,,,
464415532260024320,464415532260024320,2014-05-08 10:44:25 Venezuela Standard Time,2014-05-08,10:44:25,-0400,23865123,bpulidom,Bernardo Pulido M,,"Difieren la audiencia de @leopoldolopez, el tribunal no tiene ""despacho"", aún no sabemos para cuando será diferida la audiencia",es,"[{'screen_name': 'leopoldolopez', 'name': 'leopoldo lópez', 'id': '42434332'}]",[],[],3,28,2,[],[],https://twitter.com/bpulidom/status/464415532260024320,False,,0,,,,,,,,[],,,,
464382876730273792,464376476020666368,2014-05-08 08:34:40 Venezuela Standard Time,2014-05-08,08:34:40,-0400,23865123,bpulidom,Bernardo Pulido M,,"@lornamarcano no, el ataque a los campamentos es simplemente una muestra más del carácter autoritario del régimen",es,[],[],[],1,1,0,[],[],https://twitter.com/bpulidom/status/464382876730273792,False,,0,,,,,,,,[],,,,
464379742792482816,464376476020666368,2014-05-08 08:22:13 Venezuela Standard Time,2014-05-08,08:22:13,-0400,23865123,bpulidom,Bernardo Pulido M,,"@aaron_nahum también luchamos por ellos, no podemos dejar de hacerlo!",es,[],[],[],0,0,0,[],[],https://twitter.com/bpulidom/status/464379742792482816,False,,0,,,,,,,,[],,,,
464373859731648512,464373859731648512,2014-05-08 07:58:50 Venezuela Standard Time,2014-05-08,07:58:50,-0400,23865123,bpulidom,Bernardo Pulido M,,"Hoy es la audiencia preliminar de @leopoldolopez, esperamos que pese a lo difícil que parece, ¡se haga justicia!",es,"[{'screen_name': 'leopoldolopez', 'name': 'leopoldo lópez', 'id': '42434332'}]",[],[],1,28,4,[],[],https://twitter.com/bpulidom/status/464373859731648512,False,,0,,,,,,,,[],,,,
464251469391474688,464251469391474688,2014-05-07 23:52:30 Venezuela Standard Time,2014-05-07,23:52:30,-0400,23865123,bpulidom,Bernardo Pulido M,,"Detuvieron a mi amigo @RDiamanti (Rodrigo Diamanti), quien es activista y defensor de DDHH. Parece que defender derechos es ahora delito...",es,"[{'screen_name': 'rdiamanti', 'name': 'rodrigo diamanti', 'id': '41714095'}]",[],[],1,90,12,[],[],https://twitter.com/bpulidom/status/464251469391474688,False,,0,,,,,,,,[],,,,
461191375879675906,461189275770691585,2014-04-29 13:12:47 Venezuela Standard Time,2014-04-29,13:12:47,-0400,23865123,bpulidom,Bernardo Pulido M,,"@isabelcecilia1 le suspendieron la visita familiar, a los abogados de él no deberían poder negarnos el acceso",es,[],[],[],0,2,0,[],[],https://twitter.com/bpulidom/status/461191375879675906,False,,0,,,,,,,,[],,,,
461173530114392065,461173530114392065,2014-04-29 12:01:52 Venezuela Standard Time,2014-04-29,12:01:52,-0400,23865123,bpulidom,Bernardo Pulido M,,El mejor regalo que todos podemos hacerle a @leopoldolopez es seguir trabajando por una mejor Venezuela #CumpleLeopoldo,es,"[{'screen_name': 'leopoldolopez', 'name': 'leopoldo lópez', 'id': '42434332'}]",[],[],0,29,1,['cumpleleopoldo'],[],https://twitter.com/bpulidom/status/461173530114392065,False,,0,,,,,,,,[],,,,
461172482234662912,461171871858556928,2014-04-29 11:57:42 Venezuela Standard Time,2014-04-29,11:57:42,-0400,23865123,bpulidom,Bernardo Pulido M,,@hjmalonso la visita de los abogados no puede ser restringida,es,[],[],[],1,0,1,[],[],https://twitter.com/bpulidom/status/461172482234662912,False,,0,,,,,,,,[],,,,
461171871858556928,461171871858556928,2014-04-29 11:55:17 Venezuela Standard Time,2014-04-29,11:55:17,-0400,23865123,bpulidom,Bernardo Pulido M,,"Lamentablemente hoy no podré ir a su casa para celebrar su cumpleaños, me toca visitarlo en la cárcel #CumpleLeopoldo #INJusticia",es,[],[],[],1,14,3,"['cumpleleopoldo', 'injusticia']",[],https://twitter.com/bpulidom/status/461171871858556928,False,,0,,,,,,,,[],,,,
461171523500670976,461171523500670976,2014-04-29 11:53:54 Venezuela Standard Time,2014-04-29,11:53:54,-0400,23865123,bpulidom,Bernardo Pulido M,,Hoy @leopoldolopez cumple 43 años privado de libertad. 70 días le han robado por tratar de construir una mejor Venezuela #CumpleLeopoldo,es,"[{'screen_name': 'leopoldolopez', 'name': 'leopoldo lópez', 'id': '42434332'}]",[],[],0,14,0,['cumpleleopoldo'],[],https://twitter.com/bpulidom/status/461171523500670976,False,,0,,,,,,,,[],,,,
454498381394870272,454498381394870272,2014-04-11 01:57:12 Venezuela Standard Time,2014-04-11,01:57:12,-0400,23865123,bpulidom,Bernardo Pulido M,,"Mientras el diálogo sea discurso y no conversación poco sirve. Repito, siguen siendo necesarios respeto e igualdad de condiciones",es,[],[],[],0,38,6,[],[],https://twitter.com/bpulidom/status/454498381394870272,False,,0,,,,,,,,[],,,,
454497584384860160,454497584384860160,2014-04-11 01:54:02 Venezuela Standard Time,2014-04-11,01:54:02,-0400,23865123,bpulidom,Bernardo Pulido M,,"Nicolás paga y se da el vuelto. Este discurso, arrogante y poco reflexivo, resume la noche: no vinimos a escuchar, sólo a hablarle a la TV",es,[],[],[],2,64,10,[],[],https://twitter.com/bpulidom/status/454497584384860160,False,,0,,,,,,,,[],,,,
454494681699987457,454494681699987457,2014-04-11 01:42:30 Venezuela Standard Time,2014-04-11,01:42:30,-0400,23865123,bpulidom,Bernardo Pulido M,,"Que fastidio el eterno cuento del 11 de Abril, eso fue hace 12 años... ¿Cuántos años más vamos a oír esta cantaleta?",es,[],[],[],12,88,10,[],[],https://twitter.com/bpulidom/status/454494681699987457,False,,0,,,,,,,,[],,,,
454485078400565249,454485078400565249,2014-04-11 01:04:21 Venezuela Standard Time,2014-04-11,01:04:21,-0400,23865123,bpulidom,Bernardo Pulido M,,Hablando de nuevo de espacios no institucionales... ¿Por qué no se habla de las soluciones económicas en la AN?,es,[],[],[],0,14,1,[],[],https://twitter.com/bpulidom/status/454485078400565249,False,,0,,,,,,,,[],,,,
454476799854907393,454475883689291776,2014-04-11 00:31:27 Venezuela Standard Time,2014-04-11,00:31:27,-0400,23865123,bpulidom,Bernardo Pulido M,,@angelar86 y pusimos a batear varios que se han debido quedar en la banca,es,[],[],[],2,0,1,[],[],https://twitter.com/bpulidom/status/454476799854907393,False,,0,,,,,,,,[],,,,
454471031747801088,454471031747801088,2014-04-11 00:08:32 Venezuela Standard Time,2014-04-11,00:08:32,-0400,23865123,bpulidom,Bernardo Pulido M,,"Para todo hay una comisión, para todo hay una conferencia, para nada se usa el espacio institucional...",es,[],[],[],4,67,7,[],[],https://twitter.com/bpulidom/status/454471031747801088,False,,0,,,,,,,,[],,,,
453750591765102592,453742266046480384,2014-04-09 00:25:46 Venezuela Standard Time,2014-04-09,00:25:46,-0400,23865123,bpulidom,Bernardo Pulido M,,"@PepeClavijoA pareciera que la memoria es colectiva es corta, quien recuerda tiene el deber de alzar su bandera y los demás deben respetarlo",es,[],[],[],1,0,0,[],[],https://twitter.com/bpulidom/status/453750591765102592,False,,0,,,,,,,,[],,,,
453747237739585536,453746590604214272,2014-04-09 00:12:26 Venezuela Standard Time,2014-04-09,00:12:26,-0400,23865123,bpulidom,Bernardo Pulido M,,"Si es.. Pero valga la reflexión!, si al menos uno deja de hacerlo valdrá la pena! RT @Mariaiginia: Creo que ya es tarde",es,"[{'screen_name': 'mariaiginia', 'name': 'maria iginia silva', 'id': '66160188'}]",[],[],0,0,0,[],[],https://twitter.com/bpulidom/status/453747237739585536,False,,0,,,,,,,,[],,,,
453745986587099136,453742266046480384,2014-04-09 00:07:28 Venezuela Standard Time,2014-04-09,00:07:28,-0400,23865123,bpulidom,Bernardo Pulido M,,"@dayerleen es así, no nos representan a todos. Pero en la discusión no podemos rebajarnos a la agresión, ese nunca debe ser nuestro camino",es,[],[],[],0,0,0,[],[],https://twitter.com/bpulidom/status/453745986587099136,False,,0,,,,,,,,[],,,,
453744864673669120,453744864673669120,2014-04-09 00:03:00 Venezuela Standard Time,2014-04-09,00:03:00,-0400,23865123,bpulidom,Bernardo Pulido M,,Me preocupa también que en defensa u oposición del diálogo insultemos a otros. ¿Cómo promover algo que nosotros mismos no practicamos?,es,[],[],[],2,25,4,[],[],https://twitter.com/bpulidom/status/453744864673669120,False,,0,,,,,,,,[],,,,
453743994233966592,453743994233966592,2014-04-08 23:59:33 Venezuela Standard Time,2014-04-08,23:59:33,-0400,23865123,bpulidom,Bernardo Pulido M,,Me preocupa también que muchas personas en defensa u oposición del diálogo insulten a otras. ¿Cómo promuevo algo que no práctico?,es,[],[],[],1,18,4,[],[],https://twitter.com/bpulidom/status/453743994233966592,False,,0,,,,,,,,[],,,,
453743630734622722,453743630734622722,2014-04-08 23:58:06 Venezuela Standard Time,2014-04-08,23:58:06,-0400,23865123,bpulidom,Bernardo Pulido M,,"Soy defensor de hablar para solucionar problemas, pero una conversación honesta siempre debe venir de la humildad e igualdad de condiciones",es,[],[],[],0,39,6,[],[],https://twitter.com/bpulidom/status/453743630734622722,False,,0,,,,,,,,[],,,,
453742730221740032,453742730221740032,2014-04-08 23:54:31 Venezuela Standard Time,2014-04-08,23:54:31,-0400,23865123,bpulidom,Bernardo Pulido M,,"También me preocupa que no nos estamos oyendo ni leyendo, veo muchos mensajes que se refieren a cosas que nadie ha dicho...",es,[],[],[],0,17,3,[],[],https://twitter.com/bpulidom/status/453742730221740032,False,,0,,,,,,,,[],,,,
453742266046480384,453742266046480384,2014-04-08 23:52:41 Venezuela Standard Time,2014-04-08,23:52:41,-0400,23865123,bpulidom,Bernardo Pulido M,,Me preocupa enormemente ver como ya llamamos a unos y a otros 'radicales'. Estamos comprando el discurso de división de quienes oponemos,es,[],[],[],3,39,4,[],[],https://twitter.com/bpulidom/status/453742266046480384,False,,0,,,,,,,,[],,,,
452891438942941185,452891438942941185,2014-04-06 15:31:48 Venezuela Standard Time,2014-04-06,15:31:48,-0400,23865123,bpulidom,Bernardo Pulido M,,"Triste... la ""Revolución"" le sigue robando a la patria sus mejores hombres. ¡No descansaremos hasta que por ellos hagamos justicia!",es,[],[],[],2,48,6,[],[],https://twitter.com/bpulidom/status/452891438942941185,False,,0,,,,,,,,[],,,,
452239463159431168,452239463159431168,2014-04-04 20:21:04 Venezuela Standard Time,2014-04-04,20:21:04,-0400,23865123,bpulidom,Bernardo Pulido M,,"Nicolás, ¿Cómo es eso de que tu si puedes pedir la renuncia de autoridades pero no se puede pedir la renuncia tuya?",es,[],[],[],3,95,6,[],[],https://twitter.com/bpulidom/status/452239463159431168,False,,0,,,,,,,,[],,,,
452239108774326273,452239108774326273,2014-04-04 20:19:40 Venezuela Standard Time,2014-04-04,20:19:40,-0400,23865123,bpulidom,Bernardo Pulido M,,"Maduro dice de Muchacho: debería renunciar porque es un incapaz, es un incompetente. ¿No es por eso mismo que acusaron a @leopoldolopez hoy?",es,"[{'screen_name': 'leopoldolopez', 'name': 'leopoldo lópez', 'id': '42434332'}]",[],[],3,25,1,[],[],https://twitter.com/bpulidom/status/452239108774326273,False,,0,,,,,,,,[],,,,
452134346984783872,452134346984783872,2014-04-04 13:23:23 Venezuela Standard Time,2014-04-04,13:23:23,-0400,23865123,bpulidom,Bernardo Pulido M,,La justicia injusta mantiene a @leopoldolopez sin tener elementos que lo vinculen a los delitos de los cuales lo acusan,es,"[{'screen_name': 'leopoldolopez', 'name': 'leopoldo lópez', 'id': '42434332'}]",[],[],3,59,1,[],[],https://twitter.com/bpulidom/status/452134346984783872,False,,0,,,,,,,,[],,,,
452134035679350784,452134035679350784,2014-04-04 13:22:09 Venezuela Standard Time,2014-04-04,13:22:09,-0400,23865123,bpulidom,Bernardo Pulido M,,"Estamos revisando la acusación y los elementos probatorios que incluyó el MP, es bastante larga la acusación",es,[],[],[],1,32,0,[],[],https://twitter.com/bpulidom/status/452134035679350784,False,,0,,,,,,,,[],,,,
452133637832839168,452133637832839168,2014-04-04 13:20:34 Venezuela Standard Time,2014-04-04,13:20:34,-0400,23865123,bpulidom,Bernardo Pulido M,,"El MP acusa formalmente a @leopoldolopez por los mismos 4 delitos (daños, incendio, instigación y asoc. para delinquir)",es,"[{'screen_name': 'leopoldolopez', 'name': 'leopoldo lópez', 'id': '42434332'}]",[],[],6,92,2,[],[],https://twitter.com/bpulidom/status/452133637832839168,False,,0,,,,,,,,[],,,,
451737220870062081,451737220870062081,2014-04-03 11:05:20 Venezuela Standard Time,2014-04-03,11:05:20,-0400,23865123,bpulidom,Bernardo Pulido M,,"Esto es un insulto a todos como ciudadanos: ""las colas demuestran importante poder adquisitivo"" (VP de Mercal)  http://t.co/jNj1DA47nU",es,[],['http://goo.gl/LRmYO9'],[],1,32,1,[],[],https://twitter.com/bpulidom/status/451737220870062081,False,,0,,,,,,,,[],,,,
450308354401767424,450307438160658432,2014-03-30 12:27:32 Venezuela Standard Time,2014-03-30,12:27:32,-0400,23865123,bpulidom,Bernardo Pulido M,,"@marianodealba o también que nadie aparte de ellos pueden saber que tan ""bien fundamentadas"" están porque no han publicado sentencia...",es,[],[],[],2,2,0,[],[],https://twitter.com/bpulidom/status/450308354401767424,False,,0,,,,,,,,[],,,,
449007413052854272,449007413052854272,2014-03-26 22:18:04 Venezuela Standard Time,2014-03-26,22:18:04,-0400,23865123,bpulidom,Bernardo Pulido M,,Irónico el show de hoy conmemorando la salida de Chávez de la cárcel mientras meten más inocentes dentro de ellas #INjusticiarevolucionaria,es,[],[],[],1,48,4,['injusticiarevolucionaria'],[],https://twitter.com/bpulidom/status/449007413052854272,False,,0,,,,,,,,[],,,,
446484331175743488,446484331175743488,2014-03-19 23:12:14 Venezuela Standard Time,2014-03-19,23:12:14,-0400,23865123,bpulidom,Bernardo Pulido M,,El servilismo de los jueces y el uso acomodaticio de la justicia será la prueba más contundente de su propia sentencia,es,[],[],[],1,54,4,[],[],https://twitter.com/bpulidom/status/446484331175743488,False,,0,,,,,,,,[],,,,
446484004431085568,446484004431085568,2014-03-19 23:10:56 Venezuela Standard Time,2014-03-19,23:10:56,-0400,23865123,bpulidom,Bernardo Pulido M,,Que no crean los jueces cómplices que los verdaderos demócratas olvidaremos su nefasta actitud en tiempos oscuros,es,[],[],[],4,92,8,[],[],https://twitter.com/bpulidom/status/446484004431085568,False,,0,,,,,,,,[],,,,
446469456743911424,446469456743911424,2014-03-19 22:13:08 Venezuela Standard Time,2014-03-19,22:13:08,-0400,23865123,bpulidom,Bernardo Pulido M,,"¡Hermano @Daniel_Ceballos, estamos contigo, estamos del lado correcto de la historia y por eso haremos justicia!",es,"[{'screen_name': 'daniel_ceballos', 'name': 'daniel_ceballos', 'id': '1015614675101339648'}]",[],[],0,31,4,[],[],https://twitter.com/bpulidom/status/446469456743911424,False,,0,,,,,,,,[],,,,
444546967499452416,444494841775656960,2014-03-14 14:53:50 Venezuela Standard Time,2014-03-14,14:53:50,-0400,23865123,bpulidom,Bernardo Pulido M,,@oa4089262 lo voy a buscar! Gracias por la info!,es,[],[],[],0,0,0,[],[],https://twitter.com/bpulidom/status/444546967499452416,False,,0,,,,,,,,[],,,,
444516621059911680,444494841775656960,2014-03-14 12:53:15 Venezuela Standard Time,2014-03-14,12:53:15,-0400,23865123,bpulidom,Bernardo Pulido M,,"@oa4089262 así es, yo respondía diciendo que no fue un reconocimiento, que fue una certificación y ya otorgada",es,[],[],[],2,0,1,[],[],https://twitter.com/bpulidom/status/444516621059911680,False,,0,,,,,,,,[],,,,
444499760586956800,444497447633825792,2014-03-14 11:46:16 Venezuela Standard Time,2014-03-14,11:46:16,-0400,23865123,bpulidom,Bernardo Pulido M,,@YajaLud Es así... Cuento distinto,es,[],[],[],1,0,0,[],[],https://twitter.com/bpulidom/status/444499760586956800,False,,0,,,,,,,,[],,,,
444498716331110400,444498716331110400,2014-03-14 11:42:07 Venezuela Standard Time,2014-03-14,11:42:07,-0400,23865123,bpulidom,Bernardo Pulido M,,"La Defensora mostró el certificado de la acreditación, la revisión se hizo el año pasado (2013) con información suministrada por ellos",es,[],[],[],0,16,0,[],[],https://twitter.com/bpulidom/status/444498716331110400,False,,0,,,,,,,,[],,,,
444497447633825792,444497447633825792,2014-03-14 11:37:04 Venezuela Standard Time,2014-03-14,11:37:04,-0400,23865123,bpulidom,Bernardo Pulido M,,"Esta certificación (dada bajo los Principios de París) no es un premio, sólo declara su condición como institución de DDHH",es,[],[],[],1,21,1,[],[],https://twitter.com/bpulidom/status/444497447633825792,False,,0,,,,,,,,[],,,,
444497205442134016,444497205442134016,2014-03-14 11:36:06 Venezuela Standard Time,2014-03-14,11:36:06,-0400,23865123,bpulidom,Bernardo Pulido M,,"La defensoría del pueblo si esta certificada como NHRI (Institución nacional de Derechos Humanos) como la de Argentina, México, Nicaragua...",es,[],[],[],0,11,1,[],[],https://twitter.com/bpulidom/status/444497205442134016,False,,0,,,,,,,,[],,,,
444496779124703232,444494841775656960,2014-03-14 11:34:25 Venezuela Standard Time,2014-03-14,11:34:25,-0400,23865123,bpulidom,Bernardo Pulido M,,"@alvarezgales es una certificación que hacen a las NHRIs (instituciones Nacionales de Derechos Humanos), pero no es premio, sólo condición",es,[],[],[],2,7,1,[],[],https://twitter.com/bpulidom/status/444496779124703232,False,,0,,,,,,,,[],,,,
444495089428348928,444495089428348928,2014-03-14 11:27:42 Venezuela Standard Time,2014-03-14,11:27:42,-0400,23865123,bpulidom,Bernardo Pulido M,,Lo otorgado a la defensora fue una certificación como organización gubernamental de acuerdo a los Principios de París,es,[],[],[],1,34,1,[],[],https://twitter.com/bpulidom/status/444495089428348928,False,,0,,,,,,,,[],,,,
444494841775656960,444494841775656960,2014-03-14 11:26:43 Venezuela Standard Time,2014-03-14,11:26:43,-0400,23865123,bpulidom,Bernardo Pulido M,,"La defensora del pueblo ha circulado una información que hace entender que la ONU le dio un reconocimiento, ¡es falso!",es,[],[],[],6,105,9,[],[],https://twitter.com/bpulidom/status/444494841775656960,False,,0,,,,,,,,[],,,,
443882393037193216,443860707852161024,2014-03-12 18:53:04 Venezuela Standard Time,2014-03-12,18:53:04,-0400,23865123,bpulidom,Bernardo Pulido M,,@hernanmendezm aparte dejan el caso abierto para poder seguir presionando si lo necesitaran....,es,[],[],[],0,0,0,[],[],https://twitter.com/bpulidom/status/443882393037193216,False,,0,,,,,,,,[],,,,
443882216800940032,443860707852161024,2014-03-12 18:52:22 Venezuela Standard Time,2014-03-12,18:52:22,-0400,23865123,bpulidom,Bernardo Pulido M,,"@hernanmendezm la medida es un tanto vacía, hay una amenaza de que si no impiden barricadas los pueden meter presos pero nada concreto",es,[],[],[],0,1,0,[],[],https://twitter.com/bpulidom/status/443882216800940032,False,,0,,,,,,,,[],,,,
443867969882685440,443867969882685440,2014-03-12 17:55:45 Venezuela Standard Time,2014-03-12,17:55:45,-0400,23865123,bpulidom,Bernardo Pulido M,,"El caso de @dsmolansky y @GerardoBlyde sentencian en 6 días, la nulidad de la denuncia de la Convención americana tiene 2 años sin respuesta",es,"[{'screen_name': 'dsmolansky', 'name': 'david smolansky', 'id': '78944377'}, {'screen_name': 'gerardoblyde', 'name': 'gerardo blyde', 'id': '75891845'}]",[],[],2,31,1,[],[],https://twitter.com/bpulidom/status/443867969882685440,False,,0,,,,,,,,[],,,,
443864074481573888,443864074481573888,2014-03-12 17:40:16 Venezuela Standard Time,2014-03-12,17:40:16,-0400,23865123,bpulidom,Bernardo Pulido M,, http://t.co/q8vFIInrtJ La sentencia en contra de @dsmolansky y @GerardoBlyde pueden ver en este link Otra joya de la justicia revolucionaria,es,"[{'screen_name': 'dsmolansky', 'name': 'david smolansky', 'id': '78944377'}, {'screen_name': 'gerardoblyde', 'name': 'gerardo blyde', 'id': '75891845'}]",['http://www.tsj.gov.ve/decisiones/scon/marzo/161913-135-12314-2014-14-0194.HTML'],[],2,29,0,[],[],https://twitter.com/bpulidom/status/443864074481573888,False,,0,,,,,,,,[],,,,
443861825277681664,443861825277681664,2014-03-12 17:31:20 Venezuela Standard Time,2014-03-12,17:31:20,-0400,23865123,bpulidom,Bernardo Pulido M,,"El TSJ dicta una ""medida cautelar innominada"" que no dice nada, sólo promover, desplegar actividades, cosas que los alcaldes ya han hecho",es,[],[],[],1,19,2,[],[],https://twitter.com/bpulidom/status/443861825277681664,False,,0,,,,,,,,[],,,,
443860707852161024,443860707852161024,2014-03-12 17:26:53 Venezuela Standard Time,2014-03-12,17:26:53,-0400,23865123,bpulidom,Bernardo Pulido M,,"El TSJ una vez más al servicio de la política, dicta medida cautelar en contra de @dsmolansky y @GerardoBlyde",es,"[{'screen_name': 'dsmolansky', 'name': 'david smolansky', 'id': '78944377'}, {'screen_name': 'gerardoblyde', 'name': 'gerardo blyde', 'id': '75891845'}]",[],[],6,81,3,[],[],https://twitter.com/bpulidom/status/443860707852161024,False,,0,,,,,,,,[],,,,
443029895359516672,443029895359516672,2014-03-10 10:25:32 Venezuela Standard Time,2014-03-10,10:25:32,-0400,23865123,bpulidom,Bernardo Pulido M,,Hoy se cumplen 20 días de la injusta e ilegal privación de libertad de @leopoldolopez. ¡Lucháremos para que se haga justicia!,es,"[{'screen_name': 'leopoldolopez', 'name': 'leopoldo lópez', 'id': '42434332'}]",[],[],0,46,6,[],[],https://twitter.com/bpulidom/status/443029895359516672,False,,0,,,,,,,,[],,,,
