id,conversation_id,created_at,date,time,timezone,user_id,username,name,place,tweet,language,mentions,urls,photos,replies_count,retweets_count,likes_count,hashtags,cashtags,link,retweet,quote_url,video,thumbnail,near,geo,source,user_rt_id,user_rt,retweet_id,reply_to,retweet_date,translate,trans_src,trans_dest
1224157810012889088,1224157716886802433,2020-02-02 22:29:00 Venezuela Standard Time,2020-02-02,22:29:00,-0400,245892239,arthur_canga,Arturo Canga,,"Hay cosas que se pueden mejorar, pero en definitiva la serie estuvo a la altura de lo que esperaba el fandom y una buena apertura para Disney+. Espero con ansias una segunda temporada.  7.5/10  https://t.co/DI9HJw4uNW",es,[],[],['https://pbs.twimg.com/media/EP0VBixWkAUpQ88.jpg'],1,0,0,[],[],https://twitter.com/Arthur_Canga/status/1224157810012889088,False,,1,https://pbs.twimg.com/media/EP0VBixWkAUpQ88.jpg,,,,,,,[],,,,
1224157788538052609,1224157716886802433,2020-02-02 22:28:55 Venezuela Standard Time,2020-02-02,22:28:55,-0400,245892239,arthur_canga,Arturo Canga,,"Y de paso la ejecución del enfoque: no es una serie de acción cualquiera, es un space western super bien ejecutado y Pedro Pascal es tremendo Dirty Harry.",es,[],[],[],1,0,0,[],[],https://twitter.com/Arthur_Canga/status/1224157788538052609,False,,0,,,,,,,,[],,,,
1224157786994626560,1224157716886802433,2020-02-02 22:28:54 Venezuela Standard Time,2020-02-02,22:28:54,-0400,245892239,arthur_canga,Arturo Canga,,"Algo que sí me gustó fue el enfoque: al completamente distinto. Nada de jedis, rebeldes, comandos de la república, cazarrecompensas genéricos, no. Los FUCKING MANDALORIAN, una orden con tanto material para aprovechar que en Legends hay guerras solo de ellos.  https://t.co/DndDkeYuYn",es,[],[],['https://pbs.twimg.com/media/EP0VBH3WsAAjGEc.jpg'],1,0,0,[],[],https://twitter.com/Arthur_Canga/status/1224157786994626560,False,,1,https://pbs.twimg.com/media/EP0VBH3WsAAjGEc.jpg,,,,,,,[],,,,
1224157781185437697,1224157716886802433,2020-02-02 22:28:53 Venezuela Standard Time,2020-02-02,22:28:53,-0400,245892239,arthur_canga,Arturo Canga,,"Ahora volviendo. El potencial que hay para un nuevo conjunto de materiales audiovisuales de SW (excluyendo las películas ya anunciadas) es inmenso, y la calidad que se puede sacar es inigualable. Disney tiene para hacer crecer SW como al MCU, solo que no querían.",es,[],[],[],1,0,0,[],[],https://twitter.com/Arthur_Canga/status/1224157781185437697,False,,0,,,,,,,,[],,,,
1224157779037913088,1224157716886802433,2020-02-02 22:28:52 Venezuela Standard Time,2020-02-02,22:28:52,-0400,245892239,arthur_canga,Arturo Canga,,"Eso me pone a pensar que Disney innatamente tiene tremendo potencial para juegos de Star Wars, mientras que prefiere seguirle dejando la licencia a una compañía que ni bolas lE pAra  a la calidad de sus productos  https://t.co/brbyo5nPUQ",es,[],[],"['https://pbs.twimg.com/media/EP0U--fWkAE5Szb.jpg', 'https://pbs.twimg.com/media/EP0U--nXUAAzej_.jpg']",1,0,0,[],[],https://twitter.com/Arthur_Canga/status/1224157779037913088,False,,1,https://pbs.twimg.com/media/EP0U--fWkAE5Szb.jpg,,,,,,,[],,,,
1224157743482798083,1224157716886802433,2020-02-02 22:28:44 Venezuela Standard Time,2020-02-02,22:28:44,-0400,245892239,arthur_canga,Arturo Canga,,"Y no es joda lo del videojuego. Mando (el prota) hace tanta vaina fuera de su objetivo principal que cuando regresó pensé que estaba en un diálogo de convencimiento y le iban a salir con un ""sod off"" como un Sigimund Dijkstra a Geralt en TW3 para luego seguir su camino.  https://t.co/2nJvjM87jB",es,[],[],['https://pbs.twimg.com/media/EP0U-OyX4AMYKqo.jpg'],1,0,0,[],[],https://twitter.com/Arthur_Canga/status/1224157743482798083,False,,1,https://pbs.twimg.com/media/EP0U-OyX4AMYKqo.jpg,,,,,,,[],,,,
1224157731436867584,1224157716886802433,2020-02-02 22:28:41 Venezuela Standard Time,2020-02-02,22:28:41,-0400,245892239,arthur_canga,Arturo Canga,,"La trama es simple, fácilmente la podrían haber desarrollado en una miniserie de 5 episodios, el tener 3 episodios de aparente relleno y varios personajes desechables demuestra que se alargó más de lo necesario; al estilo de un videojuego que se alarga de manera artificial.",es,[],[],[],1,0,0,[],[],https://twitter.com/Arthur_Canga/status/1224157731436867584,False,,0,,,,,,,,[],,,,
1224157729109037062,1224157716886802433,2020-02-02 22:28:41 Venezuela Standard Time,2020-02-02,22:28:41,-0400,245892239,arthur_canga,Arturo Canga,,"Esa es otra cosa que me encanta: Jon Favreau. No buscaron a cualquier idiota, Disney buscó al director y artífice de empezar el MCU para ""rescatar"" Star Wars. La idea fue maravillosa, la ejecución no tanto  https://t.co/4W0L553PjB",es,[],[],['https://pbs.twimg.com/media/EP0U9jMWoAYUltV.jpg'],1,0,0,[],[],https://twitter.com/Arthur_Canga/status/1224157729109037062,False,,1,https://pbs.twimg.com/media/EP0U9jMWoAYUltV.jpg,,,,,,,[],,,,
1224157719730556930,1224157716886802433,2020-02-02 22:28:38 Venezuela Standard Time,2020-02-02,22:28:38,-0400,245892239,arthur_canga,Arturo Canga,,"Sí hay cosas que no me gustaron: por ejemplo de una serie de 8 episodios 3 son relleno puro, o al menos lo son para el espectador de la primera temporada, no tengo dudas de que Jon Favreau se va a encargar en desarrollar esas subtramas para las siguientes temporadas, es necesario",es,[],[],[],1,0,0,[],[],https://twitter.com/Arthur_Canga/status/1224157719730556930,False,,0,,,,,,,,[],,,,
1224157718468014080,1224157716886802433,2020-02-02 22:28:38 Venezuela Standard Time,2020-02-02,22:28:38,-0400,245892239,arthur_canga,Arturo Canga,,"Donde vea esta serie tiene una fuerte inspiración en el trabajo original de George para la trilogía original, la trama, los personajes, los diálogos, la escenografía, incluso la banda sonora gritan ""Lucasfilms"" por todos lados",es,[],[],[],1,0,0,[],[],https://twitter.com/Arthur_Canga/status/1224157718468014080,False,,0,,,,,,,,[],,,,
1224157716886802433,1224157716886802433,2020-02-02 22:28:38 Venezuela Standard Time,2020-02-02,22:28:38,-0400,245892239,arthur_canga,Arturo Canga,,"Ah por cierto, en estos días me terminé The Mandalorian y creo que tengo que hacer un hilo-tweet-review porque se lo merece.  Si pudiese resumir esta serie en una frase sería simplemente: George Lucas  https://t.co/HusXMr2eBx",es,[],[],['https://pbs.twimg.com/media/EP0U9B6X0AMvxUJ.jpg'],1,0,0,[],[],https://twitter.com/Arthur_Canga/status/1224157716886802433,False,,1,https://pbs.twimg.com/media/EP0U9B6X0AMvxUJ.jpg,,,,,,,[],,,,
1224147950370246656,1224147950370246656,2020-02-02 21:49:49 Venezuela Standard Time,2020-02-02,21:49:49,-0400,245892239,arthur_canga,Arturo Canga,,Esto es porno?,es,[],[],[],0,0,0,[],[],https://twitter.com/Arthur_Canga/status/1224147950370246656,False,https://twitter.com/LizKatzOfficial/status/1223386438420652035,0,,,,,,,,[],,,,
1224141930898120707,1224141930898120707,2020-02-02 21:25:54 Venezuela Standard Time,2020-02-02,21:25:54,-0400,245892239,arthur_canga,Arturo Canga,,"Quedé decepcionado de que no se Juntaron Shakira, JLo, Bad Bunny y J Balvin a cantar La Canción.  Pero bueh, Shakira ganó.",es,[],[],[],0,0,0,[],[],https://twitter.com/Arthur_Canga/status/1224141930898120707,False,,0,,,,,,,,[],,,,
1224137799059886080,1224137799059886080,2020-02-02 21:09:29 Venezuela Standard Time,2020-02-02,21:09:29,-0400,245892239,arthur_canga,Arturo Canga,,baboni beibe,eu,[],[],[],0,0,0,[],[],https://twitter.com/Arthur_Canga/status/1224137799059886080,False,,0,,,,,,,,[],,,,
1224126261573885952,1224126261573885952,2020-02-02 20:23:38 Venezuela Standard Time,2020-02-02,20:23:38,-0400,245892239,arthur_canga,Arturo Canga,,"Mi mamá ha tomado la manía de tildar a cualquier venezolano medianamente relevante que no opine sobre la política como ""chavista"" o ""enchufado"" porque sí  Los Mangos y El Cafetal. Same Energy.",es,[],[],[],0,0,0,[],[],https://twitter.com/Arthur_Canga/status/1224126261573885952,False,,0,,,,,,,,[],,,,
1224110818528256000,1224105761904553987,2020-02-02 19:22:16 Venezuela Standard Time,2020-02-02,19:22:16,-0400,245892239,arthur_canga,Arturo Canga,,@Camilagon,und,[],[],[],1,0,1,[],[],https://twitter.com/Arthur_Canga/status/1224110818528256000,False,,0,,,,,,,,[],,,,
1224110406828023808,1224105761904553987,2020-02-02 19:20:38 Venezuela Standard Time,2020-02-02,19:20:38,-0400,245892239,arthur_canga,Arturo Canga,,Screenshots from the W10 installation proccess courtesy of @TechDeals_16,en,"[{'screen_name': 'techdeals_16', 'name': 'tech deals', 'id': '715198343001952259'}]",[],[],0,0,0,[],[],https://twitter.com/Arthur_Canga/status/1224110406828023808,False,,0,,,,,,,,[],,,,
1224110405603164163,1224105761904553987,2020-02-02 19:20:38 Venezuela Standard Time,2020-02-02,19:20:38,-0400,245892239,arthur_canga,Arturo Canga,,Also. Si tienen alguna otra duda o problema siempre pueden escribirme al DM y haré lo posible en ayudarlos,es,[],[],[],1,0,0,[],[],https://twitter.com/Arthur_Canga/status/1224110405603164163,False,,0,,,,,,,,[],,,,
1224110403745124353,1224105761904553987,2020-02-02 19:20:37 Venezuela Standard Time,2020-02-02,19:20:37,-0400,245892239,arthur_canga,Arturo Canga,,"Una vez finalizados estos dos pasos deberíamos ser capaces de buscar en la tienda ""Windows 10"" y donde nos da la opción de salir del Modo S ser capaces de aceptar y salir.   Ya eso debería ser todo, disfruten de su W10 funcional fuera del modo S con todo actualizado.",es,[],[],[],1,0,0,[],[],https://twitter.com/Arthur_Canga/status/1224110403745124353,False,,0,,,,,,,,[],,,,
1224110401241190400,1224105761904553987,2020-02-02 19:20:37 Venezuela Standard Time,2020-02-02,19:20:37,-0400,245892239,arthur_canga,Arturo Canga,,"En la Microsoft Store le daremos a los 3 puntos y nos iremos a Descargas y Actualizaciones, allí buscaremos en ""Actualizaciones disponibles"" la propia Microsoft Store y la pondremos a actualizar. Mientras se actualiza añadiremos una cuenta de Microsoft a la tienda.  https://t.co/g3P5KF6oik",es,[],[],"['https://pbs.twimg.com/media/EPzp1_TUEAAObt7.jpg', 'https://pbs.twimg.com/media/EPzp1-6WkAAlm3c.jpg']",1,0,0,[],[],https://twitter.com/Arthur_Canga/status/1224110401241190400,False,,1,https://pbs.twimg.com/media/EPzp1_TUEAAObt7.jpg,,,,,,,[],,,,
1224106751601016834,1224105761904553987,2020-02-02 19:06:07 Venezuela Standard Time,2020-02-02,19:06:07,-0400,245892239,arthur_canga,Arturo Canga,,"Ya en este punto todo debería ser normal, el link debe cargar y redirigirnos a la parte que nos interesa. Sino, vamos con el último par de pasos...",es,[],[],[],1,0,0,[],[],https://twitter.com/Arthur_Canga/status/1224106751601016834,False,,0,,,,,,,,[],,,,
1224106750095347712,1224105761904553987,2020-02-02 19:06:06 Venezuela Standard Time,2020-02-02,19:06:06,-0400,245892239,arthur_canga,Arturo Canga,,"Aquí ya casi hemos terminado. Realizamos la configuración inicial de Windows 10 como siempre y vamos al camino inicial: Configuración&gt;Actualización y Seguridad&gt;Activación, bajamos a nuestro link de la Microsoft Store y le damos click.",es,[],[],[],1,0,0,[],[],https://twitter.com/Arthur_Canga/status/1224106750095347712,False,,0,,,,,,,,[],,,,
1224106747830456320,1224105761904553987,2020-02-02 19:06:06 Venezuela Standard Time,2020-02-02,19:06:06,-0400,245892239,arthur_canga,Arturo Canga,,"A partir de este momento Windows se está instalando, la computadora se puede reiniciar varias veces, es completamente normal. Incluso si mal no recuerdo va a haber un momento en que se apaga, luego la encendemos de la manera más normal del mundo  https://t.co/UPwRv8Acvr",es,[],[],['https://pbs.twimg.com/media/EPzmmGuUYAANeuV.png'],1,0,0,[],[],https://twitter.com/Arthur_Canga/status/1224106747830456320,False,,1,https://pbs.twimg.com/media/EPzmmGuUYAANeuV.png,,,,,,,[],,,,
1224106734064668673,1224105761904553987,2020-02-02 19:06:02 Venezuela Standard Time,2020-02-02,19:06:02,-0400,245892239,arthur_canga,Arturo Canga,,"Luego de borradas todas las particiones vamos a seleccionar el espacio sin asignar de dicho disco y vamos a darle nuevo, dejamos el espacio predeterminado, nos saltará una advertencia, le damos ok y seleccionamos la partición ""Principal"" o ""Main"" y le damos Siguiente.",es,[],[],[],1,0,0,[],[],https://twitter.com/Arthur_Canga/status/1224106734064668673,False,,0,,,,,,,,[],,,,
1224105942599524353,1224105761904553987,2020-02-02 19:02:54 Venezuela Standard Time,2020-02-02,19:02:54,-0400,245892239,arthur_canga,Arturo Canga,,"Cada disco está identificado con un número antes. Lo normal es que tengan uno o dos discos instalados, estos se empiezan a contar desde 0 en adelante. Si no saben cual es el disco y tienen respaldada toda la información pues borren todos y creen nuevas particiones para cada uno.",es,[],[],[],1,0,0,[],[],https://twitter.com/Arthur_Canga/status/1224105942599524353,False,,0,,,,,,,,[],,,,
1224105940141604865,1224105761904553987,2020-02-02 19:02:53 Venezuela Standard Time,2020-02-02,19:02:53,-0400,245892239,arthur_canga,Arturo Canga,,"Aquí vamos a ver muchos discos y particiones. Vamos a buscar un disco con 4 particiones y vamos a eliminar cada una de ellas.. Cada vez que borremos una partición de un mismo disco, el espacio se irá acumulando en ""Espacion sin asignar"".  https://t.co/VgPoHQVaHJ",es,[],[],['https://pbs.twimg.com/media/EPzl2xVWsAAIY03.png'],1,0,0,[],[],https://twitter.com/Arthur_Canga/status/1224105940141604865,False,,1,https://pbs.twimg.com/media/EPzl2xVWsAAIY03.png,,,,,,,[],,,,
1224105925079945216,1224105761904553987,2020-02-02 19:02:49 Venezuela Standard Time,2020-02-02,19:02:49,-0400,245892239,arthur_canga,Arturo Canga,,"Apartir de aquí la cosa se vuelve lineal. Instalar&gt;Windows 10 Home (si pregunta, nunca seleccionen la versión N)&gt;Aceptar&gt;Siguiente. Cuando pregunte que tipo de instalación vamos a seleccionar la segunda opción. ""Custom"" o ""Avanzado"".  https://t.co/n2H8dV8OtH",es,[],[],['https://pbs.twimg.com/media/EPzl1xGUwAAaHiK.png'],1,0,0,[],[],https://twitter.com/Arthur_Canga/status/1224105925079945216,False,,1,https://pbs.twimg.com/media/EPzl1xGUwAAaHiK.png,,,,,,,[],,,,
1224105906109140993,1224105761904553987,2020-02-02 19:02:45 Venezuela Standard Time,2020-02-02,19:02:45,-0400,245892239,arthur_canga,Arturo Canga,,"Una vez accedemos a la BIOS tenemos que tener MUCHO cuidado con lo que se toca, iremos a una parte que diga BOOT y donde diga BOOT ORDER colocaremos de primero lo que se supone que es el pendrive, es decir cualquier cosa que no diga Windows Boot Manager",es,[],[],[],1,0,0,[],[],https://twitter.com/Arthur_Canga/status/1224105906109140993,False,,0,,,,,,,,[],,,,
1224105902657167360,1224105761904553987,2020-02-02 19:02:44 Venezuela Standard Time,2020-02-02,19:02:44,-0400,245892239,arthur_canga,Arturo Canga,,"Ojo que la computadora tiene que estar apagada completamente, conectamos el pendrive y justo cuando le dan al botón de encendido tienen que pulsar un solo botón repetidas veces, si con uno no sirve prueben con el otro. Si ninguno de los dos es entonces busquen el manual de su PC.",es,[],[],[],1,0,0,[],[],https://twitter.com/Arthur_Canga/status/1224105902657167360,False,,0,,,,,,,,[],,,,
1224105900958461952,1224105761904553987,2020-02-02 19:02:44 Venezuela Standard Time,2020-02-02,19:02:44,-0400,245892239,arthur_canga,Arturo Canga,,"Ahora vamos a nuestra PC con Windows 10 S, conectaremos el pendrive y accederemos a la BIOS: justo cuando la encendamos pulsaremos como locos el botón Del (Supr) o F2.",es,[],[],[],1,0,0,[],[],https://twitter.com/Arthur_Canga/status/1224105900958461952,False,,0,,,,,,,,[],,,,
1224105897510699008,1224105761904553987,2020-02-02 19:02:43 Venezuela Standard Time,2020-02-02,19:02:43,-0400,245892239,arthur_canga,Arturo Canga,,Recomiendo a partir de este punto que toda la información en la computadora con Windows 10 S sea respaldada en cualquier otro dispositivo ya que se perderá TODO.,es,[],[],[],1,0,0,[],[],https://twitter.com/Arthur_Canga/status/1224105897510699008,False,,0,,,,,,,,[],,,,
1224105895845605382,1224105761904553987,2020-02-02 19:02:43 Venezuela Standard Time,2020-02-02,19:02:43,-0400,245892239,arthur_canga,Arturo Canga,,"Hecho esto le damos empezar, procuremos no cambiar el nombre para no generar conflictos. Esto debería durar alrededor de unos 20min.",es,[],[],[],1,0,0,[],[],https://twitter.com/Arthur_Canga/status/1224105895845605382,False,,0,,,,,,,,[],,,,
1224105891982692354,1224105761904553987,2020-02-02 19:02:42 Venezuela Standard Time,2020-02-02,19:02:42,-0400,245892239,arthur_canga,Arturo Canga,,"Si decidieron guardar el .ISO van a tener que usar Rufus.  Al abrirlo se van a encontrar con muchos campos, los únicos necesarios son Dispositivo (la letra asignada a su pendrive) y Elección de arranque (colocaremos imagen ISO, le daremos al botón SELECCIONAR y buscaremos el ISO)  https://t.co/nmsR7stoLR",es,[],[],['https://pbs.twimg.com/media/EPzl0CQUcAATPAS.png'],1,0,0,[],[],https://twitter.com/Arthur_Canga/status/1224105891982692354,False,,1,https://pbs.twimg.com/media/EPzl0CQUcAATPAS.png,,,,,,,[],,,,
1224105875800981505,1224105761904553987,2020-02-02 19:02:38 Venezuela Standard Time,2020-02-02,19:02:38,-0400,245892239,arthur_canga,Arturo Canga,,"YO recomiendo crear el archivo ISO y luego instalarlo en el pendrive con Rufus debido a que es mucho más rápido.  Hecho esto empezará a descargar. Dependiendo de su internet les será más o menos rápido, por mi parte yo me fui a dormir y a la mañana siguiente ya estaba listo.",es,[],[],[],1,0,0,[],[],https://twitter.com/Arthur_Canga/status/1224105875800981505,False,,0,,,,,,,,[],,,,
1224105871053148160,1224105761904553987,2020-02-02 19:02:37 Venezuela Standard Time,2020-02-02,19:02:37,-0400,245892239,arthur_canga,Arturo Canga,,Si seleccionamos que queremos usar un USB nos va a preguntar cual queremos usar. NOTA: respalden todo lo que tengan porque va a borrar TODO lo que tenga adentro. Sino nos va a preguntar el nombre y donde queremos guardar el ISO. Yo lo guardé como Windows10.iso en Documentos.  https://t.co/NJ4EUMIGXB,es,[],[],['https://pbs.twimg.com/media/EPzly6ZWoAIk7I0.png'],1,0,0,[],[],https://twitter.com/Arthur_Canga/status/1224105871053148160,False,,1,https://pbs.twimg.com/media/EPzly6ZWoAIk7I0.png,,,,,,,[],,,,
1224105858516254721,1224105761904553987,2020-02-02 19:02:34 Venezuela Standard Time,2020-02-02,19:02:34,-0400,245892239,arthur_canga,Arturo Canga,,"Vamos a seleccionar ""Crear medios de instalación"", seleccionaremos la información necesaria (idioma, versión* y arquitectura**) y nos preguntará si queremos instalarlo en una ""unidad flash USB"" o un ""archivo ISO"".  *la versión SIEMPRE Windows 10 **la arquitectura debe ser x64  https://t.co/5fKMNsmnxv",es,[],[],"['https://pbs.twimg.com/media/EPzlyVZWkAAtkil.png', 'https://pbs.twimg.com/media/EPzlyVYX4AAfYdF.png', 'https://pbs.twimg.com/media/EPzlyVdW4AAeSQO.png']",1,0,0,[],[],https://twitter.com/Arthur_Canga/status/1224105858516254721,False,,1,https://pbs.twimg.com/media/EPzlyVZWkAAtkil.png,,,,,,,[],,,,
1224105846579322881,1224105761904553987,2020-02-02 19:02:31 Venezuela Standard Time,2020-02-02,19:02:31,-0400,245892239,arthur_canga,Arturo Canga,,"En la computadora funcional vamos a descargar Windows Media Creation Tool y vamos a insertar el pendrive. Al abrir el Media Creation Tool cargará algo, nos mostrará el acuerdo de privacidad y cargará otro resto.  https://t.co/BRluWWsopO",es,[],[],['https://pbs.twimg.com/media/EPzlxqQX0AQ0GKb.png'],1,0,0,[],[],https://twitter.com/Arthur_Canga/status/1224105846579322881,False,,1,https://pbs.twimg.com/media/EPzlxqQX0AQ0GKb.png,,,,,,,[],,,,
1224105837532254208,1224105761904553987,2020-02-02 19:02:29 Venezuela Standard Time,2020-02-02,19:02:29,-0400,245892239,arthur_canga,Arturo Canga,,Link de Windows Media Creation Tool (descarga inmediata):  https://t.co/qxNJUaoRDa  Link de Rufus (descarga inmediata):  https://t.co/oWq7lKkdJR,es,[],"['https://go.microsoft.com/fwlink/?LinkId=691209', 'https://github.com/pbatard/rufus/releases/download/v3.8/rufus-3.8p.exe']",[],1,0,0,[],[],https://twitter.com/Arthur_Canga/status/1224105837532254208,False,,0,,,,,,,,[],,,,
1224105835208544256,1224105761904553987,2020-02-02 19:02:28 Venezuela Standard Time,2020-02-02,19:02:28,-0400,245892239,arthur_canga,Arturo Canga,,Vamos a necesitar lo siguiente: &gt;una computadora Windows 100% funcional sin el modo S y con internet &gt;un pendrive de al menos 8GB &gt;Windows Media Creation Tool &gt;Rufus (opcional) &gt;su computadora con modo S &gt;paciencia en banda  https://t.co/o57toRu2hw,es,[],[],['https://pbs.twimg.com/media/EPzlxCKU4AUpqYH.png'],1,0,0,[],[],https://twitter.com/Arthur_Canga/status/1224105835208544256,False,,1,https://pbs.twimg.com/media/EPzlxCKU4AUpqYH.png,,,,,,,[],,,,
1224105825884626945,1224105761904553987,2020-02-02 19:02:26 Venezuela Standard Time,2020-02-02,19:02:26,-0400,245892239,arthur_canga,Arturo Canga,,"OJO 2: Esta es la forma en la que YO salí del modo S, si hay alguien que le funcionó de otra forma pues bienvenido y que lo comparta, si no les funcionó pues ya no sabría que decirles",es,[],[],[],1,0,0,[],[],https://twitter.com/Arthur_Canga/status/1224105825884626945,False,,0,,,,,,,,[],,,,
1224105824001449984,1224105761904553987,2020-02-02 19:02:25 Venezuela Standard Time,2020-02-02,19:02:25,-0400,245892239,arthur_canga,Arturo Canga,,"OJO: No me hago responsable por daños a las computadoras, si no entiendes bien siempre puedes escribirme un DM o buscar en Google o Youtube sobre como instalar W10, hay bastantes guías",es,[],[],[],1,0,0,[],[],https://twitter.com/Arthur_Canga/status/1224105824001449984,False,,0,,,,,,,,[],,,,
1224105821803634688,1224105761904553987,2020-02-02 19:02:25 Venezuela Standard Time,2020-02-02,19:02:25,-0400,245892239,arthur_canga,Arturo Canga,,"Si bien ya avisé que esto no debería funcionar, nos facilitará el camino para salir del modo S.  Intentaré explicarlo lo más simple posible para la gente que no tiene dominio en la informática.",es,[],[],[],1,0,0,[],[],https://twitter.com/Arthur_Canga/status/1224105821803634688,False,,0,,,,,,,,[],,,,
1224105819979100165,1224105761904553987,2020-02-02 19:02:24 Venezuela Standard Time,2020-02-02,19:02:24,-0400,245892239,arthur_canga,Arturo Canga,,Sin embargo muchas veces suelen haber problemas con este método  Hay muchas soluciones posibles: desde instalar todas las actualizaciones posibles hasta actualizar la Microsoft Store. Yo vengo a ofrecer MI solución: drástica pero efectiva: reinstalar W10 a la versión más reciente,es,[],[],[],1,0,0,[],[],https://twitter.com/Arthur_Canga/status/1224105819979100165,False,,0,,,,,,,,[],,,,
1224105817089150977,1224105761904553987,2020-02-02 19:02:24 Venezuela Standard Time,2020-02-02,19:02:24,-0400,245892239,arthur_canga,Arturo Canga,,La forma estandar salir del modo S puede parecer sencilla: irnos a Configuración&gt;Actualización y Seguridad&gt;Activación y cuando bajemos nos encontraremos con un botón que nos lleva a un link de la Microsoft Store para cambiar de W10S a W10 Home (la versión estándar).  https://t.co/gWPuuCpM9X,es,[],[],['https://pbs.twimg.com/media/EPzlv09WoAMm_kS.png'],1,0,0,[],[],https://twitter.com/Arthur_Canga/status/1224105817089150977,False,,1,https://pbs.twimg.com/media/EPzlv09WoAMm_kS.png,,,,,,,[],,,,
1224105804854329345,1224105761904553987,2020-02-02 19:02:21 Venezuela Standard Time,2020-02-02,19:02:21,-0400,245892239,arthur_canga,Arturo Canga,,"Incluso si se les ocurriese instalar la versión LTSC (Long Term Service Channel, una versión de Windows 10 empresarial sin aplicaciones de Windows) vendría en modo S, causando un soft-brick (been there, done that)  https://t.co/bWNikUZG3I",es,[],[],['https://pbs.twimg.com/media/EPzlvO3WoAE1epM.jpg'],1,0,0,[],[],https://twitter.com/Arthur_Canga/status/1224105804854329345,False,,1,https://pbs.twimg.com/media/EPzlvO3WoAE1epM.jpg,,,,,,,[],,,,
1224105796402843649,1224105761904553987,2020-02-02 19:02:19 Venezuela Standard Time,2020-02-02,19:02:19,-0400,245892239,arthur_canga,Arturo Canga,,"La licencia de Windows 10 S viene integrada de fábrica y registrada al hardware, aparentemente  hay un sector del disco que almacena dicha información y hasta que no validemos nuestra salida por servidores oficiales estaremos atrapados; es decir: no sirve formatear.",es,[],[],[],1,0,0,[],[],https://twitter.com/Arthur_Canga/status/1224105796402843649,False,,0,,,,,,,,[],,,,
1224105794548981762,1224105761904553987,2020-02-02 19:02:18 Venezuela Standard Time,2020-02-02,19:02:18,-0400,245892239,arthur_canga,Arturo Canga,,"Esto significa: no podemos instalar ejecutables ni aplicaciones fuera de la Microsoft Store, y en dado caso de usar Microsoft Edge tendremos que usar Bing como buscador.  https://t.co/UJjwkZ9TbX",es,[],[],"['https://pbs.twimg.com/media/EPzlul8X4AE2OPv.png', 'https://pbs.twimg.com/media/EPzlumaU4AAp287.jpg', 'https://pbs.twimg.com/media/EPzlumEXkAAwhWB.jpg']",1,0,0,[],[],https://twitter.com/Arthur_Canga/status/1224105794548981762,False,,1,https://pbs.twimg.com/media/EPzlul8X4AE2OPv.png,,,,,,,[],,,,
1224105782700138496,1224105761904553987,2020-02-02 19:02:16 Venezuela Standard Time,2020-02-02,19:02:16,-0400,245892239,arthur_canga,Arturo Canga,,"Primero hay que entender que es el modo S y como funciona. Windows 10 S es una versión de Windows hecha para competir con el mercado de las Chromebooks donde todo programa, aplicación o servicio fuera de los de Microsoft estará bloqueado para su uso.  https://t.co/gnhHJRpDvx",es,[],[],"['https://pbs.twimg.com/media/EPzltcxUwAA9kqF.jpg', 'https://pbs.twimg.com/media/EPzltm0XUAAhj9N.jpg']",1,0,0,[],[],https://twitter.com/Arthur_Canga/status/1224105782700138496,False,,1,https://pbs.twimg.com/media/EPzltcxUwAA9kqF.jpg,,,,,,,[],,,,
