id,conversation_id,created_at,date,time,timezone,user_id,username,name,place,tweet,language,mentions,urls,photos,replies_count,retweets_count,likes_count,hashtags,cashtags,link,retweet,quote_url,video,thumbnail,near,geo,source,user_rt_id,user_rt,retweet_id,reply_to,retweet_date,translate,trans_src,trans_dest
1415540872519819265,1415540872519819265,2021-07-15 01:16:58 Venezuela Standard Time,2021-07-15,01:16:58,-0400,245892239,arthur_canga,Arturo Canga,,"Desde que estoy en la universidad he visto como los estudiantes eligen como líderes de literalmente lo que sea al que mejor destaca en ese área. Ej: Delegado = mejor estudiante. Dejen de relacionar el área de estudio con liderazgo, no son lo mismo y pueden ser peor de lo esperado",es,[],[],[],0,1,1,[],[],https://twitter.com/Arthur_Canga/status/1415540872519819265,False,,0,,,,,,,,[],,,,
1415322899121065986,1415322899121065986,2021-07-14 10:50:49 Venezuela Standard Time,2021-07-14,10:50:49,-0400,245892239,arthur_canga,Arturo Canga,,Me recuerda a cierto profesor estrella,es,[],[],[],0,0,1,[],[],https://twitter.com/Arthur_Canga/status/1415322899121065986,False,https://twitter.com/FitFounder/status/1415321209437396998,0,,,,,,,,[],,,,
1413939088898600964,1413939088898600964,2021-07-10 15:12:03 Venezuela Standard Time,2021-07-10,15:12:03,-0400,245892239,arthur_canga,Arturo Canga,,"El estrés de la universidad, junto con no poder salir, me ha estado consumiendo psicológicamente a niveles insoportables. Diariamente el 60% de mis pensamientos son existencialistas o de soledad.  Esto no es sano",es,[],[],[],0,0,4,[],[],https://twitter.com/Arthur_Canga/status/1413939088898600964,False,,0,,,,,,,,[],,,,
1413703455873683459,1413697693935878144,2021-07-09 23:35:43 Venezuela Standard Time,2021-07-09,23:35:43,-0400,245892239,arthur_canga,Arturo Canga,,"@untalsiso No mano, me pasa, es que estamos viejos",es,[],[],[],0,0,0,[],[],https://twitter.com/Arthur_Canga/status/1413703455873683459,False,,0,,,,,,,,"[{'screen_name': 'untalsiso', 'name': 'José Alexis Siso.', 'id': '95947259'}]",,,,
1408604684433211395,1408597971961327622,2021-06-25 21:55:02 Venezuela Standard Time,2021-06-25,21:55:02,-0400,245892239,arthur_canga,Arturo Canga,,"Ojo, no me refiero solo a nivel político. Lo he visto en cualquier contexto. Siempre que hay un problema con un déspota quieren negociar e ir por las buenas, así les escupan en la cara",es,[],[],[],0,0,1,[],[],https://twitter.com/Arthur_Canga/status/1408604684433211395,False,,0,,,,,,,,[],,,,
1408597971961327622,1408597971961327622,2021-06-25 21:28:21 Venezuela Standard Time,2021-06-25,21:28:21,-0400,245892239,arthur_canga,Arturo Canga,,"Las generaciones anteriores en Venezuela tiene el gran problema de que creen que cualquier cosa se puede resolver mediante una negociación.  Brother acabas de ver cómo patearon la mesa 4 veces seguidas y nos insultaron y quieres seguir negociando? O eres imbécil, o inútil o las 2",es,[],[],[],1,0,4,[],[],https://twitter.com/Arthur_Canga/status/1408597971961327622,False,,0,,,,,,,,[],,,,
1395106217060622341,1395106217060622341,2021-05-19 15:56:56 Venezuela Standard Time,2021-05-19,15:56:56,-0400,245892239,arthur_canga,Arturo Canga,,This is what heroin does to ppl,en,[],[],[],0,0,1,[],[],https://twitter.com/Arthur_Canga/status/1395106217060622341,False,https://twitter.com/estendenciavzl/status/1395074110594719744,0,,,,,,,,[],,,,
1390132487670702085,1390132471149301760,2021-05-05 22:33:07 Venezuela Standard Time,2021-05-05,22:33:07,-0400,245892239,arthur_canga,Arturo Canga,,"En lo que a mí respecta, no importa a qué TT nacional llegó el hashtag o las acciones del Consejo Universitario; la iniciativa fue un rotundo fracaso por estos comportamientos. En vez de buscar añadir a uno a la causa, lo alejaron más de lo que estaba.  Buenas noches.",es,[],[],[],0,0,2,[],[],https://twitter.com/Arthur_Canga/status/1390132487670702085,False,,0,,,,,,,,[],,,,
1390132485351215111,1390132471149301760,2021-05-05 22:33:06 Venezuela Standard Time,2021-05-05,22:33:06,-0400,245892239,arthur_canga,Arturo Canga,,"Felicito a los representantes estudiantiles que dieron respuestas incluyentes y respetuosas, pero como representantes también tienen que llamar al respeto de los demás miembros de la comunidad ucabista",es,[],[],[],1,0,1,[],[],https://twitter.com/Arthur_Canga/status/1390132485351215111,False,,0,,,,,,,,[],,,,
1390132479399432204,1390132471149301760,2021-05-05 22:33:05 Venezuela Standard Time,2021-05-05,22:33:05,-0400,245892239,arthur_canga,Arturo Canga,,"Bastante que dejan que desear antiguos representantes, tutores, figuras públicas y egresados de la UCAB Guayana de su comportamiento. Dejan bien alto los valores ucabistas atacando de la forma que lo han estado haciendo.",es,[],[],[],1,0,1,[],[],https://twitter.com/Arthur_Canga/status/1390132479399432204,False,,0,,,,,,,,[],,,,
1390132477583368193,1390132471149301760,2021-05-05 22:33:04 Venezuela Standard Time,2021-05-05,22:33:04,-0400,245892239,arthur_canga,Arturo Canga,,"...y dejen de hacer silencio sobre estas actitudes negativas, que es justamente uno de sus argumentos, pero en otro contexto. Comportamiento negativo debe ser reprochable de donde venga y en el contexto que sea.",es,[],[],[],1,0,0,[],[],https://twitter.com/Arthur_Canga/status/1390132477583368193,False,,0,,,,,,,,[],,,,
1390132474299109378,1390132471149301760,2021-05-05 22:33:03 Venezuela Standard Time,2021-05-05,22:33:03,-0400,245892239,arthur_canga,Arturo Canga,,"Si quieren ""dejar de hacerlo"" pues dejen de insultar para justificar su opinión; dejen de acosar no solo sexualmente, sino también de forma mediática; dejen de meter a grupos para ""dar fuerza"" a su argumento...",es,[],[],[],1,0,0,[],[],https://twitter.com/Arthur_Canga/status/1390132474299109378,False,,0,,,,,,,,[],,,,
1390132471149301760,1390132471149301760,2021-05-05 22:33:03 Venezuela Standard Time,2021-05-05,22:33:03,-0400,245892239,arthur_canga,Arturo Canga,,"Cada quien es libre de tener su propia opinión y cada quien es libre de defenderla. Pero insultar y meter a grupos que no tienen nada que ver no solo es bajo, sino que desprestigia la imagen de su movimiento o iniciativa.",es,[],[],[],1,1,2,[],[],https://twitter.com/Arthur_Canga/status/1390132471149301760,False,,0,,,,,,,,[],,,,
1390111441483714560,1390111441483714560,2021-05-05 21:09:29 Venezuela Standard Time,2021-05-05,21:09:29,-0400,245892239,arthur_canga,Arturo Canga,,"Generación Ucabista es una agrupación universitaria, no un órgano de la representación estudiantil, nuestro reglamento establece explícitamente que no tenemos intereses políticos.  Las opiniones de nuestros miembros no son la opinión de la agrupación",es,[],[],[],0,2,8,[],[],https://twitter.com/Arthur_Canga/status/1390111441483714560,False,https://twitter.com/camilaarrieta07/status/1390109714382475267,0,,,,,,,,[],,,,
1390103906366152704,1390103906366152704,2021-05-05 20:39:32 Venezuela Standard Time,2021-05-05,20:39:32,-0400,245892239,arthur_canga,Arturo Canga,,"El ""y tu que propones?"" tiene el efecto opuesto a su verdadero objetivo. Dejen de usarlo.",es,[],[],[],0,0,4,[],[],https://twitter.com/Arthur_Canga/status/1390103906366152704,False,,0,,,,,,,,[],,,,
1390096403893006337,1390096403893006337,2021-05-05 20:09:44 Venezuela Standard Time,2021-05-05,20:09:44,-0400,245892239,arthur_canga,Arturo Canga,,Creo que estoy presenciando el inicio de un efecto Barbra Streisand... y es hermoso...,es,[],[],[],0,0,0,[],[],https://twitter.com/Arthur_Canga/status/1390096403893006337,False,,0,,,,,,,,[],,,,
1388992999087132675,1388992999087132675,2021-05-02 19:05:11 Venezuela Standard Time,2021-05-02,19:05:11,-0400,245892239,arthur_canga,Arturo Canga,,"No soy fan de Bukele ni de lo que hace, pero que cerrada de boca más bella acabo de presenciar",es,[],[],[],0,0,0,[],[],https://twitter.com/Arthur_Canga/status/1388992999087132675,False,https://twitter.com/nayibbukele/status/1388977961290850306,0,,,,,,,,[],,,,
1386477434099359744,1386477434099359744,2021-04-25 20:29:14 Venezuela Standard Time,2021-04-25,20:29:14,-0400,245892239,arthur_canga,Arturo Canga,,"A horas de empezar el semestre, quiero decirles esto:  Cuando un profesor no les de clases o les de clases precarias, cuando m7 se caiga, cuando hayan problemas y la escuela hable de ""autonomía del profesor"", recuerden cuanto pagaron y recuerden por quienes votaron.",es,[],[],[],1,11,16,[],[],https://twitter.com/Arthur_Canga/status/1386477434099359744,False,,0,,,,,,,,[],,,,
1382519851353305091,1382519851353305091,2021-04-14 22:23:13 Venezuela Standard Time,2021-04-14,22:23:13,-0400,245892239,arthur_canga,Arturo Canga,,Me consta de primera mano que Cedeño es una persona honrada y honesta.  Vergüenza debería darle a las autoridades del caso pertenecer a la Facultad de Derecho y violar las leyes nacionales y los reglamentos universitarios. Arruinan la imagen de la UCAB más de lo que está,es,[],[],[],1,26,40,[],[],https://twitter.com/Arthur_Canga/status/1382519851353305091,False,https://twitter.com/jesuscedenojml/status/1382488418635112448,0,,,,,,,,[],,,,
1379557977124958208,1379557977124958208,2021-04-06 18:13:47 Venezuela Standard Time,2021-04-06,18:13:47,-0400,245892239,arthur_canga,Arturo Canga,,"Lo que más me molesta en un entorno de trabajo es que no comuniquen sus incomodidades. Nadie es adivino para saber que es lo que tienes o lo que te molesta, y comportamientos surgidos de esos sentimientos solo terminan intoxicando el ambiente",es,[],[],[],0,3,5,[],[],https://twitter.com/Arthur_Canga/status/1379557977124958208,False,,0,,,,,,,,[],,,,
1376416205930651650,1376415092607188992,2021-03-29 02:09:30 Venezuela Standard Time,2021-03-29,02:09:30,-0400,245892239,arthur_canga,Arturo Canga,,"@MeDicenYunta Se llaman ""alucinaciones"" y son un síntoma inicial de la esquizofrenia. De nada",es,[],[],[],1,0,0,[],[],https://twitter.com/Arthur_Canga/status/1376416205930651650,False,,0,,,,,,,,"[{'screen_name': 'MeDicenYunta', 'name': '𝒀 𝑼 𝑵 𝑻 𝑨', 'id': '1145900637042958337'}]",,,,
1375701906807480323,1375701906807480323,2021-03-27 02:51:08 Venezuela Standard Time,2021-03-27,02:51:08,-0400,245892239,arthur_canga,Arturo Canga,,"Es gracioso que cuando estaba en la USB no escuchaba a Canserbero, y no fue hasta que empecé a dudar de mi carrera que empecé a escucharlo activamente",es,[],[],[],0,0,0,[],[],https://twitter.com/Arthur_Canga/status/1375701906807480323,False,https://twitter.com/guarapita_R/status/1375542774494289926,0,,,,,,,,[],,,,
1375700984148725762,1375700984148725762,2021-03-27 02:47:28 Venezuela Standard Time,2021-03-27,02:47:28,-0400,245892239,arthur_canga,Arturo Canga,,Marico me gradué hace 7 años de bachiller... Maldita sea...,es,[],[],[],0,0,0,[],[],https://twitter.com/Arthur_Canga/status/1375700984148725762,False,https://twitter.com/mariabottle_/status/1375285076422914055,0,,,,,,,,[],,,,
1373091550792679426,1373091550792679426,2021-03-19 21:58:31 Venezuela Standard Time,2021-03-19,21:58:31,-0400,245892239,arthur_canga,Arturo Canga,,La gente que le gusta la lluvia dorada intentando justificarse:,es,[],[],[],0,0,3,[],[],https://twitter.com/Arthur_Canga/status/1373091550792679426,False,https://twitter.com/ChevalierRoldan/status/1372926282942533635,0,,,,,,,,[],,,,
1372603251816816653,1372589976706240514,2021-03-18 13:38:11 Venezuela Standard Time,2021-03-18,13:38:11,-0400,245892239,arthur_canga,Arturo Canga,,"@arcemiotico 7,02GB por aquí",es,[],[],[],0,0,0,[],[],https://twitter.com/Arthur_Canga/status/1372603251816816653,False,,0,,,,,,,,"[{'screen_name': 'arcemiotico', 'name': 'Mauricio | AKA Arcemiótico', 'id': '1123933431086428161'}]",,,,
1372363418259324936,1372362542404796426,2021-03-17 21:45:10 Venezuela Standard Time,2021-03-17,21:45:10,-0400,245892239,arthur_canga,Arturo Canga,,@abrahamapk Me entero que el contenido programático de la generación que votó por Chavez la criaron con Mozart y Sócrates,es,[],[],[],0,0,1,[],[],https://twitter.com/Arthur_Canga/status/1372363418259324936,False,,0,,,,,,,,[],,,,
1372363099219619840,1372363099219619840,2021-03-17 21:43:54 Venezuela Standard Time,2021-03-17,21:43:54,-0400,245892239,arthur_canga,Arturo Canga,,Ayer estaba realizando unas modificaciones al Discord de la agrupación con un amigo y nos enteramos de algo que cambió completamente nuestra perspectiva de la vida: 🔰es el símbolo japonés para principiante  No podré usar ese emoji de la misma forma que lo hacía antes...,es,[],[],[],0,0,3,[],[],https://twitter.com/Arthur_Canga/status/1372363099219619840,False,,0,,,,,,,,[],,,,
1366920546827579394,1366913786553245696,2021-03-02 21:17:09 Venezuela Standard Time,2021-03-02,21:17:09,-0400,245892239,arthur_canga,Arturo Canga,,"@MeDicenYunta Ah ta bien, ya se por que a veces tardas en contestar",es,[],[],[],1,0,0,[],[],https://twitter.com/Arthur_Canga/status/1366920546827579394,False,,0,,,,,,,,"[{'screen_name': 'MeDicenYunta', 'name': '𝒀 𝑼 𝑵 𝑻 𝑨', 'id': '1145900637042958337'}]",,,,
1366627683241779201,1366627683241779201,2021-03-02 01:53:25 Venezuela Standard Time,2021-03-02,01:53:25,-0400,245892239,arthur_canga,Arturo Canga,,Hola.  Vean Kaguya-sama: Love is War.  Adiós.,es,[],[],[],0,1,1,[],[],https://twitter.com/Arthur_Canga/status/1366627683241779201,False,,0,,,,,,,,[],,,,
1366601721699524613,1366601721699524613,2021-03-02 00:10:15 Venezuela Standard Time,2021-03-02,00:10:15,-0400,245892239,arthur_canga,Arturo Canga,,"Aquí la gente de mi carrera me va a funar, pero Algoritmos y Programación II, con José Saad.  La forma en que desarrollé mi pensamiento abstracto con estructuras de datos a día de hoy me impresiona. Esa materia es casi un ""Cracking the Coding Interview""",es,[],[],[],0,0,0,[],[],https://twitter.com/Arthur_Canga/status/1366601721699524613,False,https://twitter.com/datacampero/status/1366582380975304708,0,,,,,,,,[],,,,
1366188742474661888,1366188742474661888,2021-02-28 20:49:13 Venezuela Standard Time,2021-02-28,20:49:13,-0400,245892239,arthur_canga,Arturo Canga,,oh no  oh no  https://t.co/xZMc90cqhb,it,[],[],['https://pbs.twimg.com/media/EvWtZNqXYAIJ2NH.png'],1,1,3,[],[],https://twitter.com/Arthur_Canga/status/1366188742474661888,False,,1,https://pbs.twimg.com/media/EvWtZNqXYAIJ2NH.png,,,,,,,[],,,,
1366142589984997384,1366142589984997384,2021-02-28 17:45:49 Venezuela Standard Time,2021-02-28,17:45:49,-0400,245892239,arthur_canga,Arturo Canga,,"Llevo como 1 semana soñando vainas sobre un semestre semipresencial que transcurre de perlas y se convierte en el mejor semestre que he cursado. Cabe destacar que mis sueños siempre han sido muy ""Down to Earth""  También siempre son muy 🤡 y ahora tengo miedo",es,[],[],[],0,0,1,[],[],https://twitter.com/Arthur_Canga/status/1366142589984997384,False,,0,,,,,,,,[],,,,
1366138598500823045,1366138598500823045,2021-02-28 17:29:58 Venezuela Standard Time,2021-02-28,17:29:58,-0400,245892239,arthur_canga,Arturo Canga,,SASAGEYO SASAGEYO SHINZOU WO SASAGEYO,tl,[],[],[],0,0,0,[],[],https://twitter.com/Arthur_Canga/status/1366138598500823045,False,https://twitter.com/LuisCarlos/status/1365791067724001284,0,,,,,,,,[],,,,
1366137250770280448,1366137250770280448,2021-02-28 17:24:36 Venezuela Standard Time,2021-02-28,17:24:36,-0400,245892239,arthur_canga,Arturo Canga,,Recuerdo que ese año cursé verano de Matemáticas 3 y cada vez que salíamos de clases iba con unos amigos a los jardines de la USB a tumbar pumarrosas 😔,es,[],[],[],0,0,0,[],[],https://twitter.com/Arthur_Canga/status/1366137250770280448,False,https://twitter.com/JessGonzi/status/1366035967224782857,0,,,,,,,,[],,,,
1365355433448341517,1365355433448341517,2021-02-26 13:37:57 Venezuela Standard Time,2021-02-26,13:37:57,-0400,245892239,arthur_canga,Arturo Canga,,"Criticar a Biden por bombardear milicias iraníes en Siria cuando Trump bombardeó Siria empezando su gobierno y bombardeó el carro de Soleimani, es bien hipócrita.  Critiquen a su fanaticada por ser pacifistas hipócritas, a Biden se le puede criticar por muchas otras cosas",es,[],[],[],0,1,2,[],[],https://twitter.com/Arthur_Canga/status/1365355433448341517,False,,0,,,,,,,,[],,,,
1365354904873754627,1365286642886574082,2021-02-26 13:35:51 Venezuela Standard Time,2021-02-26,13:35:51,-0400,245892239,arthur_canga,Arturo Canga,,@anthxnyb_ Cosas que no ocurren en Terraria.  Cosas que sí ocurren en Terraria: perder los items porque se cayó el internet,es,[],[],[],0,0,0,[],[],https://twitter.com/Arthur_Canga/status/1365354904873754627,False,,0,,,,,,,,"[{'screen_name': 'anthxnyb_', 'name': 'anthony', 'id': '153953107'}]",,,,
1365352995903438854,1365352995903438854,2021-02-26 13:28:15 Venezuela Standard Time,2021-02-26,13:28:15,-0400,245892239,arthur_canga,Arturo Canga,,"Sin duda alguna Platinum: las mejoras técnicas necesarias viniendo de DP, la ambientación me parece perfecta, el misticismo de la región es palpable, fue un primer paso a las historias maduras de BW/B2W2 y DIOS SU POSTGAME.  Es por el que uno de mis sueños es visitar Hokkaido",es,[],[],[],0,0,1,[],[],https://twitter.com/Arthur_Canga/status/1365352995903438854,False,https://twitter.com/egamanww/status/1365332718117126145,0,,,,,,,,[],,,,
1364672380023558144,1364672380023558144,2021-02-24 16:23:44 Venezuela Standard Time,2021-02-24,16:23:44,-0400,245892239,arthur_canga,Arturo Canga,,Estoy trabajando mientras escucho soundtrack de The Witcher 3. Ahora quiero abandonar el trabajo para volver a matar unos cuantos ghouls,es,[],[],[],0,0,3,[],[],https://twitter.com/Arthur_Canga/status/1364672380023558144,False,,0,,,,,,,,[],,,,
1364624776002699274,1364623333384364041,2021-02-24 13:14:34 Venezuela Standard Time,2021-02-24,13:14:34,-0400,245892239,arthur_canga,Arturo Canga,,"@untalsiso Water Temple es 1000 veces más fácil que Zora's Domain, Arbiter's Ground y City in the Sky de TP.  Change my mind",es,[],[],[],1,0,1,[],[],https://twitter.com/Arthur_Canga/status/1364624776002699274,False,,0,,,,,,,,"[{'screen_name': 'untalsiso', 'name': 'José Alexis Siso.', 'id': '95947259'}]",,,,
1364484528509747203,1364484528509747203,2021-02-24 03:57:17 Venezuela Standard Time,2021-02-24,03:57:17,-0400,245892239,arthur_canga,Arturo Canga,,Un amigo se quedó dormido en la cama del perro en una reu. Hoy se llama Mascota,es,[],[],[],1,0,4,[],[],https://twitter.com/Arthur_Canga/status/1364484528509747203,False,https://twitter.com/DjMaRco77/status/1364359109441650688,0,,,,,,,,[],,,,
1364309322684071938,1364309322684071938,2021-02-23 16:21:04 Venezuela Standard Time,2021-02-23,16:21:04,-0400,245892239,arthur_canga,Arturo Canga,,Quiero una espada cuando me gradúe. Y NO ME IMPORTA SI ES PARA EL TÍTULO DE PREGRADO,es,[],[],[],0,0,1,[],[],https://twitter.com/Arthur_Canga/status/1364309322684071938,False,https://twitter.com/FrancesBoreham/status/1363862497204310025,0,,,,,,,,[],,,,
1364303433604431876,1364303433604431876,2021-02-23 15:57:40 Venezuela Standard Time,2021-02-23,15:57:40,-0400,245892239,arthur_canga,Arturo Canga,,Hoy fue la reunión de las autoridades rectorales con la representación estudiantil de la UCAB Guayana.  Estoy a la espera de los comunicados respectivos,es,[],[],[],0,0,2,[],[],https://twitter.com/Arthur_Canga/status/1364303433604431876,False,,0,,,,,,,,[],,,,
1363962839715749888,1363962839715749888,2021-02-22 17:24:16 Venezuela Standard Time,2021-02-22,17:24:16,-0400,245892239,arthur_canga,Arturo Canga,,"Este video identifica a todo estudiante de informática o ingeniero informático, siempre.  https://t.co/eOViYTI7EL",es,[],['https://youtu.be/k238XpMMn38'],[],0,0,0,[],[],https://twitter.com/Arthur_Canga/status/1363962839715749888,False,,0,,,,,,,,[],,,,
1363957712120348686,1363957712120348686,2021-02-22 17:03:54 Venezuela Standard Time,2021-02-22,17:03:54,-0400,245892239,arthur_canga,Arturo Canga,,Según la Real Academia Española. Autoritarismo. De autoritario e -ismo.  1. m. Actitud de quien ejerce con exceso su autoridad o abusa de ella.  https://t.co/w5roruTn2p,es,[],[],"['https://pbs.twimg.com/media/Eu2_iP1VIAQXt3x.png', 'https://pbs.twimg.com/media/Eu2_mYfXAAsuIRK.png']",2,2,5,[],[],https://twitter.com/Arthur_Canga/status/1363957712120348686,False,https://twitter.com/eseveipe/status/1363892870013464577,1,https://pbs.twimg.com/media/Eu2_iP1VIAQXt3x.png,,,,,,,[],,,,
1363956271171440641,1363956240674611204,2021-02-22 16:58:10 Venezuela Standard Time,2021-02-22,16:58:10,-0400,245892239,arthur_canga,Arturo Canga,,"en una materia que desarrollé un trastorno de sueño grave y crisis de ansiedad que me afectaron este semestre y que a día de hoy no he logrado controlar.  La excelencia académica no es exigencia y notas, es la forma en que se imparte el conocimiento.",es,[],[],[],0,0,1,[],[],https://twitter.com/Arthur_Canga/status/1363956271171440641,False,,0,,,,,,,,[],,,,
1363956269665701891,1363956240674611204,2021-02-22 16:58:10 Venezuela Standard Time,2021-02-22,16:58:10,-0400,245892239,arthur_canga,Arturo Canga,,"pagando una carrera para raspar en vano y que no se haga nada al respecto (y no solo en la UCAB, la gente del interior que estudia en la capital suele gastar casi lo mismo que una universidad privada solo para vivir). Yo tampoco soy inmune: el semestre pasado viví tanto estrés...",es,[],[],[],1,0,1,[],[],https://twitter.com/Arthur_Canga/status/1363956269665701891,False,,0,,,,,,,,[],,,,
1363956268273192960,1363956240674611204,2021-02-22 16:58:10 Venezuela Standard Time,2021-02-22,16:58:10,-0400,245892239,arthur_canga,Arturo Canga,,"Y también está el factor psicológico: no todo el mundo tiene la misma fortaleza mental, ni la misma capacidad económica, ni vive bajo las mismas condiciones. He presenciado como mucha gente ha desertado la carrera por daños psicológicos o porque no le parece viable seguir (...)",es,[],[],[],1,0,2,[],[],https://twitter.com/Arthur_Canga/status/1363956268273192960,False,,0,,,,,,,,[],,,,
1363956267002265602,1363956240674611204,2021-02-22 16:58:09 Venezuela Standard Time,2021-02-22,16:58:09,-0400,245892239,arthur_canga,Arturo Canga,,"Cuando todos los semestres el promedio académico de los estudiantes es tan bajo en una materia con un mismo profesor por más que la repitan, algo está fallando en el sistema, y casi seguro que los estudiantes no son 100% culpables",es,[],[],[],1,0,0,[],[],https://twitter.com/Arthur_Canga/status/1363956267002265602,False,,0,,,,,,,,[],,,,
1363956265739763715,1363956240674611204,2021-02-22 16:58:09 Venezuela Standard Time,2021-02-22,16:58:09,-0400,245892239,arthur_canga,Arturo Canga,,"El objetivo de un profesor debe ser impartir conocimiento y evaluar de manera justa e imparcial, motivando a los demás a interesarse en su área de estudio para formar estudiantes integrales y aprender juntos en el proceso. Las mejores universidades del mundo destacan por ello.",es,[],[],[],1,0,0,[],[],https://twitter.com/Arthur_Canga/status/1363956265739763715,False,,0,,,,,,,,[],,,,
1363956264028540929,1363956240674611204,2021-02-22 16:58:09 Venezuela Standard Time,2021-02-22,16:58:09,-0400,245892239,arthur_canga,Arturo Canga,,"Y saben que es lo peor? Es el único profesor de dos materias seguidas de una cadena, cualquier encuentro que tengas con él puede perjudicarte para el semestre siguiente.",es,[],[],[],1,0,0,[],[],https://twitter.com/Arthur_Canga/status/1363956264028540929,False,,0,,,,,,,,[],,,,
1363956262589915141,1363956240674611204,2021-02-22 16:58:08 Venezuela Standard Time,2021-02-22,16:58:08,-0400,245892239,arthur_canga,Arturo Canga,,"secretaría. AKA: Sin posibilidad de modificación o recuperación.  Y estas problemáticas son solo las que yo estoy al tanto, yo no se con lujo de detalles lo que pasó con cada estudiante. Pero sí me consta que la mayoría tuvo problemáticas con el profesor en esta materia",es,[],[],[],1,0,0,[],[],https://twitter.com/Arthur_Canga/status/1363956262589915141,False,,0,,,,,,,,[],,,,
1363956261327364098,1363956240674611204,2021-02-22 16:58:08 Venezuela Standard Time,2021-02-22,16:58:08,-0400,245892239,arthur_canga,Arturo Canga,,"que tanto les afecta personalmente. Hubo estudiantes que si se les hubiese dado retroalimentación efectiva, hubiesen aprobado. Se comunicó a la escuela la última problemática a tiempo y se solicitó una reunión que no tuvimos hasta la semana pasada con las notas cargadas en (...)",es,[],[],[],1,0,0,[],[],https://twitter.com/Arthur_Canga/status/1363956261327364098,False,,0,,,,,,,,[],,,,
1363956259569995776,1363956240674611204,2021-02-22 16:58:08 Venezuela Standard Time,2021-02-22,16:58:08,-0400,245892239,arthur_canga,Arturo Canga,,"Hubo estudiantes que aplazaron la materia y quisieron tener retroalimentación para cuando la vuelvan a ver y no la tuvieron, hubo aquellos que dieron su mejor esfuerzo y ahora están en riesgo de perder su beca, hubo estudiantes que bajaron su índice académico (...)",es,[],[],[],1,0,0,[],[],https://twitter.com/Arthur_Canga/status/1363956259569995776,False,,0,,,,,,,,[],,,,
1363956257699332097,1363956240674611204,2021-02-22 16:58:07 Venezuela Standard Time,2021-02-22,16:58:07,-0400,245892239,arthur_canga,Arturo Canga,,"Posteriormente, en las notas finales luego de presentar una queja a la escuela, corrigió la nota para otro estudiante del grupo con una nota mínima aprobatoria, quien fue el único que no había pasado y fue el que se comunicó con la escuela, invidualizando la nota nuevamente",es,[],[],[],1,0,0,[],[],https://twitter.com/Arthur_Canga/status/1363956257699332097,False,,0,,,,,,,,[],,,,
1363956256432660480,1363956240674611204,2021-02-22 16:58:07 Venezuela Standard Time,2021-02-22,16:58:07,-0400,245892239,arthur_canga,Arturo Canga,,"Es decir: individualizó una nota grupal, marginando al resto del grupo, con una excusa tan vaga como el haber pasado y minimizó el hecho de que un estudiante quiera tener un mejor rendimiento en una materia que de paso tiene una alta carga de créditos.",es,[],[],[],1,0,0,[],[],https://twitter.com/Arthur_Canga/status/1363956256432660480,False,,0,,,,,,,,[],,,,
