id,conversation_id,created_at,date,time,timezone,user_id,username,name,place,tweet,language,mentions,urls,photos,replies_count,retweets_count,likes_count,hashtags,cashtags,link,retweet,quote_url,video,thumbnail,near,geo,source,user_rt_id,user_rt,retweet_id,reply_to,retweet_date,translate,trans_src,trans_dest
1269444120986222593,1269444120986222593,2020-06-06 21:40:38 Venezuela Standard Time,2020-06-06,21:40:38,-0400,245892239,arthur_canga,Arturo Canga,,Habló un ancla de Clinton News Network. Recuerden que si no van a favor del establishment son trolls o la reencarnación de Hitler en su país,es,[],[],[],0,1,0,[],[],https://twitter.com/Arthur_Canga/status/1269444120986222593,False,https://twitter.com/oppenheimera/status/1269254648462008326,0,,,,,,,,[],,,,
1269114378844020738,1269114378844020738,2020-06-05 23:50:21 Venezuela Standard Time,2020-06-05,23:50:21,-0400,245892239,arthur_canga,Arturo Canga,,"Terminen de nukear este pais por favor, sale menos costoso y todo...",es,[],[],[],0,0,0,[],[],https://twitter.com/Arthur_Canga/status/1269114378844020738,False,https://twitter.com/weplash/status/1269058480821997569,0,,,,,,,,[],,,,
1269052007916191745,1269052007916191745,2020-06-05 19:42:31 Venezuela Standard Time,2020-06-05,19:42:31,-0400,245892239,arthur_canga,Arturo Canga,,"No vale, no es porque una cantidad abismal de personas que no cumplen con la distancia recomendada y en su gran mayoria no usan o no tienen mascarilla o no la usan correctamente estan juntos, tosiendo, tocandose, hablando y gritando, sin siquiera lavarse las manos. PAJUO.",es,[],[],[],0,0,0,[],[],https://twitter.com/Arthur_Canga/status/1269052007916191745,False,https://twitter.com/maibortpetit/status/1269051292292468741,0,,,,,,,,[],,,,
1269049626663018497,1269049626663018497,2020-06-05 19:33:03 Venezuela Standard Time,2020-06-05,19:33:03,-0400,245892239,arthur_canga,Arturo Canga,,.@FlagsMashupBot acaba de hacer la bandera del independentismo catalan,es,"[{'screen_name': 'flagsmashupbot', 'name': 'flags mashup bot', 'id': '1162495379574857731'}]",[],[],0,0,0,[],[],https://twitter.com/Arthur_Canga/status/1269049626663018497,False,https://twitter.com/FlagsMashupBot/status/1269046365792976897,0,,,,,,,,[],,,,
1269045458565058561,1269045445076156423,2020-06-05 19:16:29 Venezuela Standard Time,2020-06-05,19:16:29,-0400,245892239,arthur_canga,Arturo Canga,,"El gobierno tiene que tomar todo con calma (y lo esta haciendo), un paso en falso puede significar el fin de los EEUU y el mundo occidental como lo conocemos. Estamos viviendo el fin de la Guerra Fria que nunca acabo, Boris Yeltsin y Hu Jintao eran solo el armisticio.",es,[],[],[],0,0,0,[],[],https://twitter.com/Arthur_Canga/status/1269045458565058561,False,,0,,,,,,,,[],,,,
1269045456832692225,1269045445076156423,2020-06-05 19:16:29 Venezuela Standard Time,2020-06-05,19:16:29,-0400,245892239,arthur_canga,Arturo Canga,,"Si @realDonaldTrump gana, la investigacion del #OBAMAGATE sera tan grande que tendra que disolverse en partido democrata por la cantidad de presos (y muchos medios seran purgados). Es matar o ser matado para los democratas",es,"[{'screen_name': 'realdonaldtrump', 'name': 'donald j. trump', 'id': '25073877'}]",[],[],1,0,1,['obamagate'],[],https://twitter.com/Arthur_Canga/status/1269045456832692225,False,,0,,,,,,,,[],,,,
1269045455205392385,1269045445076156423,2020-06-05 19:16:28 Venezuela Standard Time,2020-06-05,19:16:28,-0400,245892239,arthur_canga,Arturo Canga,,"al oponerse estan forzando que estas personas voten al partido republicano. Es el mismo efecto del 2016: el bombardeo de informacion tergiversada fuerza a los neutrales a votar por la opcion que su sentido comun les manda, y no los medios",es,[],[],[],1,0,1,[],[],https://twitter.com/Arthur_Canga/status/1269045455205392385,False,,0,,,,,,,,[],,,,
1269045451128438785,1269045445076156423,2020-06-05 19:16:27 Venezuela Standard Time,2020-06-05,19:16:27,-0400,245892239,arthur_canga,Arturo Canga,,"Las protestas se les han ido de las manos, muchas personas estan manifestando su descontento con ellas porque son blancos usando el problema racial para justificar saqueos y alteracion del orden publico, muchos estan simpatizando con las fuerzas del orden y los medios (...)",es,[],[],[],1,0,0,[],[],https://twitter.com/Arthur_Canga/status/1269045451128438785,False,,0,,,,,,,,[],,,,
1269045449400426496,1269045445076156423,2020-06-05 19:16:27 Venezuela Standard Time,2020-06-05,19:16:27,-0400,245892239,arthur_canga,Arturo Canga,,"Los democratas estan desesperados, saben que Joe Biden no tiene ni plan, fuerza, psiquis ni capacidad de debate contra @realDonaldTrump. Si estas protestas no llegan a nada (que no llegaran) el descontento sera enorme: abstencion democrata y voto castigo contra los saqueadores",es,"[{'screen_name': 'realdonaldtrump', 'name': 'donald j. trump', 'id': '25073877'}]",[],[],1,0,0,[],[],https://twitter.com/Arthur_Canga/status/1269045449400426496,False,,0,,,,,,,,[],,,,
1269045447592730627,1269045445076156423,2020-06-05 19:16:27 Venezuela Standard Time,2020-06-05,19:16:27,-0400,245892239,arthur_canga,Arturo Canga,,"Como dice Dan Bogino: si no te gusta como el Presidente en su acto soberano usa sus poderes constitucionales en un estado de emergencia, hay solucion para eso: elecciones, y son en Noviembre.",es,[],[],[],1,0,0,[],[],https://twitter.com/Arthur_Canga/status/1269045447592730627,False,,0,,,,,,,,[],,,,
1268593825657819136,1268593825657819136,2020-06-04 13:21:52 Venezuela Standard Time,2020-06-04,13:21:52,-0400,245892239,arthur_canga,Arturo Canga,,"Solo piensen que asi como este hombre, hay cientos de personas que opinan igual. Y ademas muchos de ellos son negros.  En Noviembre, a los democratas se les habra salido el tiro por la culata, nuevamente",es,[],[],[],0,0,0,[],[],https://twitter.com/Arthur_Canga/status/1268593825657819136,False,https://twitter.com/Santi_ABASCAL/status/1268474370378301448,0,,,,,,,,[],,,,
1268422539145084930,1268241396617576450,2020-06-04 02:01:14 Venezuela Standard Time,2020-06-04,02:01:14,-0400,245892239,arthur_canga,Arturo Canga,,@LuisChataing  https://t.co/pSMf7gWLLm,und,[],[],['https://pbs.twimg.com/media/EZpXk6LXYAEA7ao.jpg'],0,0,0,[],[],https://twitter.com/Arthur_Canga/status/1268422539145084930,False,,1,https://pbs.twimg.com/media/EZpXk6LXYAEA7ao.jpg,,,,,,,[],,,,
1267557165444759552,1267557165444759552,2020-06-01 16:42:32 Venezuela Standard Time,2020-06-01,16:42:32,-0400,245892239,arthur_canga,Arturo Canga,,Los zurdos tienen una cara que corta cualquier material. Nawebona de hipócrita esta caraja,es,[],[],[],0,0,0,[],[],https://twitter.com/Arthur_Canga/status/1267557165444759552,False,https://twitter.com/HillaryClinton/status/1267469284869058563,0,,,,,,,,[],,,,
1267528230824747011,1267221302143864832,2020-06-01 14:47:34 Venezuela Standard Time,2020-06-01,14:47:34,-0400,245892239,arthur_canga,Arturo Canga,,"@untalsiso Necesito este video pero con ""No time for caution"" en mi vida",es,[],[],[],0,0,0,[],[],https://twitter.com/Arthur_Canga/status/1267528230824747011,False,,0,,,,,,,,"[{'screen_name': 'untalsiso', 'name': 'José Alexis Siso.', 'id': '95947259'}]",,,,
1267413498650341378,1267413498650341378,2020-06-01 07:11:40 Venezuela Standard Time,2020-06-01,07:11:40,-0400,245892239,arthur_canga,Arturo Canga,,Buenos dias. Todo este movimiento de protestas en EEUU son sencillamente el Partido Democrata intentando deponer a Trump a la fuerza ya que saben que Biden no podra en Noviembre y la reeleccion de Trump supondria la disolucion del partido debido a lo corrucion interna,es,[],[],[],0,3,0,[],[],https://twitter.com/Arthur_Canga/status/1267413498650341378,False,,0,,,,,,,,[],,,,
1267327154485972994,1267327154485972994,2020-06-01 01:28:34 Venezuela Standard Time,2020-06-01,01:28:34,-0400,245892239,arthur_canga,Arturo Canga,,"Voy a empezar a dar unfollow a cualquiera que de like o retweet a un hilo ""explicativo"" de las ""filtraciones"" del Anonymous chavista. No aguanto a la gente sin neuronas",es,[],[],[],0,0,0,[],[],https://twitter.com/Arthur_Canga/status/1267327154485972994,False,,0,,,,,,,,[],,,,
1267197159314784256,1267197159314784256,2020-05-31 16:52:00 Venezuela Standard Time,2020-05-31,16:52:00,-0400,245892239,arthur_canga,Arturo Canga,,Recuerdan cuando hace un tiempo el señor Godgiven Hair en su show cavernícola en un canal estatal de un estado fallido en LATAM dijo cuando las protestas en Chile que tarde o temprano la brisita bolivariana le llegaría a EEUU? Bueno mi nombre es Arturo Canga y en esta Ted Talk...,es,[],[],[],0,0,0,[],[],https://twitter.com/Arthur_Canga/status/1267197159314784256,False,,0,,,,,,,,[],,,,
1266998598362959873,1266998598362959873,2020-05-31 03:43:00 Venezuela Standard Time,2020-05-31,03:43:00,-0400,245892239,arthur_canga,Arturo Canga,,Pensamiento nocturno: y si Anonymous en realidad es un brazo especial y ultrasecreto de la CIA para operaciones web especiales y morales? Just sayin',es,[],[],[],0,0,0,[],[],https://twitter.com/Arthur_Canga/status/1266998598362959873,False,,0,,,,,,,,[],,,,
1266997686676393984,1266997686676393984,2020-05-31 03:39:22 Venezuela Standard Time,2020-05-31,03:39:22,-0400,245892239,arthur_canga,Arturo Canga,,"@jguaido @carlosvecchio no se si estarán claros, pero que ""Cállate"" sea N°16 en tendencias a estas horas y que todos los tweets en Venezuela sean respuestas dirigidas a ustedes no los deja muy bien parados",es,"[{'screen_name': 'carlosvecchio', 'name': 'carlos vecchio', 'id': '65728343'}]",[],[],0,0,0,[],[],https://twitter.com/Arthur_Canga/status/1266997686676393984,False,,0,,,,,,,,[],,,,
1266937964954660865,1266937964954660865,2020-05-30 23:42:04 Venezuela Standard Time,2020-05-30,23:42:04,-0400,245892239,arthur_canga,Arturo Canga,,"Mañana, el anuncio de la AN: ""Rechazamos lo que dijo Maduro. Gracias por su atencion""  Cinico cara e bola, ojala pronto te toque lo mismo que los que dices hacerles frente, cabron",es,[],[],[],0,0,0,[],[],https://twitter.com/Arthur_Canga/status/1266937964954660865,False,https://twitter.com/jguaido/status/1266910865401344000,0,,,,,,,,[],,,,
1266937132142202880,1266911123875520513,2020-05-30 23:38:45 Venezuela Standard Time,2020-05-30,23:38:45,-0400,245892239,arthur_canga,Arturo Canga,,"@ADemocratica Claro, como no olvidar cuando AD fusilo a su martir por ir en contra de los intereses zurdos de su sucio partido y no darle cargo a ninguno de ustedes, sino a gente realmente preparada. Hasta una ola de saqueo, dos golpes y un juicio les costo para sacarlo del poder",es,[],[],[],0,5,12,[],[],https://twitter.com/Arthur_Canga/status/1266937132142202880,False,,0,,,,,,,,"[{'screen_name': 'ADemocratica', 'name': 'Acción Democrática', 'id': '66448187'}]",,,,
1266936426018541568,1266925682753503232,2020-05-30 23:35:57 Venezuela Standard Time,2020-05-30,23:35:57,-0400,245892239,arthur_canga,Arturo Canga,,"@untalsiso Marico me corte con solo ver la cara de estos bichos, nawebona",es,[],[],[],0,0,1,[],[],https://twitter.com/Arthur_Canga/status/1266936426018541568,False,,0,,,,,,,,"[{'screen_name': 'untalsiso', 'name': 'José Alexis Siso.', 'id': '95947259'}]",,,,
1266889609595834368,1266889609595834368,2020-05-30 20:29:55 Venezuela Standard Time,2020-05-30,20:29:55,-0400,245892239,arthur_canga,Arturo Canga,,Miren Los Simpson volvieron a predecir el futuro... wait.......,es,[],[],[],0,0,0,[],[],https://twitter.com/Arthur_Canga/status/1266889609595834368,False,https://twitter.com/ChiguireBipolar/status/1266881989338107906,0,,,,,,,,[],,,,
1266888781677957120,1266887414464811008,2020-05-30 20:26:37 Venezuela Standard Time,2020-05-30,20:26:37,-0400,245892239,arthur_canga,Arturo Canga,,"@untalsiso Bueno mira entiendo tu punto, pero realmente @jguaido me puede mamar el guevo, a mi y a todo el pais",es,"[{'screen_name': 'jguaido', 'name': 'juan guaidó', 'id': '39176902'}]",[],[],1,0,0,[],[],https://twitter.com/Arthur_Canga/status/1266888781677957120,False,,0,,,,,,,,"[{'screen_name': 'untalsiso', 'name': 'José Alexis Siso.', 'id': '95947259'}]",,,,
1266888020600504327,1266888020600504327,2020-05-30 20:23:36 Venezuela Standard Time,2020-05-30,20:23:36,-0400,245892239,arthur_canga,Arturo Canga,,A estas alturas hay alguna duda sobre que todo lo que le paso a CAP en su segundo periodo fue orquestado por el propio AD por no ir con la linea del partido?,es,[],[],[],0,0,0,[],[],https://twitter.com/Arthur_Canga/status/1266888020600504327,False,https://twitter.com/PresidencialVE/status/1266874660530110464,0,,,,,,,,[],,,,
1266789413578833923,1266786206504947712,2020-05-30 13:51:46 Venezuela Standard Time,2020-05-30,13:51:46,-0400,245892239,arthur_canga,Arturo Canga,,@abrahamapk @untalsiso Loco te saltas 1000 años de exploración espacial y llegas a Andrómeda,es,[],[],[],0,0,0,[],[],https://twitter.com/Arthur_Canga/status/1266789413578833923,False,,0,,,,,,,,"[{'screen_name': 'untalsiso', 'name': 'José Alexis Siso.', 'id': '95947259'}]",,,,
1266557320504492036,1266557320504492036,2020-05-29 22:29:31 Venezuela Standard Time,2020-05-29,22:29:31,-0400,245892239,arthur_canga,Arturo Canga,,"Ups, el perro mordió la mano que le da de comer",es,[],[],[],0,0,0,[],[],https://twitter.com/Arthur_Canga/status/1266557320504492036,False,https://twitter.com/bennyjohnson/status/1266512404235661312,0,,,,,,,,[],,,,
1266553871037497344,1266553871037497344,2020-05-29 22:15:48 Venezuela Standard Time,2020-05-29,22:15:48,-0400,245892239,arthur_canga,Arturo Canga,,"El caracazo no fue espontáneo. Tampoco la escalada a velocidad luz de las protestas en EEUU.   El partido demócrata da sus patadas de ahogado, Trump queda reelecto y todo este caos creado, plus Obamagate, van a suponer graves penas a los autores.  Saben que Biden no podrá solo",es,[],[],[],0,0,0,[],[],https://twitter.com/Arthur_Canga/status/1266553871037497344,False,,0,,,,,,,,[],,,,
1266506456330907650,1266506456330907650,2020-05-29 19:07:24 Venezuela Standard Time,2020-05-29,19:07:24,-0400,245892239,arthur_canga,Arturo Canga,,"No simpatizo con Angela Merkel, pero me faltan manos para aplaudirle a esta mujer",es,[],[],[],0,0,1,[],[],https://twitter.com/Arthur_Canga/status/1266506456330907650,False,https://twitter.com/raul230280/status/1266287142134673408,0,,,,,,,,[],,,,
1266450421612187648,1266450421612187648,2020-05-29 15:24:44 Venezuela Standard Time,2020-05-29,15:24:44,-0400,245892239,arthur_canga,Arturo Canga,,"(Nawebona hoy estoy twitteando candela y debería estar estudiando ajsajskajsaksjajs, help me)",es,[],[],[],0,0,0,[],[],https://twitter.com/Arthur_Canga/status/1266450421612187648,False,,0,,,,,,,,[],,,,
1266449903229730818,1266449881314373632,2020-05-29 15:22:41 Venezuela Standard Time,2020-05-29,15:22:41,-0400,245892239,arthur_canga,Arturo Canga,,"Cuando la 2da red social más importante empieza a aplicar censura leve para impulsar una agenda política, hay un problema. Son medios privados pero su importancia les da responsabilidad social  El primer hashtag está mal escrito, desviando el contenido y evitando su visibilidad  https://t.co/mLVQg4JDhP",es,[],[],['https://pbs.twimg.com/media/EZNVdlqXkAkueyU.jpg'],0,0,0,[],[],https://twitter.com/Arthur_Canga/status/1266449903229730818,False,,1,https://pbs.twimg.com/media/EZNVdlqXkAkueyU.jpg,,,,,,,[],,,,
1266449881314373632,1266449881314373632,2020-05-29 15:22:35 Venezuela Standard Time,2020-05-29,15:22:35,-0400,245892239,arthur_canga,Arturo Canga,,"Also, don't forget #OBAMAGATE",en,[],[],[],1,0,0,['obamagate'],[],https://twitter.com/Arthur_Canga/status/1266449881314373632,False,,0,,,,,,,,[],,,,
1266446620960399361,1266446618854862849,2020-05-29 15:09:38 Venezuela Standard Time,2020-05-29,15:09:38,-0400,245892239,arthur_canga,Arturo Canga,,"Aun no empieza la campaña de verdad y ya me pregunto si Trump podrá ganarle a Biden ante todo este caos OBVIAMENTE INDUCIDO POR LA IZQUIERDA AMERICANA. I mean Biden es una mierda de candidato, pero Trump está tan confiado que si no se pone las pilas, va a perder",es,[],[],[],0,0,0,[],[],https://twitter.com/Arthur_Canga/status/1266446620960399361,False,,0,,,,,,,,[],,,,
1266446618854862849,1266446618854862849,2020-05-29 15:09:38 Venezuela Standard Time,2020-05-29,15:09:38,-0400,245892239,arthur_canga,Arturo Canga,,Creo que el gran problema de Trump es que el aparato propagandístico de los demócratas es mucho más poderoso y visceral que el republicano. Eso y que Trump solo está propagandeando vainas que menor importancia ante una triple crisis (COVID-Twitter-Minneapolis),es,[],[],[],1,0,0,[],[],https://twitter.com/Arthur_Canga/status/1266446618854862849,False,,0,,,,,,,,[],,,,
1266445012776206336,1266445012776206336,2020-05-29 15:03:15 Venezuela Standard Time,2020-05-29,15:03:15,-0400,245892239,arthur_canga,Arturo Canga,,"Resulta gracioso y deprimente que la gente se vuelca contra Trump por esto, pero en realidad la policía allá está controlada por condados y gobernaciones, en ambos casos son demócratas. Pero: ""Omg Trump is such a racist, how could he? worst president ever 😭😭😭""",es,[],[],[],0,1,1,[],[],https://twitter.com/Arthur_Canga/status/1266445012776206336,False,https://twitter.com/brauliojatarm/status/1266360725674565632,0,,,,,,,,[],,,,
1266443468387352576,1266443468387352576,2020-05-29 14:57:06 Venezuela Standard Time,2020-05-29,14:57:06,-0400,245892239,arthur_canga,Arturo Canga,,"Esto está MAL. La violencia aquí no está justificada, ni los saqueos, esto ya es vandalismo puro y duro  Pero los tankies y progres lo van a justificar y ""muhh trump amenazó con sacar a la guardia nazional si el gobernador no hace su trabajo, literally orange chavez"".  Mamenlo",es,[],[],[],0,1,0,[],[],https://twitter.com/Arthur_Canga/status/1266443468387352576,False,https://twitter.com/spiltcoco/status/1265941079767089152,0,,,,,,,,[],,,,
1266440232402116608,1266440232402116608,2020-05-29 14:44:15 Venezuela Standard Time,2020-05-29,14:44:15,-0400,245892239,arthur_canga,Arturo Canga,,"Le dije a Trump que no sabe usar Twitter y me bloqueó haciendo uso absoluto de su voluntad y de las herramientas de la plataforma, así que vengo a llorar aquí sobre como un presidente que no es de mi país me bloqueó por insultarlo al DM. Omg worst president ever 😭😭😭",es,[],[],[],0,2,1,[],[],https://twitter.com/Arthur_Canga/status/1266440232402116608,False,https://twitter.com/iancanwrite/status/1266275115240579072,0,,,,,,,,[],,,,
1266426120150429702,1266426120150429702,2020-05-29 13:48:10 Venezuela Standard Time,2020-05-29,13:48:10,-0400,245892239,arthur_canga,Arturo Canga,,"Un gran avance, pero no es suficiente",es,[],[],[],0,0,0,[],[],https://twitter.com/Arthur_Canga/status/1266426120150429702,False,https://twitter.com/AP/status/1266420193795997697,0,,,,,,,,[],,,,
1265515747968761858,1265515743774478336,2020-05-27 01:30:41 Venezuela Standard Time,2020-05-27,01:30:41,-0400,245892239,arthur_canga,Arturo Canga,,"Y con respecto a esa purga, mientras siga creciendo el descontento, más probabilidades hay de que se de por sí sola.  @jguaido debería tener miedo, porque parece que no sabe de lo que es capaz un pueblo hambriento, pisoteado y continuamente traicionado.",es,"[{'screen_name': 'jguaido', 'name': 'juan guaidó', 'id': '39176902'}]",[],[],0,0,0,[],[],https://twitter.com/Arthur_Canga/status/1265515747968761858,False,,0,,,,,,,,[],,,,
1265515746202918912,1265515743774478336,2020-05-27 01:30:40 Venezuela Standard Time,2020-05-27,01:30:40,-0400,245892239,arthur_canga,Arturo Canga,,"El descontento se siente a todos los niveles; llevo ya como 3 semanas escuchando diariamente la frase ""sáquenme de Venezuela por favor"" al menos 15 veces al día, nos sentimos condenados.  A veces parece que nuestra única salvación es una purga sangrienta contra los traidores...",es,[],[],[],1,0,0,[],[],https://twitter.com/Arthur_Canga/status/1265515746202918912,False,,0,,,,,,,,[],,,,
1265515745045348352,1265515743774478336,2020-05-27 01:30:40 Venezuela Standard Time,2020-05-27,01:30:40,-0400,245892239,arthur_canga,Arturo Canga,,"Y claro, los demás paises no se van a meter en un peo tan complejo (Cuba-China-Irán-Rusia-FARC-ELN-Hezbollah-HAMAS-Narcotráfico) sin tener la seguridad de que hay una facción con poder político que los va a respaldar ante todo lo necesario",es,[],[],[],1,0,0,[],[],https://twitter.com/Arthur_Canga/status/1265515745045348352,False,,0,,,,,,,,[],,,,
1265515743774478336,1265515743774478336,2020-05-27 01:30:40 Venezuela Standard Time,2020-05-27,01:30:40,-0400,245892239,arthur_canga,Arturo Canga,,"A veces pienso que el país está condenado. Tenemos una dirigencia ""opositora"" que se preocupa más en sus circos y sus propagandas twitteras. Y una derecha venezolana que a pesar de que proponen soluciones reales, no se si son idiotas o sencillamente no les interesa nada el país",es,[],[],[],1,0,0,[],[],https://twitter.com/Arthur_Canga/status/1265515743774478336,False,,0,,,,,,,,[],,,,
1265445340293070852,1265445340293070852,2020-05-26 20:50:54 Venezuela Standard Time,2020-05-26,20:50:54,-0400,245892239,arthur_canga,Arturo Canga,,Yoel: a Mi cerebro:,es,[],[],[],0,0,0,[],[],https://twitter.com/Arthur_Canga/status/1265445340293070852,False,https://twitter.com/CEINF_UCABG/status/1265412706837897219,0,,,,,,,,[],,,,
1265408180768722944,1265408180768722944,2020-05-26 18:23:15 Venezuela Standard Time,2020-05-26,18:23:15,-0400,245892239,arthur_canga,Arturo Canga,,Nunca me había sentido tan representado con un video del politigato,es,[],[],[],0,0,2,[],[],https://twitter.com/Arthur_Canga/status/1265408180768722944,False,https://twitter.com/GamerKevMo/status/1265359604558503936,0,,,,,,,,[],,,,
1264782446450683906,1264782446450683906,2020-05-25 00:56:48 Venezuela Standard Time,2020-05-25,00:56:48,-0400,245892239,arthur_canga,Arturo Canga,,"Que vaina más marginal y chaborra. Por qué una empresa PRIVADA tiene que regalar sus servicios a un país que no es lo suficientemente digno de sacar a su dictador y su oposición corrupta? No tiene que, punto.  Fuese el encargado de DTV y les digo de frente: coman mierda. Facilito",es,[],[],[],0,0,0,[],[],https://twitter.com/Arthur_Canga/status/1264782446450683906,False,https://twitter.com/Sinmordaza/status/1264680118406066176,0,,,,,,,,[],,,,
1264733024169721856,1264726532179791877,2020-05-24 21:40:25 Venezuela Standard Time,2020-05-24,21:40:25,-0400,245892239,arthur_canga,Arturo Canga,,@untalsiso NO MI PANA PRESTA ATENCION DIME POR QUE TE FUISTE DEL PAIS Y TE PROMETO QUE TE DARE 5 DOLARES MIENTRAS LOS DIPUTADOS QUE DEBATIMOS SOBRE LA CLOROFILA DE LAS MATAS DE MANGO NOS CUADRAMOS UN GUISO DE CINCO MIL DOLARES NO TE PREOCUPES EL VIDEO ES PARA PABLO IGLESIAS QUE ES BUENO,es,[],[],[],0,1,1,[],[],https://twitter.com/Arthur_Canga/status/1264733024169721856,False,,0,,,,,,,,"[{'screen_name': 'untalsiso', 'name': 'José Alexis Siso.', 'id': '95947259'}]",,,,
1264347265994502144,1264347265994502144,2020-05-23 20:07:33 Venezuela Standard Time,2020-05-23,20:07:33,-0400,245892239,arthur_canga,Arturo Canga,,"Este malnacido quiere que personas que están en situación de pobreza y exilio, que seguramente no tienen acceso a un puto celular para grabar un video, se humillen para tener ayuda.  Maldito ser de mierda. Ojalá te mueras tú y toda tu puta familia cagando sangre",es,[],[],[],0,1,1,[],[],https://twitter.com/Arthur_Canga/status/1264347265994502144,False,https://twitter.com/jguaido/status/1264283319723851776,0,,,,,,,,[],,,,
1264047340282920960,1264047340282920960,2020-05-23 00:15:45 Venezuela Standard Time,2020-05-23,00:15:45,-0400,245892239,arthur_canga,Arturo Canga,,"Me da risa que todas las personas que comparten esto son mujeres y todas en sus vidas pasadas vivieron en NY o Paris y se lanzan unas historias de muerte típicas de una novela juvenil.  Ta bien chamita, vuelve a Wattpad",es,[],[],[],0,0,0,[],[],https://twitter.com/Arthur_Canga/status/1264047340282920960,False,https://twitter.com/Franraraka/status/1263634715556397056,0,,,,,,,,[],,,,
1263705598115414016,1263705596639039489,2020-05-22 01:37:47 Venezuela Standard Time,2020-05-22,01:37:47,-0400,245892239,arthur_canga,Arturo Canga,,"Más allá del costo político que tiene dejarlos pasar o no y de la opinión mundial si los buques son inofensivos, la verdad es que: a) A EEUU les sabe a culo lo que carguen, no quieren otra crisis de los misiles b) Si Trump es un ególatra, su cargo importa más que nada",es,[],[],[],0,0,0,[],[],https://twitter.com/Arthur_Canga/status/1263705598115414016,False,,0,,,,,,,,[],,,,
1263705596639039489,1263705596639039489,2020-05-22 01:37:47 Venezuela Standard Time,2020-05-22,01:37:47,-0400,245892239,arthur_canga,Arturo Canga,,"Llevo días leyendo sobre los barcos iraníes y sobre si los van a detener o no. Lo único cierto es que los van a parar, no por Vzla, Irán o sanciones; sino porque en 6 meses son las elecciones en EEUU, y Trump no se va a arriesgar a perder por voto latino+republicanos radicales",es,[],[],[],1,0,1,[],[],https://twitter.com/Arthur_Canga/status/1263705596639039489,False,,0,,,,,,,,[],,,,
1262988556047454208,1262988556047454208,2020-05-20 02:08:31 Venezuela Standard Time,2020-05-20,02:08:31,-0400,245892239,arthur_canga,Arturo Canga,,"Esta es la prueba absoluta de que no queda honor en el país. Mientras en el 2002 FEDECÁMARAS y la CTV se atrevieron a lo imposible (y lo ilegal), hoy ven por encima del hombro.  Y los colegiados profesionales ni hablar...",es,[],[],[],0,2,0,[],[],https://twitter.com/Arthur_Canga/status/1262988556047454208,False,https://twitter.com/Arthur_Canga/status/1262987829745012736,0,,,,,,,,[],,,,
